,Unnamed: 0,Brand Name,Generic Name,Type of Treatment,Brief Description,Quantity,Location,Uninsured Cost,Typical Copay,Rating,Vendor,Effectiveness,Side Effects / Risk,Ingredients,Usage Overview,Conflicting Treatment/Therapies,Food Interaction,Frequency of Treatment,Estimated Percentage of Usage,Additional Information,Reference Link
0,0,isosorbide mononitrate,,,,,,,,,,,"abnormal heart sound;absence of or decrease in body movement;arm, back, or jaw pain;black, tarry stools;bladder pain;bleeding after defecation;bleeding gums;blood in the urine or stools;blurred vision;body aches or pain;burning while urinating;burning, crawling, itching, numbness, prickling, ""pins and needles"", or tingling feelings;chest pain or discomfort;chest tightness or heaviness;chills;cold sweats;colds;confusion;convulsions;cough or hoarseness;decreased urine;diarrhea;difficult or labored breathing;difficult, burning, or painful urination;dilated neck veins;dizziness;dizziness, faintness, or lightheadedness when getting up suddenly from a lying or sitting position;dry mouth;ear congestion;extra heartbeats;fainting;fast, slow, irregular, pounding, or racing heartbeat or pulse;fever or chills;flu-like symptoms;frequent urge to urinate;frequent urination;general feeling of discomfort or illness;headache;headache, severe and throbbing;heart murmur;increased need to urinate;increased sweating;increased thirst;increased volume of pale, dilute urine;irregular breathing;itching, pain, redness, or swelling on the leg;joint pain, stiffness, or swelling;lightheadedness;loss of appetite;loss of voice;lower back, side, or stomach pain;muscle aches and pains;muscle cramps;nasal congestion;nausea or vomiting;nervousness;numbness or tingling in the hands, feet, or lips;pain or discomfort in the arms, jaw, back, or neck;pain, tension, and weakness upon walking that subsides during periods of rest;partial or slight paralysis;passing urine more often;pinpoint red or purple spots on the skin;pounding in the ears;runny nose;shakiness in the legs, arms, hands, or feet;shivering;sneezing;sore on the leg;sore throat;sudden decrease in the amount of urine;sweating;swelling;swelling of the face, fingers, feet, or lower legs;tightness in the chest;trembling or shaking of the hands or feet;trouble sleeping;troubled breathing;uncomfortable swelling around the anus;unusual bleeding or bruising;unusual tiredness or weakness;vomiting of blood or material that looks like coffee grounds;weakness;weight gain;bluish-colored lips, fingernails, or palms;dark urine;pale skin;rapid heart rate;blurred or loss of vision;bulging soft spot on the head of an infant;change in consciousness;change in the ability to see colors, especially blue or yellow;cold, clammy skin;disturbed color perception;double vision;feeling of constant movement of self or surroundings;halos around lights;headache, severe and throbbing;loss of consciousness;night blindness;overbright appearance of lights;paralysis;sensation of spinning;tunnel vision;acid or sour stomach;anxiety;back pain;belching;blemishes on the skin;bloated;breast pain;burning feeling in the chest or stomach;burning, dry, or itching eyes;change in color vision;changes in vision;cold sweats;congestion;constipation;continuing ringing or buzzing or other unexplained noise in the ears;cough producing mucus;decreased interest in sexual intercourse;difficulty seeing at night;difficulty with moving;discharge, excessive tearing;double vision;drooping upper eyelids;dull ache or feeling of pressure or heaviness in the legs;earache;excess air or gas in the stomach or intestines;feeling of constant movement of self or surroundings;feeling of warmth;feeling unusually cold;frequent urge to defecate;frozen shoulder;full feeling;hearing loss;heartburn;hyperventilation;inability to have or keep an erection;increased appetite;increased sensitivity of the eyes to sunlight;increased sputum;indigestion;irritability;itching skin near damaged veins;lack or loss of strength;loss in sexual ability, desire, drive, or performance;muscle or bone pain;muscle stiffness or weakness;nightmares;noisy breathing;pain or tenderness around the eyes and cheekbones;passing gas;pimples;poor concentration;rash;redness of the face, neck, arms, and occasionally, upper chest;redness, pain, swelling of the eye, eyelid, or inner lining of the eyelid;redness, swelling, or soreness of the tongue;restlessness;seeing double;sensation of spinning;sleepiness or unusual drowsiness;small clicking, bubbling, or rattling sounds in the lung when listening with a stethoscope;small lumps under the skin;sore mouth or tongue;stiff neck;stomach bloating, burning, cramping, or pain;stomach discomfort or upset;straining while passing stool;stuffy nose;sudden sweating;swollen feet and ankles;tender, swollen glands in the neck;tenderness in the stomach area;terrifying dreams causing sleep disturbances;tooth disorder;trouble swallowing;uncontrolled twisting movements of the neck;voice changes;weight loss;white patches in the mouth,  tongue, or throat",,,,,,,,
1,1,Imdur,,,,,,,,,,,"abnormal heart sound;absence of or decrease in body movement;arm, back, or jaw pain;black, tarry stools;bladder pain;bleeding after defecation;bleeding gums;blood in the urine or stools;blurred vision;body aches or pain;burning while urinating;burning, crawling, itching, numbness, prickling, ""pins and needles"", or tingling feelings;chest pain or discomfort;chest tightness or heaviness;chills;cold sweats;colds;confusion;convulsions;cough or hoarseness;decreased urine;diarrhea;difficult or labored breathing;difficult, burning, or painful urination;dilated neck veins;dizziness;dizziness, faintness, or lightheadedness when getting up suddenly from a lying or sitting position;dry mouth;ear congestion;extra heartbeats;fainting;fast, slow, irregular, pounding, or racing heartbeat or pulse;fever or chills;flu-like symptoms;frequent urge to urinate;frequent urination;general feeling of discomfort or illness;headache;headache, severe and throbbing;heart murmur;increased need to urinate;increased sweating;increased thirst;increased volume of pale, dilute urine;irregular breathing;itching, pain, redness, or swelling on the leg;joint pain, stiffness, or swelling;lightheadedness;loss of appetite;loss of voice;lower back, side, or stomach pain;muscle aches and pains;muscle cramps;nasal congestion;nausea or vomiting;nervousness;numbness or tingling in the hands, feet, or lips;pain or discomfort in the arms, jaw, back, or neck;pain, tension, and weakness upon walking that subsides during periods of rest;partial or slight paralysis;passing urine more often;pinpoint red or purple spots on the skin;pounding in the ears;runny nose;shakiness in the legs, arms, hands, or feet;shivering;sneezing;sore on the leg;sore throat;sudden decrease in the amount of urine;sweating;swelling;swelling of the face, fingers, feet, or lower legs;tightness in the chest;trembling or shaking of the hands or feet;trouble sleeping;troubled breathing;uncomfortable swelling around the anus;unusual bleeding or bruising;unusual tiredness or weakness;vomiting of blood or material that looks like coffee grounds;weakness;weight gain;bluish-colored lips, fingernails, or palms;dark urine;pale skin;rapid heart rate;blurred or loss of vision;bulging soft spot on the head of an infant;change in consciousness;change in the ability to see colors, especially blue or yellow;cold, clammy skin;disturbed color perception;double vision;feeling of constant movement of self or surroundings;halos around lights;headache, severe and throbbing;loss of consciousness;night blindness;overbright appearance of lights;paralysis;sensation of spinning;tunnel vision;acid or sour stomach;anxiety;back pain;belching;blemishes on the skin;bloated;breast pain;burning feeling in the chest or stomach;burning, dry, or itching eyes;change in color vision;changes in vision;cold sweats;congestion;constipation;continuing ringing or buzzing or other unexplained noise in the ears;cough producing mucus;decreased interest in sexual intercourse;difficulty seeing at night;difficulty with moving;discharge, excessive tearing;double vision;drooping upper eyelids;dull ache or feeling of pressure or heaviness in the legs;earache;excess air or gas in the stomach or intestines;feeling of constant movement of self or surroundings;feeling of warmth;feeling unusually cold;frequent urge to defecate;frozen shoulder;full feeling;hearing loss;heartburn;hyperventilation;inability to have or keep an erection;increased appetite;increased sensitivity of the eyes to sunlight;increased sputum;indigestion;irritability;itching skin near damaged veins;lack or loss of strength;loss in sexual ability, desire, drive, or performance;muscle or bone pain;muscle stiffness or weakness;nightmares;noisy breathing;pain or tenderness around the eyes and cheekbones;passing gas;pimples;poor concentration;rash;redness of the face, neck, arms, and occasionally, upper chest;redness, pain, swelling of the eye, eyelid, or inner lining of the eyelid;redness, swelling, or soreness of the tongue;restlessness;seeing double;sensation of spinning;sleepiness or unusual drowsiness;small clicking, bubbling, or rattling sounds in the lung when listening with a stethoscope;small lumps under the skin;sore mouth or tongue;stiff neck;stomach bloating, burning, cramping, or pain;stomach discomfort or upset;straining while passing stool;stuffy nose;sudden sweating;swollen feet and ankles;tender, swollen glands in the neck;tenderness in the stomach area;terrifying dreams causing sleep disturbances;tooth disorder;trouble swallowing;uncontrolled twisting movements of the neck;voice changes;weight loss;white patches in the mouth,  tongue, or throat",,,,,,,,
2,2,Isordil,,,,,,,,,,,"bluish-colored lips, fingernails, or palms;dark urine;difficulty with breathing;dizziness or lightheadedness;fever;headache;pale skin;rapid heart rate;sore throat;unusual bleeding or bruising;unusual tiredness or weakness;arm, back, or jaw pain;blurred vision;chest pain or discomfort;chest tightness or heaviness;confusion;dizziness, faintness, or lightheadedness when getting up suddenly from a lying or sitting position;fainting;fast or irregular heartbeat;sweating;blurred or loss of vision;bulging soft spot on the head of an infant;change in consciousness;change in the ability to see colors, especially blue or yellow;cold, clammy skin;convulsions;disturbed color perception;double vision;fast, irregular, pounding, or racing heartbeat or pulse;feeling of constant movement of self or surroundings;halos around lights;headache, severe and throbbing;increased sweating;loss of appetite;loss of consciousness;nausea;night blindness;overbright appearance of lights;paralysis;sensation of spinning;slow heartbeat;tunnel vision;vomiting",,,,,,,,
3,3,aspirin,,,,,,,,,,,"abdominal or stomach pain, cramping, or burning;black, tarry stools;bloody or cloudy urine;change in consciousness;chest pain or discomfort;confusion;constipation;convulsions, severe or continuing;dark urine;decreased frequency or amount of urine;diarrhea;difficult breathing;drowsiness;fainting;fast breathing;feeling that something terrible will happen;fever;general tiredness and weakness;greatly decreased frequency of urination or amount of urine;headache;heartburn;increased thirst;indigestion;irregular heartbeat;light-colored stools;loss of appetite;loss of consciousness;lower back or side pain;muscle cramping and weakness;muscle tremors;nausea or vomiting;nervousness;numbness or tingling in the hands, feet, or lips;panic;rapid, deep breathing;restlessness;seizures;skin rash;stomach cramps;swelling of the face, fingers, or lower legs;unusual bleeding or bruising;unusual tiredness or weakness;upper right abdominal or stomach;vomiting of blood or material that looks like coffee grounds;weakness or heaviness of the legs;weight gain;yellow eyes and skin;acid or sour stomach;anxiety;belching;dizziness;dry mouth;hyperventilation;irritability;shaking;stomach discomfort, upset, or pain;trouble sleeping;unusual drowsiness, dullness, tiredness, weakness, or feeling of sluggishness;or",,,,,,,,
4,4,Metoprolol Succinate ER,,,,,,,,,,,"blurred vision;chest pain or discomfort;confusion;dizziness, faintness, or lightheadedness when getting up suddenly from a lying or sitting position;shortness of breath;slow or irregular heartbeat;sweating;unusual tiredness or weakness;bloating or swelling of the face, arms, hands, lower legs, or feet;cough;decreased urine output;difficult or labored breathing;difficulty with speaking;dilated neck veins;disturbed color perception;double vision;extreme fatigue;fast, pounding, or racing heartbeat or pulse;halos around lights;headache;inability to move the arms, legs, or facial muscles;inability to speak;irregular breathing;loss of vision;night blindness;noisy breathing;overbright appearance of lights;pain, tension, and weakness upon walking that subsides during periods of rest;paleness or cold feeling in the fingertips and toes;rapid weight gain;seeing, hearing, or feeling things that are not there;short-term memory loss;slow speech;swelling of the face, fingers, feet, or lower legs;tightness in the chest;tingling of the hands or feet;tingling or pain in the fingers or toes when exposed to cold;troubled breathing;tunnel vision;unusual weight gain or loss;bluish color skin of the fingers or toes;chills;clay-colored stools;continuing loss of appetite;continuing or severe abdominal or stomach pain;continuing or severe nausea and vomiting;dark urine;difficulty with moving;fever;general tiredness and weakness;hoarseness;increased frequency of urination;itching skin;light-colored stools;lower back or side pain;muscle pain or stiffness;numbness of the fingers or toes;pain, swelling, or redness in the joints;rash;sore throat;sores, ulcers, or white spots on the lips or in the mouth;unpleasant breath odor;unusual bleeding or bruising;upper right abdominal or stomach pain;vomiting of blood;weakness;yellow eyes and skin;black, tarry stools;bleeding gums;blood in the urine or stools;burning, crawling, itching, numbness, prickling, ""pins and needles"", or tingling feelings;cool, sweaty skin;pinpoint red spots on the skin;bluish color of the fingernails, lips, skin, palms, or nail beds;change in consciousness;loss of consciousness;no blood pressure or pulse;stopping of heart;unconsciousness;very drowsy or sleepy;belching;bloated;decreased interest in sexual intercourse;difficulty having a bowel movement (stool);discouragement;dry mouth;excess air or gas in stomach or intestines;feeling of constant movement of self or surroundings;feeling of indigestion;feeling sad or empty;full feeling;inability to have or keep an erection;irritability;loss in sexual ability, desire, drive, or performance;loss of interest or pleasure;nightmares;pain in the chest below the breastbone;passing gas;redness or other discoloration of the skin;runny nose;sensation of spinning;sneezing;stuffy nose;tiredness;trouble concentrating;trouble sleeping;bone pain;continuing ringing or buzzing or other unexplained noise in the ears;dry eyes;hair loss or thinning of the hair;hearing loss;increased sensitivity of the skin to sunlight;pain of penis on erection;severe sunburn;change in taste or bad, unusual, or unpleasant (after) taste;fear or nervousness;hives or welts;or",,,,,,,,
5,5,Nitrostat,,,,,,,,,,,"bloating or swelling of the face, arms, hands, lower legs, or feet;burning, crawling, itching, numbness, prickling, ""pins and needles"", or tingling feelings;difficult or labored breathing;feeling faint, dizzy, or lightheadedness;feeling of warmth or heat;flushing or redness of the skin, especially on the face and neck;headache;rapid weight gain;sweating;tightness in the chest;tingling of the hands or feet;unusual weight gain or loss;bluish-colored lips, fingernails, or palms;dark urine;fever;pale skin;rapid heart rate;sore throat;unusual bleeding or bruising;unusual tiredness or weakness;arm, back, or jaw pain;blurred vision;chest pain or discomfort;chest tightness or heaviness;confusion;cough;cracks in the skin;difficulty with swallowing;dizziness, faintness, or lightheadedness when getting up suddenly from a lying or sitting position;fainting;fast, irregular, pounding, or racing heartbeat or pulse;feeling of constant movement of self or surroundings;feeling of warmth;hives, itching, or rash;increased sweating;loss of heat from the body;nausea or vomiting;puffiness or swelling of the eyelids or around the eyes, face, lips, or tongue;red, swollen skin;redness of the face, neck, arms, and occasionally, upper chest;scaly skin;sensation of spinning;weakness;bluish-colored lips, fingernails, or palms;blurred or loss of vision;bulging soft spot on the head of an infant;change in consciousness;change in the ability to see colors, especially blue or yellow;cold, clammy skin;dark urine;difficulty breathing;disturbed color perception;dizziness or lightheadedness;double vision;fever;flushed skin;halos around lights;headache, severe and throbbing;increased sweating;loss of appetite;loss of consciousness;night blindness;overbright appearance of lights;pale skin;paralysis;slow or irregular heartbeat;sore throat;tunnel vision;unusual bleeding or bruising;unusual tiredness or weakness;abdominal or stomach pain;body aches or pain;congestion;hoarseness;lack or loss of strength;runny nose;sneezing;stuffy nose;tender, swollen glands in the neck;voice changes;or",,,,,,,,
6,6,Adalat,,,,,,,,,,,"bloating or swelling of the face, arms, hands, lower legs, or feet;cough;difficult or labored breathing;dizziness or lightheadedness;fast, irregular, pounding, or racing heartbeat or pulse;feeling of warmth;headache;muscle cramps;rapid weight gain;shakiness in the legs, arms, hands, or feet;shortness of breath;tightness in the chest;tingling of the hands or feet;trembling or shaking of the hands or feet;unusual weight gain or loss;weakness;wheezing;blue lips and fingernails;chest congestion;chest pain;chills;coughing that sometimes produces a pink frothy sputum;decreased urine output;difficult, fast, or noisy breathing, sometimes with wheezing;dilated neck veins;extreme fatigue;fever;increased sweating;irregular breathing;nausea;pain or discomfort in the arms, jaw, back, or neck;pale skin;severe unusual tiredness or weakness;sweating;troubled breathing;vomiting;black, tarry stools;bleeding gums;blood in the eyes;blood in the urine or stools;bloody stools;bluish color;blurred vision;body aches or pain;changes in skin color;cold sweats;dark urine;difficulty with swallowing;dizziness, faintness, or lightheadedness when getting up suddenly from a lying or sitting position;dry mouth;dryness or soreness of throat;ear congestion or pain;extra heartbeats;eye pain;feeling unusually cold;general tiredness and weakness;headache, severe and throbbing;hoarseness;increased urge to urinate during the night;irritation in the mouth;itching;large, hive-like swelling on face, eyelids, lips, tongue, throat, hands, legs, feet, or sex organs;light-colored stools;nasal congestion;neck pain;nervousness;no blood pressure or pulse;noisy breathing;pain;pain in the groin or genitals;pain or burning while urinating;painful or difficult urination;pinpoint red spots on the skin;puffiness or swelling of the eyelids or around the eyes, face, lips, or tongue;redness and swelling of the gums;redness in the whites of the eyes;runny nose;shakiness and unsteady walk;sharp back pain just below ribs;shivering;skin rash;small clicking, bubbling, or rattling sounds in the lung when listening with a stethoscope;sneezing;sore throat;sores, ulcers, or white spots on the lips or in the mouth;stopping of heart;swelling around the eyes;swollen glands;tenderness;tender, swollen glands in the neck;troubled breathing with exertion;unconsciousness;unsteadiness, trembling, or other problems with muscle control or coordination;unusual bleeding or bruising;upper right abdominal or stomach pain;vision changes;voice changes;vomiting of blood or material that looks like coffee grounds;waking to urinate at night;yellow eyes and skin;belching;feeling of indigestion;mood changes;pain in the chest below the breastbone;redness of the face, neck, arms, and occasionally, upper chest;abnormal ejaculation;bloody nose;burning, crawling, itching, numbness, prickling, ""pins and needles"", or tingling feelings;decreased interest in sexual intercourse;decreased sexual performance or desire;diarrhea;difficulty having a bowel movement (stool);excess air or gas in stomach or intestines;feeling of constant movement of self or surroundings;full feeling;general feeling of discomfort or illness;inability to have or keep an erection;increased need to urinate;joint stiffness;leg cramps or pain;loss in sexual ability, desire, drive, or performance;nervousness;passing gas;passing urine more often;sneezing;stuffy nose;trouble sleeping;acid or sour stomach;ankle, knee, or great toe joint pain;cracks in the skin;difficulty with moving;discouragement;excessive muscle tone;fear or nervousness;feeling sad or empty;hair loss or thinning of the hair;heartburn;increased sensitivity of the skin to sunlight;irritability;itching, pain, redness, swelling, tenderness, or warmth on the skin;lack of appetite;lack or loss of strength;loss of heat from the body;loss of interest or pleasure;loss of strength or energy;loss in sexual ability, desire, drive, or performance;lower back or side pain;muscle pain or weakness;muscle stiffness;muscle tension or tightness;pain or burning in the throat;red, swollen skin;redness or other discoloration of the skin;scaly skin;severe sunburn;sleepiness or unusual drowsiness;sleeplessness;stomach discomfort, upset, or pain;swelling of the breasts or breast soreness in both females and males;tiredness;trouble concentrating;unable to sleep;or",,,,,,,,
7,7,Bayer Aspirin,,,,,,,,,,,"abdominal or stomach pain, cramping, or burning;black, tarry stools;bloody or cloudy urine;change in consciousness;chest pain or discomfort;confusion;constipation;convulsions, severe or continuing;dark urine;decreased frequency or amount of urine;diarrhea;difficult breathing;drowsiness;fainting;fast breathing;feeling that something terrible will happen;fever;general tiredness and weakness;greatly decreased frequency of urination or amount of urine;headache;heartburn;increased thirst;indigestion;irregular heartbeat;light-colored stools;loss of appetite;loss of consciousness;lower back or side pain;muscle cramping and weakness;muscle tremors;nausea or vomiting;nervousness;numbness or tingling in the hands, feet, or lips;panic;rapid, deep breathing;restlessness;seizures;skin rash;stomach cramps;swelling of the face, fingers, or lower legs;unusual bleeding or bruising;unusual tiredness or weakness;upper right abdominal or stomach;vomiting of blood or material that looks like coffee grounds;weakness or heaviness of the legs;weight gain;yellow eyes and skin;acid or sour stomach;anxiety;belching;dizziness;dry mouth;hyperventilation;irritability;shaking;stomach discomfort, upset, or pain;trouble sleeping;unusual drowsiness, dullness, tiredness, weakness, or feeling of sluggishness;or",,,,,,,,
