26,26,Biocef,,,,,,,,,,,"diarrhea;abdominal or stomach pain;blistering, peeling, or loosening of the skin;chills;clay-colored stools;cough;dark urine;diarrhea;dizziness;fever;general tiredness and weakness;headache;itching or rash;joint or muscle pain;light-colored stools;loss of appetite;nausea and vomiting;red skin lesions, often with a purple center;red, irritated eyes;sore throat;sores, ulcers, or white spots in the mouth or on the lips;unpleasant breath odor;unusual tiredness or weakness;upper right abdominal or stomach pain;vomiting of blood;yellow eyes or skin;abdominal or stomach cramps or tenderness;back or leg pains;black, tarry stools;bleeding gums;bloating;blood in the urine or stools;chest pain;coughing up blood;diarrhea, watery and severe, which may also be bloody;difficulty with breathing or swallowing;fast heartbeat;general body swelling;hives;increased menstrual flow or vaginal bleeding;increased thirst;large, hive-like swelling on the face, eyelids, lips, tongue, throat, hands, legs, feet, or sex organs;loss of appetite;nosebleeds;pain;painful or difficult urination;pale skin;paralysis;pinpoint red spots on the skin;prolonged bleeding from cuts;puffiness or swelling of the eyelids or around the eyes, face, lips, or tongue;red or black, tarry stools;red or dark brown urine;swollen or painful glands;tightness in the chest;unusual bleeding or bruising;unusual weight loss;watery or bloody diarrhea;acid or sour stomach;anxiety;belching;burning feeling in the chest or stomach;difficulty with moving;dry mouth;heartburn;hyperventilation;indigestion;irregular heartbeats;irritability;itching of the vagina or genital area;muscle pain or stiffness;nervousness;pain during sexual intercourse;pain, swelling, or redness in the joints;redness of the skin;restlessness;seeing, hearing, or feeling things that are not there;shaking;stomach upset;trouble sleeping;white or brownish vaginal discharge;or",,,,,,,,
27,27,cefpodoxime,,,,,,,,,,,"diarrhea;loose stools;change in the color, amount, or odor of vaginal discharge;abdominal or stomach cramps or tenderness;black, tarry stools;bladder pain;bleeding gums;bloating or swelling of the face, arms, hands, lower legs, or feet;bloody nose;bloody or cloudy urine;blurred vision;burning while urinating;chest pain;collection of blood under the skin;confusion;continuing ringing or buzzing or other unexplained noise in the ears;cough or hoarseness;cough producing mucus;dark urine;decreased urination;decreased urine output;deep, dark purple bruise;diarrhea, watery and severe, which may also be bloody;difficult or labored breathing;difficult, burning, or painful urination;difficulty with breathing or troubled breathing;dilated neck veins;dizziness;dizziness, faintness, or lightheadedness when getting up suddenly from a lying or sitting position;dry mouth;extreme fatigue;fainting;fast, irregular, pounding, or racing heartbeat or pulse;feeling of warmth or heat;fever or chills;flushing or redness of the skin, especially on the face and neck;frequent urge to urinate;general body swelling;headache;hearing loss;heavier menstrual periods;increase in heart rate;increased thirst;increased urge to urinate during the night;increased weight;irregular breathing;irregular heartbeat;itching of the vagina or genital area;itching, pain, redness, or swelling;loss of appetite;lower back or side pain;nausea or vomiting;nervousness;noisy breathing;nosebleeds;pain;pain during sexual intercourse;pain or swelling of the treated skin;pain or tenderness around the eyes and cheekbones;pain, warmth, or burning in the fingers, toes, and legs;pale skin;pinpoint red spots on the skin;pounding in the ears;problems with vision or hearing;rapid breathing;rapid weight gain;runny nose;shortness of breath or troubled breathing;skin rash;slow or fast heartbeat;sneezing;sore throat;sores, ulcers, or white spots on the lips or in the mouth;stuffy or runny nose;sunken eyes;sweating;swelling of the face, fingers, feet, or lower legs;swelling or puffiness of the face;swollen glands;thick, white vaginal discharge with no odor or with a mild odor;thirst;tightness of the chest or wheezing;tingling of the hands or feet;troubled breathing;troubled breathing with exertion;unusual bleeding or bruising;unusual tiredness or weakness;unusual weight gain or loss;waking to urinate at night;weight gain;wheezing;wrinkled skin;yellowing of the eyes or skin;abdominal or stomach pain;blistering, peeling, or loosening of the skin;bloody, black, or tarry stools;clay-colored stools;feeling of discomfort;fever with or without chills;general feeling of tiredness or weakness;high fever;inflammation of the joints;irritation or inflammation of the eyelid;itching;joint or muscle pain;muscle aches;rectal bleeding;red skin lesions, often with a purple center;red, irritated eyes;seizures;sudden decrease in the amount of urine;swollen lymph glands;swollen or painful glands;unpleasant breath odor;vomiting of blood;accumulation of pus;acid or sour stomach;ankle, knee, or great toe joint pain;bad, unusual, or unpleasant (after) taste;belching;blemishes on the skin;bloated or full feeling;burning feeling in the chest or stomach;burning, crawling, itching, numbness, prickling, ""pins and needles"", or tingling feelings;change in taste;constipation;cracks in the skin;decreased appetite;difficulty with moving;dry skin;excess air or gas in the stomach or intestines;fear or nervousness;feeling of constant movement of self or surroundings;frequent urge to defecate;general feeling of discomfort or illness;hair loss;headache, severe and throbbing;heartburn;hives or welts;increase in body movements;increased sweating;increased thirst;indigestion;irritation or soreness of the mouth;joint stiffness or swelling;lack or loss of strength;loss of heat from the body;lower back or side pain;muscle aching or cramping;muscle pains or stiffness;passing of gas;peeling of the skin;pimples;poor concentration;pressure in the stomach;red, sore eyes;red, swollen skin;redness of the skin;scaly skin;seeing, hearing, or feeling things that are not there;sensation of spinning;sleepiness or unusual drowsiness;sleeplessness;sore mouth or tongue;soreness or redness around the fingernails and toenails;stomach discomfort, upset, or pain;stomach upset;straining while passing stool;swelling of the abdominal or stomach area;swelling or inflammation of the mouth;swollen, red, or tender area of infection;trouble with sleeping;unable to sleep;white patches in the mouth, tongue, or throat;or",,,,,,,,
28,28,Cefzil,,,,,,,,,,,"black, tarry stools;chest pain;cough or hoarseness;diarrhea;fever or chills;lower back or side pain;painful or difficult urination;shortness of breath;sore throat sores, ulcers, or white spots on the lips or in the mouth;swollen glands;unusual bleeding or bruising;unusual tiredness or weakness;abdominal or stomach cramps, pain, or tenderness;bleeding gums;blistering, peeling, or loosening of the skin;bloating;blood in the urine or stools;clay-colored stools;dark urine;diarrhea, watery and severe, which may also be bloody;difficulty with swallowing;dizziness;fast heartbeat;feeling of discomfort;headache;hives;increased thirst;inflammation of the joints;itching;joint or muscle pain;large, hive-like swelling on the face, eyelids, lips, tongue, throat, hands, legs, feet, or sex organs;loss of appetite;muscle aches;nausea or vomiting;pain;pinpoint red spots on the skin;puffiness or swelling of the eyelids or around the eyes, face, lips, or tongue;rash;red skin lesions, often with a purple center;red, irritated eyes;shortness of breath;swollen lymph glands;tightness in the chest;unpleasant breath odor;unusual weight loss;vomiting of blood;watery or bloody diarrhea;wheezing;yellow eyes or skin;back, leg, or stomach pains;bleeding gums;bloody or cloudy urine;bloody, black, or tarry stools;decrease in urine output or decrease in urine-concentrating ability;difficulty with breathing;fever with or without chills;general body swelling;general feeling of tiredness or weakness;high fever;nosebleeds;pale skin;sudden decrease in the amount of urine;swollen or painful glands;itching or pain of the vagina or genital area;pain during sexual intercourse;thick, white vaginal discharge with no odor or with a mild odor;confusion;hives or welts;nervousness;redness of the skin;restlessness;sleepiness or unusual drowsiness;sleeplessness;trouble sitting still;trouble with sleeping;unable to sleep;or",,,,,,,,
29,29,Daxbia,,,,,,,,,,,"diarrhea;abdominal or stomach pain;blistering, peeling, or loosening of the skin;chills;clay-colored stools;cough;dark urine;diarrhea;dizziness;fever;general tiredness and weakness;headache;itching or rash;joint or muscle pain;light-colored stools;loss of appetite;nausea and vomiting;red skin lesions, often with a purple center;red, irritated eyes;sore throat;sores, ulcers, or white spots in the mouth or on the lips;unpleasant breath odor;unusual tiredness or weakness;upper right abdominal or stomach pain;vomiting of blood;yellow eyes or skin;abdominal or stomach cramps or tenderness;back or leg pains;black, tarry stools;bleeding gums;bloating;blood in the urine or stools;chest pain;coughing up blood;diarrhea, watery and severe, which may also be bloody;difficulty with breathing or swallowing;fast heartbeat;general body swelling;hives;increased menstrual flow or vaginal bleeding;increased thirst;large, hive-like swelling on the face, eyelids, lips, tongue, throat, hands, legs, feet, or sex organs;loss of appetite;nosebleeds;pain;painful or difficult urination;pale skin;paralysis;pinpoint red spots on the skin;prolonged bleeding from cuts;puffiness or swelling of the eyelids or around the eyes, face, lips, or tongue;red or black, tarry stools;red or dark brown urine;swollen or painful glands;tightness in the chest;unusual bleeding or bruising;unusual weight loss;watery or bloody diarrhea;acid or sour stomach;anxiety;belching;burning feeling in the chest or stomach;difficulty with moving;dry mouth;heartburn;hyperventilation;indigestion;irregular heartbeats;irritability;itching of the vagina or genital area;muscle pain or stiffness;nervousness;pain during sexual intercourse;pain, swelling, or redness in the joints;redness of the skin;restlessness;seeing, hearing, or feeling things that are not there;shaking;stomach upset;trouble sleeping;white or brownish vaginal discharge;or",,,,,,,,
30,30,methenamine,,,,,,,,,,,skin rash;blood in urine;lower back pain;pain or burning while urinating;nausea and vomiting;or,,,,,,,,
31,31,Panixine,,,,,,,,,,,"diarrhea;abdominal or stomach pain;blistering, peeling, or loosening of the skin;chills;clay-colored stools;cough;dark urine;diarrhea;dizziness;fever;general tiredness and weakness;headache;itching or rash;joint or muscle pain;light-colored stools;loss of appetite;nausea and vomiting;red skin lesions, often with a purple center;red, irritated eyes;sore throat;sores, ulcers, or white spots in the mouth or on the lips;unpleasant breath odor;unusual tiredness or weakness;upper right abdominal or stomach pain;vomiting of blood;yellow eyes or skin;abdominal or stomach cramps or tenderness;back or leg pains;black, tarry stools;bleeding gums;bloating;blood in the urine or stools;chest pain;coughing up blood;diarrhea, watery and severe, which may also be bloody;difficulty with breathing or swallowing;fast heartbeat;general body swelling;hives;increased menstrual flow or vaginal bleeding;increased thirst;large, hive-like swelling on the face, eyelids, lips, tongue, throat, hands, legs, feet, or sex organs;loss of appetite;nosebleeds;pain;painful or difficult urination;pale skin;paralysis;pinpoint red spots on the skin;prolonged bleeding from cuts;puffiness or swelling of the eyelids or around the eyes, face, lips, or tongue;red or black, tarry stools;red or dark brown urine;swollen or painful glands;tightness in the chest;unusual bleeding or bruising;unusual weight loss;watery or bloody diarrhea;acid or sour stomach;anxiety;belching;burning feeling in the chest or stomach;difficulty with moving;dry mouth;heartburn;hyperventilation;indigestion;irregular heartbeats;irritability;itching of the vagina or genital area;muscle pain or stiffness;nervousness;pain during sexual intercourse;pain, swelling, or redness in the joints;redness of the skin;restlessness;seeing, hearing, or feeling things that are not there;shaking;stomach upset;trouble sleeping;white or brownish vaginal discharge;or",,,,,,,,
32,32,Cedax,,,,,,,,,,,"burning while urinating;confusion;decreased urination;difficult or labored breathing;difficult or painful urination;dizziness;dry mouth;fainting;fever;increase in heart rate;lightheadedness;rapid breathing;shortness of breath;sunken eyes;thirst;tightness in the chest;unusual tiredness or weakness;wheezing;wrinkled skin;abdominal or stomach cramps or tenderness;back, leg, or stomach pains;bleeding gums;blistering, peeling, or loosening of the skin;bloating;bloody or cloudy urine;bloody, black, or tarry stools;chest pain;chills;clay-colored stools;cloudy urine;cough or hoarseness;coughing up blood;dark urine;decrease in urine output or decrease in urine-concentrating ability;diarrhea;diarrhea, watery and severe, which may also be bloody;difficulty with breathing or swallowing;fast heartbeat;feeling of discomfort;feeling that others are watching you or controlling your behavior;feeling that others can hear your thoughts;feeling, seeing, or hearing things that are not there;fever with or without chills;general body swelling;general feeling of tiredness or weakness;high fever;hives;increased menstrual flow or vaginal bleeding;increased thirst;inflammation of the joints;itching;joint or muscle pain;loss of appetite;lower back or side pain;muscle aches;nausea or vomiting;noisy breathing;nosebleeds;pain;pale skin;paralysis;problems with speech or speaking;prolonged bleeding from cuts;puffiness or swelling of the eyelids or around the eyes, face, lips, or tongue;red or black, tarry stools;red or dark brown urine;red skin lesions, often with a purple center;red, irritated eyes;seizures;severe mood or mental changes;skin rash;sore throat;sores, ulcers, or white spots on the lips or in the mouth;sudden decrease in the amount of urine;swollen lymph glands;swollen or painful glands;unpleasant breath odor;unusual behavior;unusual bleeding or bruising;unusual weight loss;vomiting of blood;wheezing;yellowing of the eyes or skin;acid or sour stomach;belching;heartburn;indigestion;loose stools;stomach discomfort, upset, or pain;agitation;bad, unusual, or unpleasant (after) taste;bloated, full feeling;burning, crawling, itching, numbness, prickling, ""pins and needles"", or tingling feelings;change in taste;constipation;cracks in the skin at the corners of the mouth;dry mouth;excess air or gas in the stomach or intestines;feeling unusually cold;full feeling;headache;hives or welts;increase in the body movements;irritability;itching of the vagina or genital area;pain during sexual intercourse;passing gas;redness of the skin;shivering;sleepiness or unusual drowsiness;sleeplessness;soreness or redness around the fingernails and toenails;stuffy nose;thick, white vaginal discharge with no odor or with a mild odor;trouble with sleeping;unable to sleep;weight loss;or",,,,,,,,
33,33,cefixime,,,,,,,,,,,"diarrhea;loose or frequent stools;abdominal or stomach pain;agitation;black, tarry stools;bleeding gums;blistering, peeling, or loosening of the skin;blood in the urine or stools;chest pain;chills;clay-colored stools;coma;confusion;cough;dark urine;decreased urine output;depression;difficulty with swallowing;dizziness;fast heartbeat;feeling of discomfort;fever;general tiredness and weakness;headache;hives, itching, or skin rash;hostility;inflammation of the joints;irritability;joint or muscle pain;large, hive-like swelling on the face, eyelids, lips, tongue, throat, hands, legs, feet, or sex organs;lethargy;light-colored stools;loss of appetite;lower back or side pain;muscle aches;muscle twitching;nausea and vomiting;painful or difficult urination;pale skin;pinpoint red spots on the skin;puffiness or swelling of the eyelids or around the eyes, face, lips, or tongue;rapid weight gain;red skin lesions, often with a purple center;red, irritated eyes;seizures;sore throat;sores, ulcers, or white spots on the lips or in the mouth;stupor;swelling of the face, ankles, or hands;swollen glands;swollen lymph glands;tightness in the chest;unpleasant breath odor;unusual bleeding or bruising;unusual tiredness or weakness;upper right abdominal or stomach pain;vomiting of blood;yellow eyes or skin;abdominal or stomach cramps or tenderness;back, leg, or stomach pains;cough or hoarseness;coughing up blood;diarrhea, watery and severe, which may also be bloody;general body swelling;increased menstrual flow or vaginal bleeding;increased thirst;nosebleeds;pain paralysis;prolonged bleeding from cuts;red or black, tarry stools;red or dark brown urine;sudden decrease in the amount of urine;unpleasant breath odor;unusual weight loss;acid or sour stomach;belching;bloated;excess air or gas in the stomach or intestines;full feeling;heartburn;hives or welts;indigestion;itching of the vagina or genital area itching or pain of the genital area;pain during sexual intercourse;passing gas;redness of the skin;stomach discomfort, upset, or pain;thick, white vaginal discharge with no odor or with a mild odor;white patches in the mouth or throat or on the tongue;white patches with diaper rash;or",,,,,,,,
34,34,ofloxacin,,,,,,,,,,,"abdominal or stomach pain;anxiety;black, tarry stools;bleeding gums;blood in the urine or stools;blurred vision;body aches or pain;chest pain;chills;cloudy urine;cold sweats;coma;confusion;congestion;cool, pale skin;cough;depression;diarrhea;dry mouth;dryness or soreness of the throat;eye pain;fast heartbeat;fever;flushed, dry skin;fruit-like breath odor;general feeling of illness;headache;hoarseness;increased hunger;increased thirst;increased urination;lower back or side pain;nausea;nightmares;painful or difficult urination;pale skin;pinpoint red spots on the skin;pus in the urine;runny nose;seizures;shakiness;slurred speech;sore throat;sores, ulcers, or white spots on the lips or in the mouth;sweating;swollen glands;tender, swollen glands in the neck;trouble with swallowing;troubled breathing with exertion;unexplained weight loss;unusual bleeding or bruising;unusual tiredness or weakness;voice changes;vomiting;burning while urinating;burning, crawling, itching, numbness, prickling, ""pins and needles"", or tingling feelings;change in color vision;continuing ringing or buzzing or other unexplained noise in the ears;convulsions;decrease in frequency of urination;decrease in urine volume;decreased hearing or any change in hearing;difficult or painful urination;difficulty in passing urine (dribbling);difficulty seeing at night;difficulty with moving;discouragement;dizziness, faintness, or lightheadedness when getting up suddenly from a lying or sitting position;false or unusual sense of well-being;fast, irregular, pounding, or racing heartbeat or pulse;feeling of constant movement of self or surroundings;feeling of warmth or heat;feeling sad or empty;flushing or redness of the skin, especially on the face and neck;hearing loss;hives or welts, itching, or skin rash;increased need to urinate;increased sensitivity of the eyes to sunlight;increased sweating;irritability;joint pain;lack of appetite;large, hive-like swelling on the face, eyelids, lips, tongue, throat, hands, legs, feet, or sex organs;loss of bladder control;loss of interest or pleasure;muscle aching or cramping;muscle pains or stiffness;muscle spasm or jerking of all extremities;no blood pressure or pulse;no breathing;passing urine more often;pounding in the ears;redness, soreness, or itching skin;seeing, hearing, or feeling things that are not there;sensation of spinning;shakiness in the legs, arms, hands, or feet;slow or fast heartbeat;sores, welting, or blisters;stopping of the heart;sudden loss of consciousness;swelling;swollen joints;trembling or shaking of the hands or feet;trouble concentrating;trouble performing routine tasks;trouble sleeping;unconsciousness;abdominal or stomach tenderness;actions that are out of control;back, leg, or stomach pains;blistering, peeling, or loosening of the skin;bloating;blue lips and fingernails;burning, dry, or itching eyes;changes in behavior;confusion about identity, place, and time;coughing that sometimes produces a pink frothy sputum;coughing up blood;cracks in the skin;crying;dark-colored urine;darkening of the skin;delusions of persecution, mistrust, suspiciousness, and/or combativeness;depersonalization;diarrhea, watery and severe, which may also be bloody;difficulty with breathing, chewing, speaking, or swallowing;discharge or excessive tearing;double vision;drooling;drooping eyelids;dysphoria;euphoria;feeling of discomfort;general body swelling;heartburn;high fever;hyperventilation;increased blood pressure;increased menstrual flow or vaginal bleeding;increased sensitivity of the skin to sunlight;increased sweating;indigestion;inflammation of the joints;irregular heartbeats;irregular or slow heart rate;itching of the vagina or outside the genitals;loss of ability to use or understand speech or language;loss of appetite;loss of balance control;loss of heat from the body;mental depression;mood or mental changes;muscle weakness;noisy breathing;nosebleeds;numbness of the hands;pain during sexual intercourse;pain in the ankles or knees;pain, inflammation, or swelling in the calves, shoulders, or hands;painful, red lumps under the skin, mostly on the legs;paralysis;prolonged bleeding from cuts;puffiness or swelling of the eyelids or around the eyes, face, lips, or tongue;quick to react or overreact emotionally;rapidly changing moods;red or black, tarry stools;red or dark brown urine;red skin lesions, often with a purple center;red, irritated eyes;red, swollen skin;redness or other discoloration of the skin;redness, pain, or swelling of the eye, eyelid, or inner lining of the eyelid;restlessness;scaly skin;severe abdominal or stomach pain, cramping, or burning;severe sunburn;severe tiredness;shaking;shuffling walk;stiffness of the limbs;stomach pain, continuing;swelling of the face, fingers, or lower legs;swollen lymph glands;talking, feeling, and acting with excitement;thick, white, curd-like vaginal discharge without odor or with mild odor;thoughts of killing oneself;twisting movements of the body;uncontrolled eye movements;uncontrolled movements, especially of the face, neck, and back;unexplained bleeding or bruising;unpleasant breath odor;unsteadiness or awkwardness;unusual behavior, such as disorientation to time or place, failure to recognize people, hyperactivity, or restlessness, especially in children using 2% cyclopentolate;unusual weight loss;upper right abdominal or stomach pain;vomiting of blood or material that looks like coffee grounds;weakness in the arms, hands, legs, or feet;weight gain;yellowing of the eyes or skin;change in taste;excess air or gas in the stomach or intestines;full feeling;loss of taste;passing gas;runny nose;or",,,,,,,,
35,35,pentosan polysulfate sodium,,,,,,,,,,,chills;difficulty in breathing;fever;skin rash or hives;sore throat;unusual bleeding or bruising;unusual tiredness or weakness;vision impairment;abdominal pain;bleeding gums;constipation;diarrhea;difficulty or pain upon swallowing;dizziness;dryness of throat;hair loss;headache;heartburn;increased sensitivity of skin to sunlight;irritated or red eyes;itching;loss of appetite;nausea;nosebleed;ringing in the ears;runny nose;sores in mouth;stomach gas;stomach upset;vomiting,,,,,,,,
36,36,tetracycline,,,,,,,,,,,"increased sensitivity of skin to sunlight (rare with minocycline);abdominal pain;bulging fontanel (soft spot on head) of infants;headache;loss of appetite;nausea and vomiting;visual changes;yellowing skin;greatly increased frequency of urination or amount of urine;increased thirst;unusual tiredness or weakness;pigmentation (darker color or discoloration) of skin and mucous membranes;cramps or burning of the stomach;diarrhea;itching of the rectal or genital (sex organ) areas;sore mouth or tongue;dizziness, light-headedness, or unsteadiness;or",,,,,,,,
