,Unnamed: 0,Brand Name,Generic Name,Type of Treatment,Brief Description,Quantity,Location,Uninsured Cost,Typical Copay,Rating,Vendor,Effectiveness,Side Effects / Risk,Ingredients,Usage Overview,Conflicting Treatment/Therapies,Food Interaction,Frequency of Treatment,Estimated Percentage of Usage,Additional Information,Reference Link
0,0,ciprofloxacin,,,,,,,,,,,"diarrhea;bloody or black, tarry stools;burning, crawling, itching, numbness, prickling, ""pins and needles"", or tingling feelings;changes in skin color;changes in urination;chest pain or discomfort;chest tightness or heaviness;chills or fever;clumsiness or unsteadiness;confusion;continuing ringing or buzzing or other unexplained noise in the ears;coughing or spitting up blood;dizziness, faintness, or lightheadedness when getting up suddenly from a lying or sitting position;fast, irregular, pounding, or racing heartbeat or pulse;headache, severe and throbbing;hearing loss;hives or welts or skin rash;joint stiffness;large, hive-like swelling on the face, eyelids, lips, tongue, throat, hands, legs, feet, or sex organs;light-colored stools;muscle pain or stiffness;nausea and vomiting;nightmares;numbness of the hands;pain in the joints;pain or discomfort in the arms, jaw, back, or neck;painful, red lumps under the skin, mostly on the legs;pounding in the ears;puffiness or swelling of the eyelids or around the eyes, face, lips, or tongue;redness of the face, neck, arms, and occasionally, upper chest;seizures;severe abdominal or stomach pain, cramping, or burning;shakiness in the legs, arms, hands, or feet;swelling of the face, feet, or lower legs;swollen, painful, or tender lymph glands in the neck, armpit, or groin;thick, white vaginal discharge with no odor or with a mild odor;unsteadiness, trembling, or other problems with muscle control or coordination;unusual drowsiness, dullness, tiredness, weakness, or feeling of sluggishness;white patches in the mouth and/or on the tongue;yellow eyes or skin;acid or sour stomach;blistering, peeling, or loosening of the skin;bluish-colored lips, fingernails, or palms;bone pain;diarrhea, watery and severe, which may also be bloody;difficulty with breathing, chewing, or talking;double vision;excessive muscle tone;feeling of discomfort;feeling, seeing, or hearing things that are not there;increased sensitivity to pain;increased sensitivity to touch;irregular or slow heart rate;mood changes;nosebleeds;rapid heart rate;red skin lesions, often with a purple center;seeing, hearing, or feeling things that are not there;sores, ulcers, or white spots on the lips or in the mouth;unusual bleeding or bruising;unusual excitement, nervousness, or restlessness;vaginal yeast infection;runny nose;sneezing;stuffy nose;or",,,,,,,,
1,1,Cipro,,,,,,,,,,,"diarrhea;bloody or black, tarry stools;burning, crawling, itching, numbness, prickling, ""pins and needles"", or tingling feelings;changes in skin color;changes in urination;chest pain or discomfort;chest tightness or heaviness;chills or fever;clumsiness or unsteadiness;confusion;continuing ringing or buzzing or other unexplained noise in the ears;coughing or spitting up blood;dizziness, faintness, or lightheadedness when getting up suddenly from a lying or sitting position;fast, irregular, pounding, or racing heartbeat or pulse;headache, severe and throbbing;hearing loss;hives or welts or skin rash;joint stiffness;large, hive-like swelling on the face, eyelids, lips, tongue, throat, hands, legs, feet, or sex organs;light-colored stools;muscle pain or stiffness;nausea and vomiting;nightmares;numbness of the hands;pain in the joints;pain or discomfort in the arms, jaw, back, or neck;painful, red lumps under the skin, mostly on the legs;pounding in the ears;puffiness or swelling of the eyelids or around the eyes, face, lips, or tongue;redness of the face, neck, arms, and occasionally, upper chest;seizures;severe abdominal or stomach pain, cramping, or burning;shakiness in the legs, arms, hands, or feet;swelling of the face, feet, or lower legs;swollen, painful, or tender lymph glands in the neck, armpit, or groin;thick, white vaginal discharge with no odor or with a mild odor;unsteadiness, trembling, or other problems with muscle control or coordination;unusual drowsiness, dullness, tiredness, weakness, or feeling of sluggishness;white patches in the mouth and/or on the tongue;yellow eyes or skin;acid or sour stomach;blistering, peeling, or loosening of the skin;bluish-colored lips, fingernails, or palms;bone pain;diarrhea, watery and severe, which may also be bloody;difficulty with breathing, chewing, or talking;double vision;excessive muscle tone;feeling of discomfort;feeling, seeing, or hearing things that are not there;increased sensitivity to pain;increased sensitivity to touch;irregular or slow heart rate;mood changes;nosebleeds;rapid heart rate;red skin lesions, often with a purple center;seeing, hearing, or feeling things that are not there;sores, ulcers, or white spots on the lips or in the mouth;unusual bleeding or bruising;unusual excitement, nervousness, or restlessness;vaginal yeast infection;runny nose;sneezing;stuffy nose;or",,,,,,,,
2,2,nitrofurantoin,,,,,,,,,,,"changes in facial skin color;chest pain;chills;cough;fever;general feeling of discomfort or illness;hives;hoarseness;itching;joint or muscle pain;shortness of breath;skin rash;sudden trouble in swallowing or breathing;swelling of the face, mouth, hands, or feet;troubled breathing;black, tarry stools;blood in the urine or stools;burning, numbness, tingling, or painful sensations;dizziness;drowsiness;headache;pinpoint red spots on the skin;sore throat;unsteadiness or awkwardness;unusual bleeding or bruising;unusual tiredness or weakness;weakness in the arms, hands, legs, or feet;abdominal or stomach pain;blindness;blistering, peeling, or loosening of the skin and mucous membranes;blue-yellow color blindness;bluish color of the fingernails, lips, skin, palms, or nail beds;blurred vision or loss of vision, with or without eye pain;bulging soft spot on the head of an infant;change in the ability to see colors, especially blue or yellow;confusion;cracks in the skin;darkening of the urine;decreased vision;diarrhea;diarrhea, watery and severe, which may also be bloody;eye pain;general tiredness and weakness;light-colored stools;loss of appetite;loss of heat from the body;mental depression;mood or mental changes;nausea or vomiting;pale skin;pale stools;red skin lesions, often with a purple center;red, irritated eyes;red, swollen skin;red, thickened, or scaly skin;skin rash;sores, ulcers, or white spots on the lips or in the mouth;swollen or painful glands;tenderness of salivary glands;unpleasant breath odor;upper right abdominal pain;visual changes;vomiting of blood;wheezing or tightness in the chest;yellow eyes or skin;diarrhea;gas;dizziness or lightheadedness;feeling of constant movement of self or surroundings;lack or loss of strength;loss of hair, temporary;sensation of spinning;uncontrolled eye movements;or",,,,,,,,
3,3,Macrobid,,,,,,,,,,,"changes in facial skin color;chest pain;chills;cough;fever;general feeling of discomfort or illness;hives;hoarseness;itching;joint or muscle pain;shortness of breath;skin rash;sudden trouble in swallowing or breathing;swelling of the face, mouth, hands, or feet;troubled breathing;black, tarry stools;blood in the urine or stools;burning, numbness, tingling, or painful sensations;dizziness;drowsiness;headache;pinpoint red spots on the skin;sore throat;unsteadiness or awkwardness;unusual bleeding or bruising;unusual tiredness or weakness;weakness in the arms, hands, legs, or feet;abdominal or stomach pain;blindness;blistering, peeling, or loosening of the skin and mucous membranes;blue-yellow color blindness;bluish color of the fingernails, lips, skin, palms, or nail beds;blurred vision or loss of vision, with or without eye pain;bulging soft spot on the head of an infant;change in the ability to see colors, especially blue or yellow;confusion;cracks in the skin;darkening of the urine;decreased vision;diarrhea;diarrhea, watery and severe, which may also be bloody;eye pain;general tiredness and weakness;light-colored stools;loss of appetite;loss of heat from the body;mental depression;mood or mental changes;nausea or vomiting;pale skin;pale stools;red skin lesions, often with a purple center;red, irritated eyes;red, swollen skin;red, thickened, or scaly skin;skin rash;sores, ulcers, or white spots on the lips or in the mouth;swollen or painful glands;tenderness of salivary glands;unpleasant breath odor;upper right abdominal pain;visual changes;vomiting of blood;wheezing or tightness in the chest;yellow eyes or skin;diarrhea;gas;dizziness or lightheadedness;feeling of constant movement of self or surroundings;lack or loss of strength;loss of hair, temporary;sensation of spinning;uncontrolled eye movements;or",,,,,,,,
4,4,cephalexin,,,,,,,,,,,"diarrhea;abdominal or stomach pain;blistering, peeling, or loosening of the skin;chills;clay-colored stools;cough;dark urine;diarrhea;dizziness;fever;general tiredness and weakness;headache;itching or rash;joint or muscle pain;light-colored stools;loss of appetite;nausea and vomiting;red skin lesions, often with a purple center;red, irritated eyes;sore throat;sores, ulcers, or white spots in the mouth or on the lips;unpleasant breath odor;unusual tiredness or weakness;upper right abdominal or stomach pain;vomiting of blood;yellow eyes or skin;abdominal or stomach cramps or tenderness;back or leg pains;black, tarry stools;bleeding gums;bloating;blood in the urine or stools;chest pain;coughing up blood;diarrhea, watery and severe, which may also be bloody;difficulty with breathing or swallowing;fast heartbeat;general body swelling;hives;increased menstrual flow or vaginal bleeding;increased thirst;large, hive-like swelling on the face, eyelids, lips, tongue, throat, hands, legs, feet, or sex organs;loss of appetite;nosebleeds;pain;painful or difficult urination;pale skin;paralysis;pinpoint red spots on the skin;prolonged bleeding from cuts;puffiness or swelling of the eyelids or around the eyes, face, lips, or tongue;red or black, tarry stools;red or dark brown urine;swollen or painful glands;tightness in the chest;unusual bleeding or bruising;unusual weight loss;watery or bloody diarrhea;acid or sour stomach;anxiety;belching;burning feeling in the chest or stomach;difficulty with moving;dry mouth;heartburn;hyperventilation;indigestion;irregular heartbeats;irritability;itching of the vagina or genital area;muscle pain or stiffness;nervousness;pain during sexual intercourse;pain, swelling, or redness in the joints;redness of the skin;restlessness;seeing, hearing, or feeling things that are not there;shaking;stomach upset;trouble sleeping;white or brownish vaginal discharge;or",,,,,,,,
5,5,Amoxil,,,,,,,,,,,"abdominal or stomach cramps or tenderness;back, leg, or stomach pains;black, tarry stools;bleeding gums;blistering, peeling, or loosening of the skin;bloating;blood in the urine;bloody nose;chest pain;chills;clay-colored stools;cough;dark urine;diarrhea;diarrhea, watery and severe, which may also be bloody;difficulty with breathing;difficulty with swallowing;dizziness;fast heartbeat;feeling of discomfort;fever;general body swelling;headache;heavier menstrual periods;hives or welts;increased thirst;inflammation of the joints;itching;joint or muscle pain;loss of appetite;muscle aches;nausea or vomiting;nosebleeds;pain;pain in the lower back;pain or burning while urinating;painful or difficult urination;pale skin;pinpoint red spots on the skin;puffiness or swelling of the eyelids or around the eyes, face, lips, or tongue;rash;red, irritated eyes;redness, soreness, or itching skin;shortness of breath;sore throat;sores, ulcers, or white spots in the mouth or on the lips;sores, welting, or blisters;sudden decrease in the amount of urine;swollen, lymph glands;tenderness;tightness in the chest;unpleasant breath odor;unusual bleeding or bruising;unusual tiredness or weakness;unusual weight loss;vomiting of blood;watery or bloody diarrhea;wheezing;yellow eyes or skin;bad, unusual, or unpleasant (after) taste;change in taste;agitation;black, hairy tongue;changes in behavior;confusion;convulsions;discoloration of the tooth (brown, yellow, or gray staining);dizziness;sleeplessness;trouble with sleeping;unable to sleep;white patches in the mouth or throat or on the tongue;white patches with diaper rash;or",,,,,,,,
6,6,Keflex,,,,,,,,,,,"diarrhea;abdominal or stomach pain;blistering, peeling, or loosening of the skin;chills;clay-colored stools;cough;dark urine;diarrhea;dizziness;fever;general tiredness and weakness;headache;itching or rash;joint or muscle pain;light-colored stools;loss of appetite;nausea and vomiting;red skin lesions, often with a purple center;red, irritated eyes;sore throat;sores, ulcers, or white spots in the mouth or on the lips;unpleasant breath odor;unusual tiredness or weakness;upper right abdominal or stomach pain;vomiting of blood;yellow eyes or skin;abdominal or stomach cramps or tenderness;back or leg pains;black, tarry stools;bleeding gums;bloating;blood in the urine or stools;chest pain;coughing up blood;diarrhea, watery and severe, which may also be bloody;difficulty with breathing or swallowing;fast heartbeat;general body swelling;hives;increased menstrual flow or vaginal bleeding;increased thirst;large, hive-like swelling on the face, eyelids, lips, tongue, throat, hands, legs, feet, or sex organs;loss of appetite;nosebleeds;pain;painful or difficult urination;pale skin;paralysis;pinpoint red spots on the skin;prolonged bleeding from cuts;puffiness or swelling of the eyelids or around the eyes, face, lips, or tongue;red or black, tarry stools;red or dark brown urine;swollen or painful glands;tightness in the chest;unusual bleeding or bruising;unusual weight loss;watery or bloody diarrhea;acid or sour stomach;anxiety;belching;burning feeling in the chest or stomach;difficulty with moving;dry mouth;heartburn;hyperventilation;indigestion;irregular heartbeats;irritability;itching of the vagina or genital area;muscle pain or stiffness;nervousness;pain during sexual intercourse;pain, swelling, or redness in the joints;redness of the skin;restlessness;seeing, hearing, or feeling things that are not there;shaking;stomach upset;trouble sleeping;white or brownish vaginal discharge;or",,,,,,,,
7,7,amoxicillin,,,,,,,,,,,"abdominal or stomach cramps or tenderness;back, leg, or stomach pains;black, tarry stools;bleeding gums;blistering, peeling, or loosening of the skin;bloating;blood in the urine;bloody nose;chest pain;chills;clay-colored stools;cough;dark urine;diarrhea;diarrhea, watery and severe, which may also be bloody;difficulty with breathing;difficulty with swallowing;dizziness;fast heartbeat;feeling of discomfort;fever;general body swelling;headache;heavier menstrual periods;hives or welts;increased thirst;inflammation of the joints;itching;joint or muscle pain;loss of appetite;muscle aches;nausea or vomiting;nosebleeds;pain;pain in the lower back;pain or burning while urinating;painful or difficult urination;pale skin;pinpoint red spots on the skin;puffiness or swelling of the eyelids or around the eyes, face, lips, or tongue;rash;red, irritated eyes;redness, soreness, or itching skin;shortness of breath;sore throat;sores, ulcers, or white spots in the mouth or on the lips;sores, welting, or blisters;sudden decrease in the amount of urine;swollen, lymph glands;tenderness;tightness in the chest;unpleasant breath odor;unusual bleeding or bruising;unusual tiredness or weakness;unusual weight loss;vomiting of blood;watery or bloody diarrhea;wheezing;yellow eyes or skin;bad, unusual, or unpleasant (after) taste;change in taste;agitation;black, hairy tongue;changes in behavior;confusion;convulsions;discoloration of the tooth (brown, yellow, or gray staining);dizziness;sleeplessness;trouble with sleeping;unable to sleep;white patches in the mouth or throat or on the tongue;white patches with diaper rash;or",,,,,,,,
8,8,Levaquin,,,,,,,,,,,"diarrhea;abdominal or stomach cramps or pain (severe);agitation;blisters;confusion;diarrhea (watery and severe) which may also be bloody;feeling that others can hear your thoughts or control your behavior;fever;pain, inflammation, or swelling in the calves of the legs, shoulders, or hands, including tendon rupture or swelling of the tendon (tendinitis);redness and swelling of the skin;seeing, hearing, or feeling things that are not there;sensation of burning on the skin;severe mood or mental changes;skin rash, itching, or redness;trembling;unusual behavior;black, tarry stools;blurred vision;burning, numbness, tingling, or painful sensation including peripheral neuropathy.;convulsions;cough;dark-colored urine;difficulty with breathing;difficulty with chewing, talking, or swallowing;drooping eyelids;fast or irregular heartbeat;general body swelling;hives;hoarseness;joint or muscle pain including tendon rupture or swelling of the tendon (tendinitis).;muscle cramps, spasms, pain, or stiffness;peeling or loosening of the skin;puffiness or swelling of the eyelids or around the eyes, face, lips, or tongue;severe dizziness;severe tiredness;tightness in the chest;unsteadiness or awkwardness;unusual bleeding or bruising;unusual tiredness or weakness;vision changes;voice changes;weakness in the arms, hands, legs, or feet including worsening of myasthenia gravis.;abdominal or stomach pain or discomfort;change in taste;constipation;dizziness;drowsiness;headache;lightheadedness;nausea;nervousness;trouble sleeping;vaginal itching and discharge;vomiting;feeling faint;feeling of warmth or heat;flushing or redness of the skin, especially on the face and neck;sweating;or",,,,,,,,
9,9,trimethoprim,,,,,,,,,,,"skin rash or itching;black, tarry stools;blood in urine or stools;bluish fingernails, lips, or skin;changes in facial skin color;chills;difficult breathing or shortness of breath;fever with or without chills;general feeling of discomfort or illness;headache;joint or muscle pain;nausea;neck stiffness;pale skin;pinpoint red spots on skin;redness, blistering, burning, tenderness, peeling, or loosening of skin or mucous membranes;redness, swelling, or soreness of tongue;red skin lesions, often with a purple center;sore throat;swelling;thickened or scaly skin;unusual bleeding or bruising;unusual tiredness or weakness;diarrhea;loss of appetite;nausea or vomiting;stomach cramps or pain;or",,,,,,,,
10,10,levofloxacin,,,,,,,,,,,"diarrhea;abdominal or stomach cramps or pain (severe);agitation;blisters;confusion;diarrhea (watery and severe) which may also be bloody;feeling that others can hear your thoughts or control your behavior;fever;pain, inflammation, or swelling in the calves of the legs, shoulders, or hands, including tendon rupture or swelling of the tendon (tendinitis);redness and swelling of the skin;seeing, hearing, or feeling things that are not there;sensation of burning on the skin;severe mood or mental changes;skin rash, itching, or redness;trembling;unusual behavior;black, tarry stools;blurred vision;burning, numbness, tingling, or painful sensation including peripheral neuropathy.;convulsions;cough;dark-colored urine;difficulty with breathing;difficulty with chewing, talking, or swallowing;drooping eyelids;fast or irregular heartbeat;general body swelling;hives;hoarseness;joint or muscle pain including tendon rupture or swelling of the tendon (tendinitis).;muscle cramps, spasms, pain, or stiffness;peeling or loosening of the skin;puffiness or swelling of the eyelids or around the eyes, face, lips, or tongue;severe dizziness;severe tiredness;tightness in the chest;unsteadiness or awkwardness;unusual bleeding or bruising;unusual tiredness or weakness;vision changes;voice changes;weakness in the arms, hands, legs, or feet including worsening of myasthenia gravis.;abdominal or stomach pain or discomfort;change in taste;constipation;dizziness;drowsiness;headache;lightheadedness;nausea;nervousness;trouble sleeping;vaginal itching and discharge;vomiting;feeling faint;feeling of warmth or heat;flushing or redness of the skin, especially on the face and neck;sweating;or",,,,,,,,
11,11,Ceftin,,,,,,,,,,,"chills;diarrhea;fever;general feeling of illness or discomfort;headache;itching of the vagina or genital area;pain during sexual intercourse;rigidity;sweating;thick, white vaginal discharge with no odor or with a mild odor;black, tarry stools;chest pain;cough;loose stools;painful or difficult urination;shortness of breath;sore throat;sores, ulcers, or white spots on the lips or in the mouth;swollen glands;unusual bleeding or bruising;unusual tiredness or weakness;back, leg, or stomach pains;bladder pain;bleeding gums;bloody or cloudy urine;body aches or pain;burning while urinating;dark urine;difficulty with breathing;ear congestion;fast, pounding, or irregular heartbeat or pulse;frequent urge to urinate;general body swelling;loss of appetite;loss of voice;lower back or side pain;nasal congestion;nausea or vomiting;nosebleeds;pain or tenderness around the eyes and cheekbones;pale skin;pink or red urine;sneezing;stuffy or runny nose;swelling of the joints;swollen glands;tightness of chest or wheezing;white or brownish vaginal discharge;white patches in the mouth or throat or on the tongue;white patches with diaper rash;yellowing of the eyes or skin;blistering, peeling, or loosening of the skin;bloody, black, or tarry stools;clay-colored stools;cough or hoarseness;coughing up blood;decrease in urine output or decrease in urine-concentrating ability;feeling of discomfort;fever with or without chills;general feeling of tiredness or weakness;high fever;hives;increased menstrual flow or vaginal bleeding;joint or muscle pain;large, hive-like swelling on the face, eyelids, lips, tongue, throat, hands, legs, feet, or sex organs;light-colored stools;paralysis;prolonged bleeding from cuts;puffiness or swelling of the eyelids or around the eyes, face, lips, or tongue;red or black, tarry stools;red or dark brown urine;red skin lesions, often with a purple center;red, irritated eyes;seizures;swollen lymph glands;swollen or painful glands;unpleasant breath odor;upper right abdominal or stomach pain;vomiting of blood;bad, unusual, or unpleasant (after) taste;change in taste;diaper rash;abdominal or stomach cramps;acid or sour stomach;belching;bloated;difficulty with moving;excess air or gas in the stomach or intestines;flushing or redness of the skin;full feeling;gas in the stomach;heartburn;indigestion;irritability;irritation or soreness of the mouth;itching skin;muscle pain or stiffness;muscle spasm of the neck;passing gas;restlessness;sleepiness or unusual drowsiness;stomach discomfort, upset, or pain;swelling of the tongue;thirst;trouble sitting still;unusually warm skin;watering of the mouth and drooling;weight loss;hives or welts;redness of the skin;or",,,,,,,,
12,12,Macrodantin,,,,,,,,,,,"changes in facial skin color;chest pain;chills;cough;fever;general feeling of discomfort or illness;hives;hoarseness;itching;joint or muscle pain;shortness of breath;skin rash;sudden trouble in swallowing or breathing;swelling of the face, mouth, hands, or feet;troubled breathing;black, tarry stools;blood in the urine or stools;burning, numbness, tingling, or painful sensations;dizziness;drowsiness;headache;pinpoint red spots on the skin;sore throat;unsteadiness or awkwardness;unusual bleeding or bruising;unusual tiredness or weakness;weakness in the arms, hands, legs, or feet;abdominal or stomach pain;blindness;blistering, peeling, or loosening of the skin and mucous membranes;blue-yellow color blindness;bluish color of the fingernails, lips, skin, palms, or nail beds;blurred vision or loss of vision, with or without eye pain;bulging soft spot on the head of an infant;change in the ability to see colors, especially blue or yellow;confusion;cracks in the skin;darkening of the urine;decreased vision;diarrhea;diarrhea, watery and severe, which may also be bloody;eye pain;general tiredness and weakness;light-colored stools;loss of appetite;loss of heat from the body;mental depression;mood or mental changes;nausea or vomiting;pale skin;pale stools;red skin lesions, often with a purple center;red, irritated eyes;red, swollen skin;red, thickened, or scaly skin;skin rash;sores, ulcers, or white spots on the lips or in the mouth;swollen or painful glands;tenderness of salivary glands;unpleasant breath odor;upper right abdominal pain;visual changes;vomiting of blood;wheezing or tightness in the chest;yellow eyes or skin;diarrhea;gas;dizziness or lightheadedness;feeling of constant movement of self or surroundings;lack or loss of strength;loss of hair, temporary;sensation of spinning;uncontrolled eye movements;or",,,,,,,,
