,Unnamed: 0,Brand Name,Generic Name,Type of Treatment,Brief Description,Quantity,Location,Uninsured Cost,Typical Copay,Rating,Vendor,Effectiveness,Side Effects / Risk,Ingredients,Usage Overview,Conflicting Treatment/Therapies,Food Interaction,Frequency of Treatment,Estimated Percentage of Usage,Additional Information,Reference Link
0,0,Cipro,,,,,,,,,,,"diarrhea;bloody or black, tarry stools;burning, crawling, itching, numbness, prickling, ""pins and needles"", or tingling feelings;changes in skin color;changes in urination;chest pain or discomfort;chest tightness or heaviness;chills or fever;clumsiness or unsteadiness;confusion;continuing ringing or buzzing or other unexplained noise in the ears;coughing or spitting up blood;dizziness, faintness, or lightheadedness when getting up suddenly from a lying or sitting position;fast, irregular, pounding, or racing heartbeat or pulse;headache, severe and throbbing;hearing loss;hives or welts or skin rash;joint stiffness;large, hive-like swelling on the face, eyelids, lips, tongue, throat, hands, legs, feet, or sex organs;light-colored stools;muscle pain or stiffness;nausea and vomiting;nightmares;numbness of the hands;pain in the joints;pain or discomfort in the arms, jaw, back, or neck;painful, red lumps under the skin, mostly on the legs;pounding in the ears;puffiness or swelling of the eyelids or around the eyes, face, lips, or tongue;redness of the face, neck, arms, and occasionally, upper chest;seizures;severe abdominal or stomach pain, cramping, or burning;shakiness in the legs, arms, hands, or feet;swelling of the face, feet, or lower legs;swollen, painful, or tender lymph glands in the neck, armpit, or groin;thick, white vaginal discharge with no odor or with a mild odor;unsteadiness, trembling, or other problems with muscle control or coordination;unusual drowsiness, dullness, tiredness, weakness, or feeling of sluggishness;white patches in the mouth and/or on the tongue;yellow eyes or skin;acid or sour stomach;blistering, peeling, or loosening of the skin;bluish-colored lips, fingernails, or palms;bone pain;diarrhea, watery and severe, which may also be bloody;difficulty with breathing, chewing, or talking;double vision;excessive muscle tone;feeling of discomfort;feeling, seeing, or hearing things that are not there;increased sensitivity to pain;increased sensitivity to touch;irregular or slow heart rate;mood changes;nosebleeds;rapid heart rate;red skin lesions, often with a purple center;seeing, hearing, or feeling things that are not there;sores, ulcers, or white spots on the lips or in the mouth;unusual bleeding or bruising;unusual excitement, nervousness, or restlessness;vaginal yeast infection;runny nose;sneezing;stuffy nose;or",,,,,,,,
1,1,ciprofloxacin,,,,,,,,,,,"diarrhea;bloody or black, tarry stools;burning, crawling, itching, numbness, prickling, ""pins and needles"", or tingling feelings;changes in skin color;changes in urination;chest pain or discomfort;chest tightness or heaviness;chills or fever;clumsiness or unsteadiness;confusion;continuing ringing or buzzing or other unexplained noise in the ears;coughing or spitting up blood;dizziness, faintness, or lightheadedness when getting up suddenly from a lying or sitting position;fast, irregular, pounding, or racing heartbeat or pulse;headache, severe and throbbing;hearing loss;hives or welts or skin rash;joint stiffness;large, hive-like swelling on the face, eyelids, lips, tongue, throat, hands, legs, feet, or sex organs;light-colored stools;muscle pain or stiffness;nausea and vomiting;nightmares;numbness of the hands;pain in the joints;pain or discomfort in the arms, jaw, back, or neck;painful, red lumps under the skin, mostly on the legs;pounding in the ears;puffiness or swelling of the eyelids or around the eyes, face, lips, or tongue;redness of the face, neck, arms, and occasionally, upper chest;seizures;severe abdominal or stomach pain, cramping, or burning;shakiness in the legs, arms, hands, or feet;swelling of the face, feet, or lower legs;swollen, painful, or tender lymph glands in the neck, armpit, or groin;thick, white vaginal discharge with no odor or with a mild odor;unsteadiness, trembling, or other problems with muscle control or coordination;unusual drowsiness, dullness, tiredness, weakness, or feeling of sluggishness;white patches in the mouth and/or on the tongue;yellow eyes or skin;acid or sour stomach;blistering, peeling, or loosening of the skin;bluish-colored lips, fingernails, or palms;bone pain;diarrhea, watery and severe, which may also be bloody;difficulty with breathing, chewing, or talking;double vision;excessive muscle tone;feeling of discomfort;feeling, seeing, or hearing things that are not there;increased sensitivity to pain;increased sensitivity to touch;irregular or slow heart rate;mood changes;nosebleeds;rapid heart rate;red skin lesions, often with a purple center;seeing, hearing, or feeling things that are not there;sores, ulcers, or white spots on the lips or in the mouth;unusual bleeding or bruising;unusual excitement, nervousness, or restlessness;vaginal yeast infection;runny nose;sneezing;stuffy nose;or",,,,,,,,
2,2,Levaquin,,,,,,,,,,,"diarrhea;abdominal or stomach cramps or pain (severe);agitation;blisters;confusion;diarrhea (watery and severe) which may also be bloody;feeling that others can hear your thoughts or control your behavior;fever;pain, inflammation, or swelling in the calves of the legs, shoulders, or hands, including tendon rupture or swelling of the tendon (tendinitis);redness and swelling of the skin;seeing, hearing, or feeling things that are not there;sensation of burning on the skin;severe mood or mental changes;skin rash, itching, or redness;trembling;unusual behavior;black, tarry stools;blurred vision;burning, numbness, tingling, or painful sensation including peripheral neuropathy.;convulsions;cough;dark-colored urine;difficulty with breathing;difficulty with chewing, talking, or swallowing;drooping eyelids;fast or irregular heartbeat;general body swelling;hives;hoarseness;joint or muscle pain including tendon rupture or swelling of the tendon (tendinitis).;muscle cramps, spasms, pain, or stiffness;peeling or loosening of the skin;puffiness or swelling of the eyelids or around the eyes, face, lips, or tongue;severe dizziness;severe tiredness;tightness in the chest;unsteadiness or awkwardness;unusual bleeding or bruising;unusual tiredness or weakness;vision changes;voice changes;weakness in the arms, hands, legs, or feet including worsening of myasthenia gravis.;abdominal or stomach pain or discomfort;change in taste;constipation;dizziness;drowsiness;headache;lightheadedness;nausea;nervousness;trouble sleeping;vaginal itching and discharge;vomiting;feeling faint;feeling of warmth or heat;flushing or redness of the skin, especially on the face and neck;sweating;or",,,,,,,,
3,3,Bactrim DS,,,,,,,,,,,"abdominal or stomach pain;black, tarry stools;blistering, peeling, or loosening of the skin;changes in skin color;chest pain;chills;cough or hoarseness;dark urine;diarrhea;dizziness;fever with or without chills;general feeling of tiredness or weakness;headache;itching;joint or muscle pain;light-colored stools;loss of appetite;lower back or side pain;nausea;pain, tenderness, or swelling of the foot or leg;painful or difficult urination;pale skin;rash;red skin lesions, often with a purple center;red, irritated eyes;shortness of breath;sore throat;sores, ulcers, or white spots in the mouth or on the lips;swollen or painful glands;tightness in the chest;unpleasant breath odor;unusual bleeding or bruising;vomiting of blood;wheezing;yellow eyes or skin;abdominal or stomach tenderness;back, leg, or stomach pains;bleeding gums;blindness or vision changes;blisters, hives, or itching;bloating;blood in the urine or stools;bluish-colored lips, fingernails, or palms;burning, crawling, itching, numbness, painful, prickling, ""pins and needles"", or tingling feelings;burning of the face or mouth;chest pain;cloudy urine;confusion;constipation;continuing ringing or buzzing or other unexplained noise in the ears;convulsions;cracks in the skin;decreased frequency or amount of urine;diarrhea, watery and severe, which may also be bloody;difficulty with breathing;difficulty with swallowing;fainting spells;general body swelling;general feeling of discomfort or illness;hair loss;hearing loss;hives;increased thirst;indigestion;irregular heartbeat;large, flat, blue, or purplish patches in the skin;large, hive-like swelling on the face, eyelids, lips, tongue, throat, hands, legs, feet, or sex organs;loss of heat from the body;muscle or joint pain;nosebleeds;not able to pass urine;numbness or tingling in the hands, feet, or lips;pain or burning while urinating;pinpoint red spots on the skin;puffiness or swelling of the eyelids or around the eyes, face, lips, or tongue;raised red swellings on the skin, the buttocks, legs, or ankles;redness of the white part of the eyes;redness, swelling, or soreness of the tongue;sores, ulcers, or white spots on the lips or in the mouth;soreness of the muscles;stiff neck or back;swelling of the face, hands, legs, and feet;unsteadiness, trembling, or other problems with muscle control or coordination;unusual weight loss;weakness in the hands or feet;weakness or heaviness of the legs;weight gain;passing of gas;discouragement;feeling of constant movement of self or surroundings;feeling sad or empty;increased sensitivity of the skin to sunlight;irritability;lack of feeling or emotion;loss of interest or pleasure;nervousness;redness or other discoloration of the skin;seeing, hearing, or feeling things that are not there;sensation of spinning;severe sunburn;trouble concentrating;trouble sleeping;uncaring;weight loss",,,,,,,,
4,4,doxycycline,,,,,,,,,,,"abdominal or stomach tenderness;black, tarry stools;bloating;clay-colored stools;cough;dark urine;decreased appetite;diarrhea;diarrhea, watery and severe, which may also be bloody;difficulty with swallowing;dizziness;fast heartbeat;feeling of discomfort;fever;headache;hives, itching, puffiness or swelling of the eyelids or around the eyes, face, lips, or tongue;hives or welts, itching, or rash;increased thirst;inflammation of the joints;joint or muscle pain;large, hive-like swelling on the face, eyelids, lips, tongue, throat, hands, legs, feet, or sex organs;loss of appetite;nausea and vomiting;numbness or tingling of the face, hands, or feet;pain;redness and soreness of the eyes;redness of the skin;severe stomach pain;sore throat;sores in the mouth;stomach cramps;stomach pain or tenderness;swelling of the feet or lower legs;swollen lymph glands;tightness in the chest;unusual tiredness or weakness;unusual weight loss;yellow eyes or skin;back, leg, or stomach pains;bleeding gums;blood in the urine or stools;blurred vision;bulging soft spot on the head of an infant;change in the ability to see colors, especially blue or yellow;chest pain, discomfort, or burning;chills;cracks in the skin;decrease in vision;difficulty breathing;discoloration of the thyroid glands;double vision;general body swelling;heartburn;increased sensitivity of the skin to sunlight;loss of heat from the body;lower back or side pain;nosebleeds;pain or burning in the throat;pain with swallowing;painful or difficult urination;pale skin;pinpoint red spots on the skin;rash with flat lesions or small raised lesions on the skin;red, swollen skin;redness or other discoloration of the skin;redness, swelling, or soreness of the tongue;scaly skin;severe nausea;severe sunburn;sores, ulcers, or white spots on the lips or tongue or inside the mouth;unusual bleeding or bruising;vomiting blood;or",,,,,,,,
5,5,oxybutynin,,,,,,,,,,,"eye pain;skin rash or hives;clumsiness or unsteadiness;confusion;convulsions;dizziness;drowsiness (severe);fainting;fast, slow, or irregular heartbeat;fever;flushing or redness of the face;hallucinations (seeing, hearing, or feeling things that are not there);troubled breathing;unusual excitement, nervousness, restlessness, or irritability;acid or sour stomach;belching;decreased sweating;diarrhea;difficulty having a bowel movement (stool);drowsiness;dryness of the eyes, mouth, nose, or throat;heartburn;indigestion;runny nose;stomach discomfort, upset, or pain;blurred vision;decreased flow of breast milk;decreased sexual ability;difficulty in swallowing;feeling of warmth or heat;headache;increased sensitivity of the eyes to light;nausea or vomiting;trouble with sleeping;unusual tiredness or weakness;bloating or swelling of the face, arms, hands, lower legs, or feet;decreased interest in sexual intercourse;inability to have or keep an erection;loss in sexual ability, desire, drive, or performance;rapid weight gain;tingling of the hands or feet;unusual weight gain or loss",,,,,,,,
6,6,Bactrim,,,,,,,,,,,"abdominal or stomach pain;black, tarry stools;blistering, peeling, or loosening of the skin;changes in skin color;chest pain;chills;cough or hoarseness;dark urine;diarrhea;dizziness;fever with or without chills;general feeling of tiredness or weakness;headache;itching;joint or muscle pain;light-colored stools;loss of appetite;lower back or side pain;nausea;pain, tenderness, or swelling of the foot or leg;painful or difficult urination;pale skin;rash;red skin lesions, often with a purple center;red, irritated eyes;shortness of breath;sore throat;sores, ulcers, or white spots in the mouth or on the lips;swollen or painful glands;tightness in the chest;unpleasant breath odor;unusual bleeding or bruising;vomiting of blood;wheezing;yellow eyes or skin;abdominal or stomach tenderness;back, leg, or stomach pains;bleeding gums;blindness or vision changes;blisters, hives, or itching;bloating;blood in the urine or stools;bluish-colored lips, fingernails, or palms;burning, crawling, itching, numbness, painful, prickling, ""pins and needles"", or tingling feelings;burning of the face or mouth;chest pain;cloudy urine;confusion;constipation;continuing ringing or buzzing or other unexplained noise in the ears;convulsions;cracks in the skin;decreased frequency or amount of urine;diarrhea, watery and severe, which may also be bloody;difficulty with breathing;difficulty with swallowing;fainting spells;general body swelling;general feeling of discomfort or illness;hair loss;hearing loss;hives;increased thirst;indigestion;irregular heartbeat;large, flat, blue, or purplish patches in the skin;large, hive-like swelling on the face, eyelids, lips, tongue, throat, hands, legs, feet, or sex organs;loss of heat from the body;muscle or joint pain;nosebleeds;not able to pass urine;numbness or tingling in the hands, feet, or lips;pain or burning while urinating;pinpoint red spots on the skin;puffiness or swelling of the eyelids or around the eyes, face, lips, or tongue;raised red swellings on the skin, the buttocks, legs, or ankles;redness of the white part of the eyes;redness, swelling, or soreness of the tongue;sores, ulcers, or white spots on the lips or in the mouth;soreness of the muscles;stiff neck or back;swelling of the face, hands, legs, and feet;unsteadiness, trembling, or other problems with muscle control or coordination;unusual weight loss;weakness in the hands or feet;weakness or heaviness of the legs;weight gain;passing of gas;discouragement;feeling of constant movement of self or surroundings;feeling sad or empty;increased sensitivity of the skin to sunlight;irritability;lack of feeling or emotion;loss of interest or pleasure;nervousness;redness or other discoloration of the skin;seeing, hearing, or feeling things that are not there;sensation of spinning;severe sunburn;trouble concentrating;trouble sleeping;uncaring;weight loss",,,,,,,,
7,7,levofloxacin,,,,,,,,,,,"diarrhea;abdominal or stomach cramps or pain (severe);agitation;blisters;confusion;diarrhea (watery and severe) which may also be bloody;feeling that others can hear your thoughts or control your behavior;fever;pain, inflammation, or swelling in the calves of the legs, shoulders, or hands, including tendon rupture or swelling of the tendon (tendinitis);redness and swelling of the skin;seeing, hearing, or feeling things that are not there;sensation of burning on the skin;severe mood or mental changes;skin rash, itching, or redness;trembling;unusual behavior;black, tarry stools;blurred vision;burning, numbness, tingling, or painful sensation including peripheral neuropathy.;convulsions;cough;dark-colored urine;difficulty with breathing;difficulty with chewing, talking, or swallowing;drooping eyelids;fast or irregular heartbeat;general body swelling;hives;hoarseness;joint or muscle pain including tendon rupture or swelling of the tendon (tendinitis).;muscle cramps, spasms, pain, or stiffness;peeling or loosening of the skin;puffiness or swelling of the eyelids or around the eyes, face, lips, or tongue;severe dizziness;severe tiredness;tightness in the chest;unsteadiness or awkwardness;unusual bleeding or bruising;unusual tiredness or weakness;vision changes;voice changes;weakness in the arms, hands, legs, or feet including worsening of myasthenia gravis.;abdominal or stomach pain or discomfort;change in taste;constipation;dizziness;drowsiness;headache;lightheadedness;nausea;nervousness;trouble sleeping;vaginal itching and discharge;vomiting;feeling faint;feeling of warmth or heat;flushing or redness of the skin, especially on the face and neck;sweating;or",,,,,,,,
8,8,sulfamethoxazole / trimethoprim,,,,,,,,,,,"abdominal or stomach pain;black, tarry stools;blistering, peeling, or loosening of the skin;changes in skin color;chest pain;chills;cough or hoarseness;dark urine;diarrhea;dizziness;fever with or without chills;general feeling of tiredness or weakness;headache;itching;joint or muscle pain;light-colored stools;loss of appetite;lower back or side pain;nausea;pain, tenderness, or swelling of the foot or leg;painful or difficult urination;pale skin;rash;red skin lesions, often with a purple center;red, irritated eyes;shortness of breath;sore throat;sores, ulcers, or white spots in the mouth or on the lips;swollen or painful glands;tightness in the chest;unpleasant breath odor;unusual bleeding or bruising;vomiting of blood;wheezing;yellow eyes or skin;abdominal or stomach tenderness;back, leg, or stomach pains;bleeding gums;blindness or vision changes;blisters, hives, or itching;bloating;blood in the urine or stools;bluish-colored lips, fingernails, or palms;burning, crawling, itching, numbness, painful, prickling, ""pins and needles"", or tingling feelings;burning of the face or mouth;chest pain;cloudy urine;confusion;constipation;continuing ringing or buzzing or other unexplained noise in the ears;convulsions;cracks in the skin;decreased frequency or amount of urine;diarrhea, watery and severe, which may also be bloody;difficulty with breathing;difficulty with swallowing;fainting spells;general body swelling;general feeling of discomfort or illness;hair loss;hearing loss;hives;increased thirst;indigestion;irregular heartbeat;large, flat, blue, or purplish patches in the skin;large, hive-like swelling on the face, eyelids, lips, tongue, throat, hands, legs, feet, or sex organs;loss of heat from the body;muscle or joint pain;nosebleeds;not able to pass urine;numbness or tingling in the hands, feet, or lips;pain or burning while urinating;pinpoint red spots on the skin;puffiness or swelling of the eyelids or around the eyes, face, lips, or tongue;raised red swellings on the skin, the buttocks, legs, or ankles;redness of the white part of the eyes;redness, swelling, or soreness of the tongue;sores, ulcers, or white spots on the lips or in the mouth;soreness of the muscles;stiff neck or back;swelling of the face, hands, legs, and feet;unsteadiness, trembling, or other problems with muscle control or coordination;unusual weight loss;weakness in the hands or feet;weakness or heaviness of the legs;weight gain;passing of gas;discouragement;feeling of constant movement of self or surroundings;feeling sad or empty;increased sensitivity of the skin to sunlight;irritability;lack of feeling or emotion;loss of interest or pleasure;nervousness;redness or other discoloration of the skin;seeing, hearing, or feeling things that are not there;sensation of spinning;severe sunburn;trouble concentrating;trouble sleeping;uncaring;weight loss",,,,,,,,
9,9,Doxy 100,,,,,,,,,,,"abdominal or stomach tenderness;bloating;clay-colored stools;cough;dark urine;decreased appetite;diarrhea;diarrhea, watery and severe, which may also be bloody;difficulty with swallowing;dizziness;fast heartbeat;feeling of discomfort;fever;headache;hives, itching, puffiness or swelling of the eyelids or around the eyes, face, lips, or tongue;hives or welts, itching, or rash;increased thirst;inflammation of the joints;joint or muscle pain;large, hive-like swelling on the face, eyelids, lips, tongue, throat, hands, legs, feet, or sex organs;loss of appetite;nausea and vomiting;numbness or tingling of the face, hands, or feet;pain;redness and soreness of the eyes;redness of the skin;sore throat;sores in the mouth;stomach cramps;stomach pain or tenderness;swelling of the feet or lower legs;swollen lymph glands;tightness in the chest;unusual tiredness or weakness;unusual weight loss;yellow eyes or skin;back, leg, or stomach pains;black, tarry stools;bleeding gums;blood in the urine or stools;blurred vision;bulging soft spot on the head of an infant;change in the ability to see colors, especially blue or yellow;chest pain, discomfort, or burning;chills;cracks in the skin;decrease in vision;difficulty breathing;discoloration of the thyroid glands;double vision;general body swelling;heartburn;increased sensitivity of the skin to sunlight;loss of heat from the body;lower back or side pain;nosebleeds;pain or burning in the throat;pain with swallowing;painful or difficult urination;pale skin;pinpoint red spots on the skin;rash with flat lesions or small raised lesions on the skin;red, swollen skin;redness or other discoloration of the skin;redness, swelling, or soreness of the tongue;scaly skin;severe nausea;severe stomach pain;severe sunburn;sores, ulcers, or white spots on the lips or tongue or inside the mouth;unusual bleeding or bruising;vomiting blood;or",,,,,,,,
10,10,Keflex,,,,,,,,,,,"diarrhea;abdominal or stomach pain;blistering, peeling, or loosening of the skin;chills;clay-colored stools;cough;dark urine;diarrhea;dizziness;fever;general tiredness and weakness;headache;itching or rash;joint or muscle pain;light-colored stools;loss of appetite;nausea and vomiting;red skin lesions, often with a purple center;red, irritated eyes;sore throat;sores, ulcers, or white spots in the mouth or on the lips;unpleasant breath odor;unusual tiredness or weakness;upper right abdominal or stomach pain;vomiting of blood;yellow eyes or skin;abdominal or stomach cramps or tenderness;back or leg pains;black, tarry stools;bleeding gums;bloating;blood in the urine or stools;chest pain;coughing up blood;diarrhea, watery and severe, which may also be bloody;difficulty with breathing or swallowing;fast heartbeat;general body swelling;hives;increased menstrual flow or vaginal bleeding;increased thirst;large, hive-like swelling on the face, eyelids, lips, tongue, throat, hands, legs, feet, or sex organs;loss of appetite;nosebleeds;pain;painful or difficult urination;pale skin;paralysis;pinpoint red spots on the skin;prolonged bleeding from cuts;puffiness or swelling of the eyelids or around the eyes, face, lips, or tongue;red or black, tarry stools;red or dark brown urine;swollen or painful glands;tightness in the chest;unusual bleeding or bruising;unusual weight loss;watery or bloody diarrhea;acid or sour stomach;anxiety;belching;burning feeling in the chest or stomach;difficulty with moving;dry mouth;heartburn;hyperventilation;indigestion;irregular heartbeats;irritability;itching of the vagina or genital area;muscle pain or stiffness;nervousness;pain during sexual intercourse;pain, swelling, or redness in the joints;redness of the skin;restlessness;seeing, hearing, or feeling things that are not there;shaking;stomach upset;trouble sleeping;white or brownish vaginal discharge;or",,,,,,,,
