17,17,ritonavir,,,,,,,,,,,"fainting;feeling faint, dizzy, or lightheaded;feeling of warmth or heat;flushing or redness of the skin, especially on the face and neck;headache;sweating;confusion;dehydration;dry or itchy skin;fruity mouth odor;increased hunger;increased thirst;increased urination;nausea;vomiting;weight loss;bloating;chills;constipation;convulsions;cough;darkened urine;decreased urination;difficulty with breathing;dry mouth;fast heartbeat;fever;hives or welts, itching, or skin rash;increase in heart rate;indigestion;large, hive-like swelling on the face, eyelids, lips, tongue, throat, hands, legs, feet, or sex organs;loss of appetite;loss of bladder control;muscle spasm or jerking of all extremities;noisy breathing;pains in the stomach, side, or abdomen, possibly radiating to the back;rapid breathing;redness of the skin;sudden loss of consciousness;sunken eyes;thirst;tightness in the chest;unusual tiredness or weakness;wrinkled skin;yellow eyes or skin;acid or sour stomach;belching;burning, crawling, itching, numbness, prickling, ""pins and needles"", or tingling feelings;change in sense of taste;diarrhea;dizziness;general feeling of discomfort or illness;heartburn;lack or loss of strength;sleepiness or unusual drowsiness;trouble sleeping;weakness;body aches or pain;congestion;delusions;dementia;difficulty with moving;discouragement;dryness or soreness of the throat;excess air or gas in the stomach or intestines;fear;feeling sad or empty;full feeling;hoarseness;increased urge to urinate during the night;irritability;lack of appetite;loss of interest or pleasure;mood or mental changes;muscle pain or stiffness;nervousness;pain in the joints or in unspecified location;passing gas;runny nose;tender, swollen glands in the neck;throat irritation;tiredness;trouble concentrating;trouble swallowing;voice changes;waking to urinate at night;gaining weight around your neck, upper back, breast, face, or waist;or",,,,,,,,
18,18,Ziagen,,,,,,,,,,,"abdominal or stomach pain;cough;diarrhea;difficult or labored breathing;fever;headache;joint or muscle pain;nausea;numbness or tingling of the hands, feet, or face;redness and soreness of the eyes;skin rash;sore throat;sores in the mouth;swelling of the feet or lower legs;unusual feeling of discomfort or illness;unusual tiredness;vomiting;abdominal or stomach swelling;decreased appetite;fast, shallow breathing;sleepiness;blistering, peeling, or loosening of the skin;chest pain or discomfort;chills;dark urine;itching;light-colored stools;pain or discomfort in the arms, jaw, back, or neck;red, irritated eyes;red skin lesions, often with a purple center;sores, ulcers, or white spots in the mouth or on the lips;sweating;unusual weakness;upper right abdominal or stomach pain;yellow eyes and skin;headache;trouble sleeping;breast enlargement;buffalo hump;central obesity;facial wasting;gaining weight around your neck, upper back, breast, face, or waist;peripheral wasting;or",,,,,,,,
19,19,abacavir,,,,,,,,,,,"abdominal or stomach pain;cough;diarrhea;difficult or labored breathing;fever;headache;joint or muscle pain;nausea;numbness or tingling of the hands, feet, or face;redness and soreness of the eyes;skin rash;sore throat;sores in the mouth;swelling of the feet or lower legs;unusual feeling of discomfort or illness;unusual tiredness;vomiting;abdominal or stomach swelling;decreased appetite;fast, shallow breathing;sleepiness;blistering, peeling, or loosening of the skin;chest pain or discomfort;chills;dark urine;itching;light-colored stools;pain or discomfort in the arms, jaw, back, or neck;red, irritated eyes;red skin lesions, often with a purple center;sores, ulcers, or white spots in the mouth or on the lips;sweating;unusual weakness;upper right abdominal or stomach pain;yellow eyes and skin;headache;trouble sleeping;breast enlargement;buffalo hump;central obesity;facial wasting;gaining weight around your neck, upper back, breast, face, or waist;peripheral wasting;or",,,,,,,,
20,20,tenofovir,,,,,,,,,,,"chest pain;cough;fever or chills;tightness in the chest;troubled breathing;abdominal or stomach discomfort;decreased appetite;diarrhea;fast, shallow breathing;general feeling of discomfort;muscle pain or cramping;unusual tiredness or weakness;agitation;bone pain;changes in urination;confusion;convulsions or seizures;depression;fast heartbeat;increased blood pressure;increased thirst;muscle twitching;pains in the stomach, side, or abdomen, possibly radiating to the back;stupor;swelling of the face, fingers, or lower legs;vomiting;weight gain;yellow eyes or skin;back pain;lack or loss of strength;pain;redness of the skin;skin rash, itching skin, hives or welts;burning, crawling, itching, numbness, prickling, ""pins and needles"", or tingling feelings;heartburn or indigestion;joint pain or swelling;muscle pains or stiffness;passing of gas;redistribution or accumulation of body fat;weight loss;or",,,,,,,,
21,21,Viramune,,,,,,,,,,,"black, tarry stools;blistering, peeling, or loosening of the skin;chills;clay-colored stools;cough;dark urine;diarrhea;fever;general tiredness and weakness;itching;joint or muscle pain;light-colored stools;lower back or side pain;nausea and vomiting;painful or difficult urination;pale skin;red, irritated eyes;red skin lesions, often with a purple center;shortness of breath;skin rash;sore throat;sores, ulcers, or white spots in the mouth or on the lips;troubled breathing with exertion;unusual bleeding or bruising;unusual tiredness or weakness;upper right abdominal or stomach pain;yellow eyes and skin;decreased appetite;hives;loss of appetite;swelling of the feet or lower legs;abdominal or stomach pain;pain, numbness, or tingling of the hands, arms, legs, or feet;sleepiness or unusual drowsiness;tingling, burning, or prickly sensations;chest pain;cough;decrease in weight;dizziness or lightheadedness;feeling of constant movement of self or surroundings;headache;pain in the ankles or knees;painful, red lumps under the skin, mostly on the legs;sensation of spinning;trouble sleeping;difficulty with moving;muscle pain or stiffness;pain in the joints;or",,,,,,,,
22,22,darunavir,,,,,,,,,,,"blurred vision;dry mouth;flushed, dry skin;fruit-like breath odor;increased hunger;increased thirst;increased urination;skin rash;sweating;troubled breathing;unexplained weight loss;unusual tiredness or weakness;abdominal or stomach pain or tenderness;acid or sour stomach;belching;blistering, peeling, or loosening of the skin;bloating;chills;clay colored stools;constipation;cough;dark urine;decreased appetite;diarrhea;difficulty with moving;dizziness;excess air or gas in the stomach or intestines;fast heartbeat;fever;full feeling;headache;heartburn;indigestion;itching;joint or muscle pain;lack or loss of strength;light-colored stools;loss of appetite;muscle aching or cramping;nausea and vomiting;passing gas;red skin lesions, often with a purple center;red, irritated eyes;sore throat;sores, ulcers, or white spots in the mouth or on the lips;swelling of the feet or lower legs;swollen joints;unpleasant breath odor;vomiting of blood;yellow eyes or skin;muscle pain or stiffness;swelling or puffiness of the face;stuffy or runny nose;gaining weight around your neck, upper back, breast, face, or waist;or",,,,,,,,
23,23,efavirenz / emtricitabine / tenofovir,,,,,,,,,,,"abdominal or stomach pain or tenderness;blistering, peeling, or loosening of the skin;body aches or pain;clay-colored stools;cough;dark urine;ear congestion;fever or chills;headache;itching;loss of voice;muscle aches;nausea and vomiting;severe skin rash;sore throat;swelling of the feet or lower legs;tightness of the chest;trouble concentrating;yellow eyes or skin;diarrhea;dizziness;unusual tiredness or weakness;abnormal dreams;decreased appetite;discouragement;feeling sad or empty;irritability;loss of appetite;loss of interest or pleasure;mild rash;pain or tenderness around the eyes and cheekbones;sleepiness;trouble sleeping;unusual drowsiness",,,,,,,,
24,24,efavirenz,,,,,,,,,,,"depression;skin rash or itching;blood in the urine;difficult or painful urination;pain in the lower back or side;abdominal or stomach pain;blistering;changes in vision;clumsiness or unsteadiness;confusion;convulsions (seizures);cough;dark urine;delusions;double vision;fainting;fast or pounding heartbeat;fever or chills;headache (severe and throbbing);hives;inappropriate behavior;loss of appetite;mood or mental changes (severe);muscle cramps or pain;nausea or vomiting;nerve pain;open sores;pain, tenderness, bluish color, or swelling of the leg or foot;rapid weight gain;seeing, hearing, or feeling things that are not there;sense of constant movement of self or surroundings;sores, ulcers, or white spots in the mouth or on the lips;speech disorder;swelling or tenderness in the upper abdominal or stomach area;swelling of the hands, arms, feet, or legs;thoughts of suicide or attempts at suicide;tightness in the chest;tingling, burning, numbness, or pain in the hands, arms, feet, or legs;tingling, burning, or prickling sensations;tremor;troubled breathing;unusual tiredness;weight loss;yellow eyes or skin;actions that are out of control;attack, assault, or force;continuing vomiting;delusions of persecution, mistrust, suspiciousness, or combativeness;difficult or labored breathing;early appearance of redness or swelling of the skin;general feeling of tiredness or weakness;irregular heartbeat recurrent;irritability;late appearance of rash with or without weeping blisters that become crusted, especially in sun-exposed areas of the skin, may extend to unexposed areas;light-colored stools;nervousness;talking, feeling, and acting with excitement;diarrhea;dizziness;drowsiness;headache;increased sweating;poor concentration;trouble sleeping;abnormally decreased sensitivity, particularly to touch;agitation or anxiety;belching;change in sense of taste or smell;dry mouth;excessive gas;false sense of well-being;flaking and falling off of the skin;flushing;general feeling of discomfort;heartburn;indigestion;joint pain;lack of feeling or emotion;loss of hair;loss of memory;loss of sense of reality;mood changes;pain;painful, red, hot, or irritated hair follicles;ringing in the ears;stomach discomfort;unusual dreams;weakness;difficulty having a bowel movement (stool);discoloration of the fingernails or toenails;dizziness or lightheadedness;feeling of constant movement of self or surroundings;increased amount of fat in the upper back and neck, or around the chest and stomach area;lose fat from the legs, arms, and face;sensation of spinning;swelling of the breasts or breast soreness in both females and males;or",,,,,,,,
25,25,abacavir / lamivudine,,,,,,,,,,,"abdominal or stomach pain;cough;diarrhea;fever;headache;nausea;numbness or tingling of the face, feet, or hands;pain in the joints;pain in the muscles;shortness of breath;skin rash;sore throat;swelling of the feet or lower legs;unusual feeling of discomfort or illness;unusual tiredness or weakness;vomiting;blistering, peeling, or loosening of the skin;bloating;burning, numbness, tingling, or painful sensations;chest pain;chills;constipation;convulsions;dark urine;decreased appetite;diarrhea;difficulty with swallowing;dizziness;fast heartbeat;fast, shallow breathing;feeling of fullness;general feeling of discomfort;hives or welts, itching;indigestion;light-colored stools;loss of appetite;loss of bladder control;muscle cramping;muscle spasm or jerking of all extremities;pains in the stomach, side, or abdomen, possibly radiating to the back;pale skin;puffiness or swelling of the eyelids or around the eyes, face, lips, or tongue;red, irritated eyes;redness of the skin;red skin lesions, often with a purple center;sleepiness;sores, ulcers, or white spots on the lips or in the mouth;sudden loss of consciousness;swollen, painful, or tender lymph glands in the neck, armpit, or groin;tightness in the chest;troubled breathing with exertion;unsteadiness or awkwardness;unusual bleeding or bruising;upper right abdominal or stomach pain;weakness in the arms, hands, legs, or feet;yellow eyes and skin;abnormal dreams;burning feeling in the chest or stomach;fear or nervousness;feeling of constant movement of self or surroundings;lightheadedness;sensation of spinning;severe and throbbing headache;stomach upset;tenderness in the stomach area;trouble sleeping;abnormal breathing sounds;blurred vision;burning, crawling, itching, numbness, prickling, ""pins and needles"", or tingling feelings;dry mouth;flushed, dry skin;fruit-like breath odor;gaining weight around your neck, upper back, breast, face, or waist;hair loss;increased hunger;increased thirst;increased urination;muscle weakness;sweating;swelling or inflammation of the mouth;thinning of the hair;unexplained weight loss",,,,,,,,
26,26,Combivir,,,,,,,,,,,"chills;fever;pale skin;sore throat;unusual tiredness or weakness;abdominal or stomach pain (severe);burning, tingling, numbness, or pain in the hands, arms, feet, or legs;muscle tenderness and weakness;nausea;skin rash;vomiting;yellow eyes or skin;blistering, peeling, or loosening of the skin;canker sores;chest discomfort or pain;chills;convulsions;dark urine;decreased appetite;difficulty with breathing;difficulty with swallowing;dizziness;faintness;fast, irregular, or pounding heartbeat;fast, shallow breathing;feeling of fullness;general feeling of discomfort;general tiredness and weakness;hives or welts;itching;itching, puffiness, or swelling of the eyelids or around the eyes, face, lips, or tongue;jerking of all extremities;joint or muscle pain;light-colored stools;loss of bladder control;muscle pain, spasms, stiffness, or cramping;red skin lesions often with a purple center;red, irritated eyes;redness, soreness, or itching skin;sensation of pins and needles;shortness of breath;sleepiness;sores, ulcers, or white spots in the mouth or on the lips or tongue;sores, welting or blisters;stabbing pain;sudden loss of consciousness;swelling of the feet or lower legs;tingling, burning, numbness, or pain in the hands, arms, feet, or legs;tightness in the chest;troubled with breathing;unsteadiness or awkwardness;wheezing;headache;abdominal or stomach pain (mild);coughing;decreased appetite;diarrhea;dizziness;trouble in sleeping;abnormal breathing;blurred vision;body fat redistribution or accumulation;darkening of the skin and mucous membranes;dry mouth;fatigue;flushed, dry skin;fruit-like breath odor;hair loss;increased hunger;increased thirst;increased urination;sweating;swelling of the breasts or breast soreness in both females and males;swollen, painful, or tender lymph glands in the neck, armpit, or groin;thinning of the hair;troubled breathing, unexplained",,,,,,,,
27,27,Crixivan,,,,,,,,,,,blood in the urine;sharp back pain just below the ribs;abdominal or stomach pain;chills;clay-colored stools;dark urine;dizziness;fever;headache;itching;loss of appetite;nausea;rash;unpleasant breath odor;unusual tiredness or weakness;vomiting of blood;yellow eyes or skin;confusion;dehydration;dry or itchy skin;fruity mouth odor;increased hunger;increased thirst;increased urination;pale skin;troubled breathing with exertion;unusual bleeding or bruising;unusual tiredness or weakness;vomiting;weight loss;change in sense of taste;diarrhea;difficulty with sleeping;generalized weakness;acid or sour stomach;acid regurgitation;belching;cough;general feeling of discomfort or illness;heartburn;increase in appetite;indigestion;sleepiness;or,,,,,,,,
28,28,Emtriva,,,,,,,,,,,"burning, crawling, itching, numbness, prickling, ""pins and needles, or tingling feelings;chest pain or tightness;cough or hoarseness;fever or chills;lower back or side pain;painful or difficult urination;pale skin;troubled breathing with exertion;unusual bleeding or bruising;unusual tiredness or weakness;sensation of pins and needles;stabbing pain;abdominal or stomach pain;abnormal dreams;darkening or redness of the skin;depression;dizziness;earache;headache;heartburn or indigestion;itching skin;puffiness or swelling of the eyelids or around the eyes, face, lips, or tongue;rash, hives, or welts on the skin;spots on your skin resembling a blister or pimple;vomiting;joint pain or swelling;muscle stiffness;trouble sleeping;unsteadiness or awkwardness;weakness in the arms, hands, legs, or feet;or",,,,,,,,
29,29,Genvoya,,,,,,,,,,,"abdominal or stomach discomfort;bloody urine;bone pain;dark urine;decreased appetite;decreased frequency or amount of urine;diarrhea;fast, shallow breathing;general feeling of discomfort;increased thirst;light-colored stools;loss of appetite;lower back or side pain;muscle pain or cramping;nausea and vomiting;pain in the arms or legs;right upper abdominal or stomach pain and fullness;sleepiness;swelling of the face, fingers, or lower legs;troubled breathing;unusual tiredness or weakness;weight gain;yellow eyes and skin;headache",,,,,,,,
30,30,Lexiva,,,,,,,,,,,"severe skin rash;abdominal or stomach pain;blurred vision;depression;dry mouth;flushed, dry skin;fruit-like breath odor;increased hunger;increased thirst;increased urination;mood or mental changes;nausea;sweating;troubled breathing;unexplained weight loss;unusual tiredness or weakness;vomiting;back, leg, or stomach pains;bleeding gums;blistering, peeling, or loosening of the skin;chills;cough;dark urine;diarrhea;difficulty with breathing;fever;general body swelling;itching;joint or muscle pain;loss of appetite;nosebleeds;pale skin;red skin lesions often with a purple center;red, irritated eyes;sore throat;sores, ulcers, or white spots in the mouth or on the lips;yellowing of the eyes or skin;large, hive-like swelling on the face, eyelids, lips, tongue, throat, hands, legs, feet, or sex organs;mild or moderate rash;burning or prickling sensation around the mouth;headache;breast enlargement;buffalo hump;increased fat deposits on the face, neck, and trunk;obesity;or",,,,,,,,
31,31,raltegravir,,,,,,,,,,,"blood in the urine;burning or stinging of the skin;dark urine;decreased frequency or amount of urine;fast heartbeat;fever;general tiredness and weakness;hoarseness;increased thirst;irritation;joint pain, stiffness, or swelling;light-colored stools;loss of appetite;lower back or side pain;nausea and vomiting;pain in the groin or genitals;painful blisters on the trunk of the body;painful cold sores or blisters on the lips, nose, eyes, or genitals;rash, hives, or itching;redness of the skin;sharp back pain just below the ribs;swelling of the eyelids, face, lips, hands, lower legs, or feet;tightness in the chest;troubled breathing or swallowing;unusual tiredness or weakness;upper right abdominal or stomach pain;weight gain;yellow eyes and skin;black, tarry stools;bleeding gums;headache;muscle cramps or spasms;muscle pain or stiffness;pinpoint red spots on the skin;stomach pain, continuing;unusual bleeding or bruising;dizziness;trouble sleeping;acid or sour stomach;belching;depression;heartburn;indigestion;lack or loss of strength;stomach discomfort, upset, or pain;tenderness in the stomach area;thoughts of killing oneself or changes in behavior;delusions of persecution, mistrust, suspiciousness, or combativeness;diarrhea;fear or nervousness;or",,,,,,,,
32,32,zidovudine,,,,,,,,,,,"fever, chills, or sore throat;pale skin;unusual tiredness or weakness;abdominal or stomach discomfort;confusion;convulsions (seizures);diarrhea;fast, shallow breathing;general feeling of discomfort;loss of appetite;mood or mental changes;muscle pain, tenderness, weakness, or cramping;nausea;shortness of breath;sleepiness;difficulty having a bowel movement (stool);general feeling of discomfort or illness;headache (severe);lack or loss of strength;muscle soreness;trouble with sleeping;vomiting;weight loss;bluish-brown colored bands on nails;changes in skin color;acid or sour stomach;belching;burning, tingling, numbness, or pain in the hands, arms, feet, or legs;heartburn;indigestion;muscle or bone pain;sensation of pins and needles, stabbing pain;stomach cramps;stomach pain;yellow eyes or skin;or",,,,,,,,
33,33,atazanavir,,,,,,,,,,,"abdominal or stomach discomfort, fullness, or pain;bloating;blood in the urine;blurred vision;chest pain or discomfort;chills;clay-colored stools;constipation;dark-colored urine;decreased appetite;diarrhea;dizziness or lightheadedness;dry mouth;fainting;fast heartbeat;fast, shallow breathing;fever;flushed, dry skin;fruit-like breath odor;gaseous abdominal or stomach pain;general feeling of discomfort;headache;hives, itching, or skin rash;increased hunger;increased thirst;increased urination;indigestion;irregular heartbeat;loss of appetite;loss of consciousness;muscle pain or cramping;nausea;pain in the groin or genitals;pain in the stomach, side, or abdomen, possibly radiating to the back;recurrent fever;severe nausea or vomiting;sharp back pain just below the ribs;sleepiness;slow or irregular heartbeat;stomachache;sweating;swelling;tightness in the chest;trouble with breathing;unexplained weight loss;unpleasant breath odor;unusual tiredness or weakness;vomiting;vomiting of blood;yellow eyes or skin;back pain;cough, increased;discouragement;extra body fat;feeling sad or empty;irritability;loss of interest or pleasure;trouble concentrating;trouble sleeping;burning, numbness, tingling, or painful sensations;difficulty with moving;muscle stiffness;pain;pain in the joints;unsteadiness or awkwardness;weakness in the arms, hands, legs, or feet;hair loss or thinning of the hair;rash with flat lesions or small raised lesions on the skin;or",,,,,,,,
34,34,dolutegravir,,,,,,,,,,,"black, tarry stools;blistering or peeling skin;bloody urine;burning, dry, or itching eyes;chest pain;chills;cough;dark urine;decreased frequency or amount of urine;discharge or excessive tearing;fever;general feeling of discomfort or illness;general tiredness and weakness;increased thirst;large, hive-like swelling on the face, eyelids, lips, tongue, throat, hands, legs, feet, or sex organs;light-colored stools;loss of appetite;lower back or side pain;muscle or joint aches;nausea and vomiting;painful or difficult urination;rash with fever;redness, pain, swelling of the eye, eyelid, or inner lining of the eyelid;severe rash;sore throat;sores, ulcers, or white spots on the lips or in the mouth;swelling of the face, fingers, or lower legs;swollen glands;troubled breathing;unusual bleeding or bruising;unusual tiredness or weakness;upper right abdominal or stomach pain;weight gain;yellow eyes and skin;abdominal or stomach pain or discomfort;headache;itching skin;trouble sleeping;abnormal dreams;diarrhea;dizziness;weight gain around your neck, upper back, breast, face, or waist",,,,,,,,
35,35,Epivir-HBV,,,,,,,,,,,"abdominal or stomach discomfort;black, tarry stools;bleeding gums;bloating;blood in the urine or stools;chills;constipation;cough;darkened urine;decreased appetite;diarrhea;difficulty with swallowing;dizziness;fast heartbeat;fast, shallow breathing;fever;general feeling of discomfort;general tiredness and weakness;indigestion;light-colored stools;loss of appetite;muscle cramps or spasms;muscle pain or stiffness;nausea and vomiting;pains in the stomach, side, or abdomen, possibly radiating to the back;pinpoint red spots on the skin;puffiness or swelling of the eyelids or around the eyes, face, lips, or tongue;right upper abdominal or stomach pain and fullness;skin rash, hives, or itching;sleepiness;tightness in the chest;unusual bleeding or bruising;unusual tiredness or weakness;upper right abdominal or stomach pain;yellow eyes or skin;acid or sour stomach;belching;burning, tingling, numbness or pain in the hands, arms, feet, or legs;depression;general feeling of discomfort or illness;headache;heartburn;indigestion;muscle or joint pain;sensation of pins and needles;sore throat;stabbing pain;stomach discomfort, upset, or pain;stuffy or runny nose;trouble sleeping;weight loss;blurred vision;dry mouth;flushed, dry skin;fruit-like breath odor;hair loss or thinning of the hair;increased hunger;increased thirst;increased urination;pale skin;sweating;troubled breathing with exertion;unexplained weight loss;weight gain around your neck, upper back, breast, face, or waist;or",,,,,,,,
36,36,Retrovir,,,,,,,,,,,"fever, chills, or sore throat;pale skin;unusual tiredness or weakness;abdominal or stomach discomfort;confusion;convulsions (seizures);diarrhea;fast, shallow breathing;general feeling of discomfort;loss of appetite;mood or mental changes;muscle pain, tenderness, weakness, or cramping;nausea;shortness of breath;sleepiness;difficulty having a bowel movement (stool);general feeling of discomfort or illness;headache (severe);lack or loss of strength;muscle soreness;trouble with sleeping;vomiting;weight loss;bluish-brown colored bands on nails;changes in skin color;acid or sour stomach;belching;burning, tingling, numbness, or pain in the hands, arms, feet, or legs;heartburn;indigestion;muscle or bone pain;sensation of pins and needles, stabbing pain;stomach cramps;stomach pain;yellow eyes or skin;or",,,,,,,,
