,Unnamed: 0,Brand Name,Generic Name,Type of Treatment,Brief Description,Quantity,Location,Uninsured Cost,Typical Copay,Rating,Vendor,Effectiveness,Side Effects / Risk,Ingredients,Usage Overview,Conflicting Treatment/Therapies,Food Interaction,Frequency of Treatment,Estimated Percentage of Usage,Additional Information,Reference Link
0,0,tranexamic acid,,,,,,,,,,,"pale skin;trouble breathing with exertion;unusual bleeding or bruising;unusual tiredness or weakness;anxiety;change in vision;chest pain or tightness;confusion;cough;difficulty with swallowing;dizziness or lightheadedness;fainting;fast heartbeat;numbness of the hands;pain, redness, or swelling in the arm or leg;puffiness or swelling of the eyelids or around the eyes, face, lips, or tongue;skin rash, hives, or itching;abdominal or stomach pain, discomfort, or tenderness;chills or fever;difficulty with moving;headache, severe and throbbing;joint or back pain;muscle aching or cramping;muscle pains or stiffness;stuffy or runny nose;diarrhea;nausea;vomiting;or",,,,,,,,
1,1,Cyklokapron,,,,,,,,,,,"pale skin;trouble breathing with exertion;unusual bleeding or bruising;unusual tiredness or weakness;anxiety;change in vision;chest pain or tightness;confusion;cough;difficulty with swallowing;dizziness or lightheadedness;fainting;fast heartbeat;numbness of the hands;pain, redness, or swelling in the arm or leg;puffiness or swelling of the eyelids or around the eyes, face, lips, or tongue;skin rash, hives, or itching;abdominal or stomach pain, discomfort, or tenderness;chills or fever;difficulty with moving;headache, severe and throbbing;joint or back pain;muscle aching or cramping;muscle pains or stiffness;stuffy or runny nose;diarrhea;nausea;vomiting;or",,,,,,,,
2,2,Zoladex,,,,,,,,,,,"fast or irregular heartbeat;bone, muscle, or joint pain;changes in skin color of the face;fainting;fast or irregular breathing;numbness or tingling of the hands or feet;puffiness or swelling of the eyelids or around the eyes;skin rash, hives, or itching;sudden, severe decrease in blood pressure and collapse;tightness in the chest;troubled breathing;anxiety;deepening of voice;increased hair growth;mental depression;mood changes;pain in the chest;pain in the groin or legs (especially in the calves of the legs);sudden sweating and feelings of warmth (also called hot flashes);blurred vision;burning, itching, redness, or swelling at the place of injection;decreased interest in sexual intercourse;dizziness;headache;nausea or vomiting;swelling and increased tenderness of the breasts;swelling of the feet or lower legs;trouble sleeping;weight gain;light, irregular vaginal bleeding;stopping of menstrual periods;burning, dryness, or itching of the vagina;pelvic pain;bone pain;constipation;decreased size of the testicles;inability to have or keep an erection",,,,,,,,
3,3,Hyskon,,,,,,,,,,,,,,,,,,,
4,4,Dextran 70 6% in 5% Dextrose,,,,,,,,,,,,,,,,,,,
5,5,goserelin,,,,,,,,,,,"fast or irregular heartbeat;bone, muscle, or joint pain;changes in skin color of the face;fainting;fast or irregular breathing;numbness or tingling of the hands or feet;puffiness or swelling of the eyelids or around the eyes;skin rash, hives, or itching;sudden, severe decrease in blood pressure and collapse;tightness in the chest;troubled breathing;anxiety;deepening of voice;increased hair growth;mental depression;mood changes;pain in the chest;pain in the groin or legs (especially in the calves of the legs);sudden sweating and feelings of warmth (also called hot flashes);blurred vision;burning, itching, redness, or swelling at the place of injection;decreased interest in sexual intercourse;dizziness;headache;nausea or vomiting;swelling and increased tenderness of the breasts;swelling of the feet or lower legs;trouble sleeping;weight gain;light, irregular vaginal bleeding;stopping of menstrual periods;burning, dryness, or itching of the vagina;pelvic pain;bone pain;constipation;decreased size of the testicles;inability to have or keep an erection",,,,,,,,
6,6,"dextran, high molecular weight",,,,,,,,,,,,,,,,,,,
7,7,,,,,,,,,,,,,,,,,,,,
