,Unnamed: 0,Brand Name,Generic Name,Type of Treatment,Brief Description,Quantity,Location,Uninsured Cost,Typical Copay,Rating,Vendor,Effectiveness,Side Effects / Risk,Ingredients,Usage Overview,Conflicting Treatment/Therapies,Food Interaction,Frequency of Treatment,Estimated Percentage of Usage,Additional Information,Reference Link
0,0,ciprofloxacin,,,,,,,,,,,"diarrhea;bloody or black, tarry stools;burning, crawling, itching, numbness, prickling, ""pins and needles"", or tingling feelings;changes in skin color;changes in urination;chest pain or discomfort;chest tightness or heaviness;chills or fever;clumsiness or unsteadiness;confusion;continuing ringing or buzzing or other unexplained noise in the ears;coughing or spitting up blood;dizziness, faintness, or lightheadedness when getting up suddenly from a lying or sitting position;fast, irregular, pounding, or racing heartbeat or pulse;headache, severe and throbbing;hearing loss;hives or welts or skin rash;joint stiffness;large, hive-like swelling on the face, eyelids, lips, tongue, throat, hands, legs, feet, or sex organs;light-colored stools;muscle pain or stiffness;nausea and vomiting;nightmares;numbness of the hands;pain in the joints;pain or discomfort in the arms, jaw, back, or neck;painful, red lumps under the skin, mostly on the legs;pounding in the ears;puffiness or swelling of the eyelids or around the eyes, face, lips, or tongue;redness of the face, neck, arms, and occasionally, upper chest;seizures;severe abdominal or stomach pain, cramping, or burning;shakiness in the legs, arms, hands, or feet;swelling of the face, feet, or lower legs;swollen, painful, or tender lymph glands in the neck, armpit, or groin;thick, white vaginal discharge with no odor or with a mild odor;unsteadiness, trembling, or other problems with muscle control or coordination;unusual drowsiness, dullness, tiredness, weakness, or feeling of sluggishness;white patches in the mouth and/or on the tongue;yellow eyes or skin;acid or sour stomach;blistering, peeling, or loosening of the skin;bluish-colored lips, fingernails, or palms;bone pain;diarrhea, watery and severe, which may also be bloody;difficulty with breathing, chewing, or talking;double vision;excessive muscle tone;feeling of discomfort;feeling, seeing, or hearing things that are not there;increased sensitivity to pain;increased sensitivity to touch;irregular or slow heart rate;mood changes;nosebleeds;rapid heart rate;red skin lesions, often with a purple center;seeing, hearing, or feeling things that are not there;sores, ulcers, or white spots on the lips or in the mouth;unusual bleeding or bruising;unusual excitement, nervousness, or restlessness;vaginal yeast infection;runny nose;sneezing;stuffy nose;or",,,,,,,,
1,1,prednisone,,,,,,,,,,,"aggression;agitation;blurred vision;decrease in the amount of urine;dizziness;fast, slow, pounding, or irregular heartbeat or pulse;headache;irritability;mood changes;noisy, rattling breathing;numbness or tingling in the arms or legs;pounding in the ears;shortness of breath;swelling of the fingers, hands, feet, or lower legs;trouble thinking, speaking, or walking;troubled breathing at rest;weight gain;abdominal or stomach cramping or burning (severe);abdominal or stomach pain;backache;bloody, black, or tarry stools;cough or hoarseness;darkening of the skin;decrease in height;decreased vision;diarrhea;dry mouth;eye pain;eye tearing;facial hair growth in females;fainting;fever or chills;flushed, dry skin;fractures;fruit-like breath odor;full or round face, neck, or trunk;heartburn or indigestion (severe and continuous);increased hunger;increased thirst;increased urination;loss of appetite;loss of sexual desire or ability;lower back or side pain;menstrual irregularities;muscle pain or tenderness;muscle wasting or weakness;nausea;pain in the back, ribs, arms, or legs;painful or difficult urination;skin rash;sweating;trouble healing;trouble sleeping;unexplained weight loss;unusual tiredness or weakness;vision changes;vomiting;vomiting of material that looks like coffee grounds;increased appetite;abnormal fat deposits on the face, neck, and trunk;acne;dry scalp;lightening of normal skin color;red face;reddish purple lines on the arms, face, legs, trunk, or groin;swelling of the stomach area;thinning of the scalp hair;or",,,,,,,,
2,2,Ciloxan,,,,,,,,,,,"allergic reaction, such as skin rash, hives, or itching;blurred vision or other change in vision;eye pain;irritation (severe) or redness of eye;nausea;burning or other discomfort of eye;crusting or crystals in corner of eye;bad taste following use in the eye;feeling of something in eye;itching of eye;redness of the lining of the eyelids;dryness of eye;increased sensitivity of eyes to light;swelling of eyelid;tearing of eye;or",,,,,,,,
3,3,ofloxacin,,,,,,,,,,,"abdominal or stomach pain;anxiety;black, tarry stools;bleeding gums;blood in the urine or stools;blurred vision;body aches or pain;chest pain;chills;cloudy urine;cold sweats;coma;confusion;congestion;cool, pale skin;cough;depression;diarrhea;dry mouth;dryness or soreness of the throat;eye pain;fast heartbeat;fever;flushed, dry skin;fruit-like breath odor;general feeling of illness;headache;hoarseness;increased hunger;increased thirst;increased urination;lower back or side pain;nausea;nightmares;painful or difficult urination;pale skin;pinpoint red spots on the skin;pus in the urine;runny nose;seizures;shakiness;slurred speech;sore throat;sores, ulcers, or white spots on the lips or in the mouth;sweating;swollen glands;tender, swollen glands in the neck;trouble with swallowing;troubled breathing with exertion;unexplained weight loss;unusual bleeding or bruising;unusual tiredness or weakness;voice changes;vomiting;burning while urinating;burning, crawling, itching, numbness, prickling, ""pins and needles"", or tingling feelings;change in color vision;continuing ringing or buzzing or other unexplained noise in the ears;convulsions;decrease in frequency of urination;decrease in urine volume;decreased hearing or any change in hearing;difficult or painful urination;difficulty in passing urine (dribbling);difficulty seeing at night;difficulty with moving;discouragement;dizziness, faintness, or lightheadedness when getting up suddenly from a lying or sitting position;false or unusual sense of well-being;fast, irregular, pounding, or racing heartbeat or pulse;feeling of constant movement of self or surroundings;feeling of warmth or heat;feeling sad or empty;flushing or redness of the skin, especially on the face and neck;hearing loss;hives or welts, itching, or skin rash;increased need to urinate;increased sensitivity of the eyes to sunlight;increased sweating;irritability;joint pain;lack of appetite;large, hive-like swelling on the face, eyelids, lips, tongue, throat, hands, legs, feet, or sex organs;loss of bladder control;loss of interest or pleasure;muscle aching or cramping;muscle pains or stiffness;muscle spasm or jerking of all extremities;no blood pressure or pulse;no breathing;passing urine more often;pounding in the ears;redness, soreness, or itching skin;seeing, hearing, or feeling things that are not there;sensation of spinning;shakiness in the legs, arms, hands, or feet;slow or fast heartbeat;sores, welting, or blisters;stopping of the heart;sudden loss of consciousness;swelling;swollen joints;trembling or shaking of the hands or feet;trouble concentrating;trouble performing routine tasks;trouble sleeping;unconsciousness;abdominal or stomach tenderness;actions that are out of control;back, leg, or stomach pains;blistering, peeling, or loosening of the skin;bloating;blue lips and fingernails;burning, dry, or itching eyes;changes in behavior;confusion about identity, place, and time;coughing that sometimes produces a pink frothy sputum;coughing up blood;cracks in the skin;crying;dark-colored urine;darkening of the skin;delusions of persecution, mistrust, suspiciousness, and/or combativeness;depersonalization;diarrhea, watery and severe, which may also be bloody;difficulty with breathing, chewing, speaking, or swallowing;discharge or excessive tearing;double vision;drooling;drooping eyelids;dysphoria;euphoria;feeling of discomfort;general body swelling;heartburn;high fever;hyperventilation;increased blood pressure;increased menstrual flow or vaginal bleeding;increased sensitivity of the skin to sunlight;increased sweating;indigestion;inflammation of the joints;irregular heartbeats;irregular or slow heart rate;itching of the vagina or outside the genitals;loss of ability to use or understand speech or language;loss of appetite;loss of balance control;loss of heat from the body;mental depression;mood or mental changes;muscle weakness;noisy breathing;nosebleeds;numbness of the hands;pain during sexual intercourse;pain in the ankles or knees;pain, inflammation, or swelling in the calves, shoulders, or hands;painful, red lumps under the skin, mostly on the legs;paralysis;prolonged bleeding from cuts;puffiness or swelling of the eyelids or around the eyes, face, lips, or tongue;quick to react or overreact emotionally;rapidly changing moods;red or black, tarry stools;red or dark brown urine;red skin lesions, often with a purple center;red, irritated eyes;red, swollen skin;redness or other discoloration of the skin;redness, pain, or swelling of the eye, eyelid, or inner lining of the eyelid;restlessness;scaly skin;severe abdominal or stomach pain, cramping, or burning;severe sunburn;severe tiredness;shaking;shuffling walk;stiffness of the limbs;stomach pain, continuing;swelling of the face, fingers, or lower legs;swollen lymph glands;talking, feeling, and acting with excitement;thick, white, curd-like vaginal discharge without odor or with mild odor;thoughts of killing oneself;twisting movements of the body;uncontrolled eye movements;uncontrolled movements, especially of the face, neck, and back;unexplained bleeding or bruising;unpleasant breath odor;unsteadiness or awkwardness;unusual behavior, such as disorientation to time or place, failure to recognize people, hyperactivity, or restlessness, especially in children using 2% cyclopentolate;unusual weight loss;upper right abdominal or stomach pain;vomiting of blood or material that looks like coffee grounds;weakness in the arms, hands, legs, or feet;weight gain;yellowing of the eyes or skin;change in taste;excess air or gas in the stomach or intestines;full feeling;loss of taste;passing gas;runny nose;or",,,,,,,,
4,4,diclofenac,,,,,,,,,,,"abdominal or stomach bloating, burning, cramping, or pain;belching;bloody or black, tarry stools;cloudy urine;constipation;decrease in urine output or decrease in urine-concentrating ability;diarrhea;dizziness;feeling of indigestion;headache;increased bleeding time;itching skin or rash;loss of appetite;nausea and vomiting;pain in the chest below the breastbone;pale skin;severe stomach pain;swelling;troubled breathing with exertion;unusual bleeding or bruising;unusual tiredness or weakness;vomiting of blood or material that looks like coffee grounds;weight loss;agitation;blurred vision;change in consciousness;change in the ability to see colors, especially blue or yellow;confusion;depression;difficult or troubled breathing;hives;hostility;irregular, fast or slow, or shallow breathing;irritability;loss of consciousness;muscle twitching;nervousness;pain or discomfort in the chest, upper stomach, or throat;pale or blue lips, fingernails, or skin;puffiness or swelling of the eyelids or around the eyes, face, lips, or tongue;rapid weight gain;seizures;sleepiness;slow or fast heartbeat;stupor;swelling of the face, ankles, or hands;tightness in the chest;trouble sleeping;unusual drowsiness, dullness, or feeling of sluggishness;continuing ringing or buzzing or other unexplained noise in the ears;excess air or gas in the stomach or intestines;hearing loss;lack or loss of strength;passing gas;or",,,,,,,,
5,5,Voltaren Ophthalmic,,,,,,,,,,,"eye redness, irritation, or pain;tearing of the eyes;blindness;blurred vision;burning, dry, or itching eyes;clear or yellow fluid from the eye;decreased vision or any change in vision;redness, pain, or swelling of the eye, eyelid, or inner lining of the eyelid;sensitivity to light;sticky or matted eyelashes;throbbing pain;feeling of something in the eye;burning and stinging of the eye;abdominal or stomach pain;chills;cold flu-like symptoms;cough or hoarseness;dizziness;fever;headache;lack or loss of strength;nausea;pain;runny nose;sleeplessness;sneezing;stuffy nose;swelling or puffiness of the face;trouble with sleeping;unable to sleep;vomiting;or",,,,,,,,
6,6,Ocuflox,,,,,,,,,,,"puffiness or swelling of eyes;signs of an allergic reaction, such as hives, itching, rash, swelling of face or lips, tightness in chest, troubled breathing, or wheezing;dizziness;burning of eye;blurred vision;eye pain;feeling of something in the eye;increased sensitivity of eye to light;redness, irritation, or itching of eye, eyelid, or inner lining of eyelid;stinging, tearing, or dryness of eye;or",,,,,,,,
7,7,Iquix,,,,,,,,,,,"voice changes;body aches or pain;congestion;dryness or soreness of throat;runny nose;swelling of the eyelid;tender, swollen glands in neck;trouble in swallowing;itching, pain, redness or swelling of eye or eyelid;watering of eyes;decreased vision;fever;feeling of having something in the eye;headache;hoarseness;eye burning, dryness, itching, or pain;increased sensitivity of eyes to light;or",,,,,,,,
8,8,levofloxacin,,,,,,,,,,,"diarrhea;abdominal or stomach cramps or pain (severe);agitation;blisters;confusion;diarrhea (watery and severe) which may also be bloody;feeling that others can hear your thoughts or control your behavior;fever;pain, inflammation, or swelling in the calves of the legs, shoulders, or hands, including tendon rupture or swelling of the tendon (tendinitis);redness and swelling of the skin;seeing, hearing, or feeling things that are not there;sensation of burning on the skin;severe mood or mental changes;skin rash, itching, or redness;trembling;unusual behavior;black, tarry stools;blurred vision;burning, numbness, tingling, or painful sensation including peripheral neuropathy.;convulsions;cough;dark-colored urine;difficulty with breathing;difficulty with chewing, talking, or swallowing;drooping eyelids;fast or irregular heartbeat;general body swelling;hives;hoarseness;joint or muscle pain including tendon rupture or swelling of the tendon (tendinitis).;muscle cramps, spasms, pain, or stiffness;peeling or loosening of the skin;puffiness or swelling of the eyelids or around the eyes, face, lips, or tongue;severe dizziness;severe tiredness;tightness in the chest;unsteadiness or awkwardness;unusual bleeding or bruising;unusual tiredness or weakness;vision changes;voice changes;weakness in the arms, hands, legs, or feet including worsening of myasthenia gravis.;abdominal or stomach pain or discomfort;change in taste;constipation;dizziness;drowsiness;headache;lightheadedness;nausea;nervousness;trouble sleeping;vaginal itching and discharge;vomiting;feeling faint;feeling of warmth or heat;flushing or redness of the skin, especially on the face and neck;sweating;or",,,,,,,,
9,9,Quixin,,,,,,,,,,,"voice changes;body aches or pain;congestion;dryness or soreness of throat;runny nose;swelling of the eyelid;tender, swollen glands in neck;trouble in swallowing;itching, pain, redness or swelling of eye or eyelid;watering of eyes;decreased vision;fever;feeling of having something in the eye;headache;hoarseness;eye burning, dryness, itching, or pain;increased sensitivity of eyes to light;or",,,,,,,,
10,10,,,,,,,,,,,,,,,,,,,,
