,Unnamed: 0,Brand Name,Generic Name,Type of Treatment,Brief Description,Quantity,Location,Uninsured Cost,Typical Copay,Rating,Vendor,Effectiveness,Side Effects / Risk,Ingredients,Usage Overview,Conflicting Treatment/Therapies,Food Interaction,Frequency of Treatment,Estimated Percentage of Usage,Additional Information,Reference Link
0,0,baclofen,,,,,,,,,,,"bloody or dark urine;chest pain;fainting;hallucinations (seeing or hearing things that are not there);mental depression or other mood changes;ringing or buzzing in the ears;skin rash or itching;blurred or double vision;convulsions (seizures);muscle weakness (severe);shortness of breath or unusually slow or troubled breathing;vomiting;confusion;dizziness or lightheadedness;drowsiness;nausea;unusual weakness, especially muscle weakness;abdominal or stomach pain or discomfort;clumsiness, unsteadiness, trembling, or other problems with muscle control;constipation;diarrhea;difficult or painful urination or decrease in amount of urine;false sense of well-being;frequent urge to urinate or uncontrolled urination;headache;loss of appetite;low blood pressure;muscle or joint pain;numbness or tingling in hands or feet;pounding heartbeat;sexual problems in males;slurred speech or other speech problems;stuffy nose;swelling of ankles;trouble in sleeping;unexplained muscle stiffness;unusual excitement;unusual tiredness;weight gain;convulsions (seizures);hallucinations (seeing or hearing things that are not there);increase in muscle spasm, cramping, or tightness;mood or mental changes;unusual nervousness or restlessness;or",,,,,,,,
1,1,Botox,,,,,,,,,,,"difficulty with swallowing;difficulty with breathing or speaking;muscle weakness;dryness of the eyes;inability to close the eyelids completely;bladder pain;bloody or cloudy urine;difficult, burning, or painful urination;frequent urge to urinate;lower back or side pain;decreased blinking;irritation of the cornea (colored portion) of the eyes;turning outward or inward of the edge of the eyelids;swelling of the eyelids;blue or purplish bruise on the eyelids;drooping of the upper eyelids;irritation or watering of the eyes;sensitivity of the eyes to light;body aches or pain;chills;cough, fever, sneezing, or sore throat;ear congestion;headache;loss of voice;nasal congestion;neck pain;runny nose;unusual tiredness or weakness;neck pain;body aches or pain;chills;congestion;cough;diarrhea;dryness or soreness of the throat;fear;fever;general feeling of discomfort or illness;headache;heavy bleeding from the place where shot was given;itching skin;joint pain;loss of appetite;nausea;nervousness;painful or difficult urination;runny nose;shivering;sweating;tender, swollen glands in the neck;trouble sleeping;trouble swallowing;voice changes;vomiting;drooping of the upper eyelid;eye pointing upward or downward instead of straight ahead;pain in the arms;skin rash;swelling of the eyelid skin;bleeding, blistering, burning, coldness, discoloration of the skin, feeling of pressure, hives, infection, inflammation, itching, lumps, numbness, pain, rash, redness, scarring, soreness, stinging, swelling, tenderness, tingling, ulceration, or warmth at the injection site;blurred vision;body aches or pain;cough producing mucus;difficulty breathing;dizziness;drooping of the upper eyelid;headache;muscle aches and pains;nervousness;pounding in the ears;slow or fast heartbeat;tightness in the chest;difficulty finding the location of objects;double vision;back pain;body aches or pain;chills;cough;difficulty in breathing;ear congestion;fever;headache;loss of voice;nasal congestion;sneezing;sore throat;unusual tiredness or weakness;cough producing mucus;difficulty breathing;muscle weakness;nausea;tightness in the chest;weakness",,,,,,,,
2,2,Lioresal,,,,,,,,,,,"bloody or dark urine;chest pain;fainting;hallucinations (seeing or hearing things that are not there);mental depression or other mood changes;ringing or buzzing in the ears;skin rash or itching;blurred or double vision;convulsions (seizures);muscle weakness (severe);shortness of breath or unusually slow or troubled breathing;vomiting;confusion;dizziness or lightheadedness;drowsiness;nausea;unusual weakness, especially muscle weakness;abdominal or stomach pain or discomfort;clumsiness, unsteadiness, trembling, or other problems with muscle control;constipation;diarrhea;difficult or painful urination or decrease in amount of urine;false sense of well-being;frequent urge to urinate or uncontrolled urination;headache;loss of appetite;low blood pressure;muscle or joint pain;numbness or tingling in hands or feet;pounding heartbeat;sexual problems in males;slurred speech or other speech problems;stuffy nose;swelling of ankles;trouble in sleeping;unexplained muscle stiffness;unusual excitement;unusual tiredness;weight gain;convulsions (seizures);hallucinations (seeing or hearing things that are not there);increase in muscle spasm, cramping, or tightness;mood or mental changes;unusual nervousness or restlessness;or",,,,,,,,
3,3,Kemstro,,,,,,,,,,,"bloody or dark urine;chest pain;fainting;hallucinations (seeing or hearing things that are not there);mental depression or other mood changes;ringing or buzzing in the ears;skin rash or itching;blurred or double vision;convulsions (seizures);muscle weakness (severe);shortness of breath or unusually slow or troubled breathing;vomiting;confusion;dizziness or lightheadedness;drowsiness;nausea;unusual weakness, especially muscle weakness;abdominal or stomach pain or discomfort;clumsiness, unsteadiness, trembling, or other problems with muscle control;constipation;diarrhea;difficult or painful urination or decrease in amount of urine;false sense of well-being;frequent urge to urinate or uncontrolled urination;headache;loss of appetite;low blood pressure;muscle or joint pain;numbness or tingling in hands or feet;pounding heartbeat;sexual problems in males;slurred speech or other speech problems;stuffy nose;swelling of ankles;trouble in sleeping;unexplained muscle stiffness;unusual excitement;unusual tiredness;weight gain;convulsions (seizures);hallucinations (seeing or hearing things that are not there);increase in muscle spasm, cramping, or tightness;mood or mental changes;unusual nervousness or restlessness;or",,,,,,,,
4,4,Myobloc,,,,,,,,,,,"difficulty with swallowing;infection;neck pain;uncontrolled twisting movements of the neck;difficulty with breathing or speaking;muscle weakness;acid or sour stomach;back pain;belching;bleeding, blistering, burning, coldness, discoloration of the skin, feeling of pressure, hives, infection, inflammation, itching, lumps, numbness, pain, rash, redness, scarring, soreness, stinging, swelling, tenderness, tingling, ulceration, or warmth at the injection site;cough;difficulty with moving;dizziness;dry mouth;flu-like syndrome;headache;heartburn or indigestion;lack or loss of strength or energy;muscle pain, stiffness, or weakness;nausea;pain, swelling, or redness in the joints;stomach discomfort, upset, or pain",,,,,,,,
5,5,carbamazepine,,,,,,,,,,,"blurred vision or double vision;continuous back-and-forth eye movements;actions that are out of control;behavioral changes (especially in children);confusion, agitation, or hostility (especially in the elderly);diarrhea (severe);discouragement;drooling;fear;feeling of unreality;feeling sad or empty;headache (continuing);increase in seizures;irritability;lack of appetite;loss of balance control;loss of interest or pleasure;muscle trembling, jerking, or stiffness;nausea and vomiting (severe);other problems with muscle control or coordination;sense of detachment from self or body;shakiness and unsteady walk;shuffling walk;stiffness of the limb;sudden, wide mood swings;talking, feeling, and acting with excitement;thoughts or attempts of killing oneself;tiredness;trouble concentrating;trouble sleeping;twisting movements of the body;uncontrolled movements, especially of the face, neck, and back;unusual drowsiness;black, tarry stools;blood in the urine or stools;bone or joint pain;chest pain;cough or hoarseness;darkening of the urine;difficulty with speaking or slurred speech;fainting;frequent urination;irregular, pounding, or unusually slow heartbeat;lower back or side pain;mental depression with restlessness and nervousness or other mood or mental changes;muscle or stomach cramps;nosebleeds or other unusual bleeding or bruising;numbness, tingling, pain, or weakness in the hands and feet;pain, tenderness, swelling, or bluish color in the leg or foot;painful or difficult urination;pale stools;pinpoint red spots on the skin;rapid weight gain;rigidity;ringing, buzzing, or other unexplained sounds in the ears;skin rash, hives, or itching;sore throat, chills, and fever;sores, ulcers, or white spots on the lips or in the mouth;swelling of the face, hands, feet, or lower legs;swollen or painful glands;sudden decrease in the amount of urine;tightness in the chest;trembling;troubled breathing;uncontrolled body movements;unusual tiredness or weakness;visual hallucinations (seeing things that are not there);yellow eyes or skin;dizziness (mild);drowsiness (mild);lightheadedness;nausea or vomiting (mild);accidental injury;aching joints or muscles;acid or sour stomach;back pain;belching;constipation;diarrhea;dryness of the mouth;headache;heartburn;increased sensitivity of the skin to sunlight (skin rash, itching, redness or other discoloration of the skin, or severe sunburn);increased sweating;indigestion;irritation or soreness of the tongue or mouth;lack or loss of strength;loss of hair;loss of memory;problems with memory;sexual problems in males;sleepiness;stomach pain, upset, or discomfort;or",,,,,,,,
6,6,onabotulinumtoxinA,,,,,,,,,,,"difficulty with swallowing;difficulty with breathing or speaking;muscle weakness;dryness of the eyes;inability to close the eyelids completely;bladder pain;bloody or cloudy urine;difficult, burning, or painful urination;frequent urge to urinate;lower back or side pain;decreased blinking;irritation of the cornea (colored portion) of the eyes;turning outward or inward of the edge of the eyelids;swelling of the eyelids;blue or purplish bruise on the eyelids;drooping of the upper eyelids;irritation or watering of the eyes;sensitivity of the eyes to light;body aches or pain;chills;cough, fever, sneezing, or sore throat;ear congestion;headache;loss of voice;nasal congestion;neck pain;runny nose;unusual tiredness or weakness;neck pain;body aches or pain;chills;congestion;cough;diarrhea;dryness or soreness of the throat;fear;fever;general feeling of discomfort or illness;headache;heavy bleeding from the place where shot was given;itching skin;joint pain;loss of appetite;nausea;nervousness;painful or difficult urination;runny nose;shivering;sweating;tender, swollen glands in the neck;trouble sleeping;trouble swallowing;voice changes;vomiting;drooping of the upper eyelid;eye pointing upward or downward instead of straight ahead;pain in the arms;skin rash;swelling of the eyelid skin;bleeding, blistering, burning, coldness, discoloration of the skin, feeling of pressure, hives, infection, inflammation, itching, lumps, numbness, pain, rash, redness, scarring, soreness, stinging, swelling, tenderness, tingling, ulceration, or warmth at the injection site;blurred vision;body aches or pain;cough producing mucus;difficulty breathing;dizziness;drooping of the upper eyelid;headache;muscle aches and pains;nervousness;pounding in the ears;slow or fast heartbeat;tightness in the chest;difficulty finding the location of objects;double vision;back pain;body aches or pain;chills;cough;difficulty in breathing;ear congestion;fever;headache;loss of voice;nasal congestion;sneezing;sore throat;unusual tiredness or weakness;cough producing mucus;difficulty breathing;muscle weakness;nausea;tightness in the chest;weakness",,,,,,,,
7,7,botulinum toxin type b,,,,,,,,,,,"difficulty with swallowing;infection;neck pain;uncontrolled twisting movements of the neck;difficulty with breathing or speaking;muscle weakness;acid or sour stomach;back pain;belching;bleeding, blistering, burning, coldness, discoloration of the skin, feeling of pressure, hives, infection, inflammation, itching, lumps, numbness, pain, rash, redness, scarring, soreness, stinging, swelling, tenderness, tingling, ulceration, or warmth at the injection site;cough;difficulty with moving;dizziness;dry mouth;flu-like syndrome;headache;heartburn or indigestion;lack or loss of strength or energy;muscle pain, stiffness, or weakness;nausea;pain, swelling, or redness in the joints;stomach discomfort, upset, or pain",,,,,,,,
8,8,,,,,,,,,,,,,,,,,,,,
