11,11,Floxin,,,,,,,,,,,"abdominal or stomach pain;anxiety;black, tarry stools;bleeding gums;blood in the urine or stools;blurred vision;body aches or pain;chest pain;chills;cloudy urine;cold sweats;coma;confusion;congestion;cool, pale skin;cough;depression;diarrhea;dry mouth;dryness or soreness of the throat;eye pain;fast heartbeat;fever;flushed, dry skin;fruit-like breath odor;general feeling of illness;headache;hoarseness;increased hunger;increased thirst;increased urination;lower back or side pain;nausea;nightmares;painful or difficult urination;pale skin;pinpoint red spots on the skin;pus in the urine;runny nose;seizures;shakiness;slurred speech;sore throat;sores, ulcers, or white spots on the lips or in the mouth;sweating;swollen glands;tender, swollen glands in the neck;trouble with swallowing;troubled breathing with exertion;unexplained weight loss;unusual bleeding or bruising;unusual tiredness or weakness;voice changes;vomiting;burning while urinating;burning, crawling, itching, numbness, prickling, ""pins and needles"", or tingling feelings;change in color vision;continuing ringing or buzzing or other unexplained noise in the ears;convulsions;decrease in frequency of urination;decrease in urine volume;decreased hearing or any change in hearing;difficult or painful urination;difficulty in passing urine (dribbling);difficulty seeing at night;difficulty with moving;discouragement;dizziness, faintness, or lightheadedness when getting up suddenly from a lying or sitting position;false or unusual sense of well-being;fast, irregular, pounding, or racing heartbeat or pulse;feeling of constant movement of self or surroundings;feeling of warmth or heat;feeling sad or empty;flushing or redness of the skin, especially on the face and neck;hearing loss;hives or welts, itching, or skin rash;increased need to urinate;increased sensitivity of the eyes to sunlight;increased sweating;irritability;joint pain;lack of appetite;large, hive-like swelling on the face, eyelids, lips, tongue, throat, hands, legs, feet, or sex organs;loss of bladder control;loss of interest or pleasure;muscle aching or cramping;muscle pains or stiffness;muscle spasm or jerking of all extremities;no blood pressure or pulse;no breathing;passing urine more often;pounding in the ears;redness, soreness, or itching skin;seeing, hearing, or feeling things that are not there;sensation of spinning;shakiness in the legs, arms, hands, or feet;slow or fast heartbeat;sores, welting, or blisters;stopping of the heart;sudden loss of consciousness;swelling;swollen joints;trembling or shaking of the hands or feet;trouble concentrating;trouble performing routine tasks;trouble sleeping;unconsciousness;abdominal or stomach tenderness;actions that are out of control;back, leg, or stomach pains;blistering, peeling, or loosening of the skin;bloating;blue lips and fingernails;burning, dry, or itching eyes;changes in behavior;confusion about identity, place, and time;coughing that sometimes produces a pink frothy sputum;coughing up blood;cracks in the skin;crying;dark-colored urine;darkening of the skin;delusions of persecution, mistrust, suspiciousness, and/or combativeness;depersonalization;diarrhea, watery and severe, which may also be bloody;difficulty with breathing, chewing, speaking, or swallowing;discharge or excessive tearing;double vision;drooling;drooping eyelids;dysphoria;euphoria;feeling of discomfort;general body swelling;heartburn;high fever;hyperventilation;increased blood pressure;increased menstrual flow or vaginal bleeding;increased sensitivity of the skin to sunlight;increased sweating;indigestion;inflammation of the joints;irregular heartbeats;irregular or slow heart rate;itching of the vagina or outside the genitals;loss of ability to use or understand speech or language;loss of appetite;loss of balance control;loss of heat from the body;mental depression;mood or mental changes;muscle weakness;noisy breathing;nosebleeds;numbness of the hands;pain during sexual intercourse;pain in the ankles or knees;pain, inflammation, or swelling in the calves, shoulders, or hands;painful, red lumps under the skin, mostly on the legs;paralysis;prolonged bleeding from cuts;puffiness or swelling of the eyelids or around the eyes, face, lips, or tongue;quick to react or overreact emotionally;rapidly changing moods;red or black, tarry stools;red or dark brown urine;red skin lesions, often with a purple center;red, irritated eyes;red, swollen skin;redness or other discoloration of the skin;redness, pain, or swelling of the eye, eyelid, or inner lining of the eyelid;restlessness;scaly skin;severe abdominal or stomach pain, cramping, or burning;severe sunburn;severe tiredness;shaking;shuffling walk;stiffness of the limbs;stomach pain, continuing;swelling of the face, fingers, or lower legs;swollen lymph glands;talking, feeling, and acting with excitement;thick, white, curd-like vaginal discharge without odor or with mild odor;thoughts of killing oneself;twisting movements of the body;uncontrolled eye movements;uncontrolled movements, especially of the face, neck, and back;unexplained bleeding or bruising;unpleasant breath odor;unsteadiness or awkwardness;unusual behavior, such as disorientation to time or place, failure to recognize people, hyperactivity, or restlessness, especially in children using 2% cyclopentolate;unusual weight loss;upper right abdominal or stomach pain;vomiting of blood or material that looks like coffee grounds;weakness in the arms, hands, legs, or feet;weight gain;yellowing of the eyes or skin;change in taste;excess air or gas in the stomach or intestines;full feeling;loss of taste;passing gas;runny nose;or",,,,,,,,
12,12,Zinacef,,,,,,,,,,,"chills;diarrhea;fever;general feeling of illness or discomfort;headache;itching of the vagina or genital area;pain during sexual intercourse;rigidity;sweating;thick, white vaginal discharge with no odor or with a mild odor;black, tarry stools;chest pain;cough;loose stools;painful or difficult urination;shortness of breath;sore throat;sores, ulcers, or white spots on the lips or in the mouth;swollen glands;unusual bleeding or bruising;unusual tiredness or weakness;back, leg, or stomach pains;bladder pain;bleeding gums;bloody or cloudy urine;body aches or pain;burning while urinating;dark urine;difficulty with breathing;ear congestion;fast, pounding, or irregular heartbeat or pulse;frequent urge to urinate;general body swelling;loss of appetite;loss of voice;lower back or side pain;nasal congestion;nausea or vomiting;nosebleeds;pain or tenderness around the eyes and cheekbones;pale skin;pink or red urine;sneezing;stuffy or runny nose;swelling of the joints;swollen glands;tightness of chest or wheezing;white or brownish vaginal discharge;white patches in the mouth or throat or on the tongue;white patches with diaper rash;yellowing of the eyes or skin;blistering, peeling, or loosening of the skin;bloody, black, or tarry stools;clay-colored stools;cough or hoarseness;coughing up blood;decrease in urine output or decrease in urine-concentrating ability;feeling of discomfort;fever with or without chills;general feeling of tiredness or weakness;high fever;hives;increased menstrual flow or vaginal bleeding;joint or muscle pain;large, hive-like swelling on the face, eyelids, lips, tongue, throat, hands, legs, feet, or sex organs;light-colored stools;paralysis;prolonged bleeding from cuts;puffiness or swelling of the eyelids or around the eyes, face, lips, or tongue;red or black, tarry stools;red or dark brown urine;red skin lesions, often with a purple center;red, irritated eyes;seizures;swollen lymph glands;swollen or painful glands;unpleasant breath odor;upper right abdominal or stomach pain;vomiting of blood;bad, unusual, or unpleasant (after) taste;change in taste;diaper rash;abdominal or stomach cramps;acid or sour stomach;belching;bloated;difficulty with moving;excess air or gas in the stomach or intestines;flushing or redness of the skin;full feeling;gas in the stomach;heartburn;indigestion;irritability;irritation or soreness of the mouth;itching skin;muscle pain or stiffness;muscle spasm of the neck;passing gas;restlessness;sleepiness or unusual drowsiness;stomach discomfort, upset, or pain;swelling of the tongue;thirst;trouble sitting still;unusually warm skin;watering of the mouth and drooling;weight loss;hives or welts;redness of the skin;or",,,,,,,,
13,13,cefpodoxime,,,,,,,,,,,"diarrhea;loose stools;change in the color, amount, or odor of vaginal discharge;abdominal or stomach cramps or tenderness;black, tarry stools;bladder pain;bleeding gums;bloating or swelling of the face, arms, hands, lower legs, or feet;bloody nose;bloody or cloudy urine;blurred vision;burning while urinating;chest pain;collection of blood under the skin;confusion;continuing ringing or buzzing or other unexplained noise in the ears;cough or hoarseness;cough producing mucus;dark urine;decreased urination;decreased urine output;deep, dark purple bruise;diarrhea, watery and severe, which may also be bloody;difficult or labored breathing;difficult, burning, or painful urination;difficulty with breathing or troubled breathing;dilated neck veins;dizziness;dizziness, faintness, or lightheadedness when getting up suddenly from a lying or sitting position;dry mouth;extreme fatigue;fainting;fast, irregular, pounding, or racing heartbeat or pulse;feeling of warmth or heat;fever or chills;flushing or redness of the skin, especially on the face and neck;frequent urge to urinate;general body swelling;headache;hearing loss;heavier menstrual periods;increase in heart rate;increased thirst;increased urge to urinate during the night;increased weight;irregular breathing;irregular heartbeat;itching of the vagina or genital area;itching, pain, redness, or swelling;loss of appetite;lower back or side pain;nausea or vomiting;nervousness;noisy breathing;nosebleeds;pain;pain during sexual intercourse;pain or swelling of the treated skin;pain or tenderness around the eyes and cheekbones;pain, warmth, or burning in the fingers, toes, and legs;pale skin;pinpoint red spots on the skin;pounding in the ears;problems with vision or hearing;rapid breathing;rapid weight gain;runny nose;shortness of breath or troubled breathing;skin rash;slow or fast heartbeat;sneezing;sore throat;sores, ulcers, or white spots on the lips or in the mouth;stuffy or runny nose;sunken eyes;sweating;swelling of the face, fingers, feet, or lower legs;swelling or puffiness of the face;swollen glands;thick, white vaginal discharge with no odor or with a mild odor;thirst;tightness of the chest or wheezing;tingling of the hands or feet;troubled breathing;troubled breathing with exertion;unusual bleeding or bruising;unusual tiredness or weakness;unusual weight gain or loss;waking to urinate at night;weight gain;wheezing;wrinkled skin;yellowing of the eyes or skin;abdominal or stomach pain;blistering, peeling, or loosening of the skin;bloody, black, or tarry stools;clay-colored stools;feeling of discomfort;fever with or without chills;general feeling of tiredness or weakness;high fever;inflammation of the joints;irritation or inflammation of the eyelid;itching;joint or muscle pain;muscle aches;rectal bleeding;red skin lesions, often with a purple center;red, irritated eyes;seizures;sudden decrease in the amount of urine;swollen lymph glands;swollen or painful glands;unpleasant breath odor;vomiting of blood;accumulation of pus;acid or sour stomach;ankle, knee, or great toe joint pain;bad, unusual, or unpleasant (after) taste;belching;blemishes on the skin;bloated or full feeling;burning feeling in the chest or stomach;burning, crawling, itching, numbness, prickling, ""pins and needles"", or tingling feelings;change in taste;constipation;cracks in the skin;decreased appetite;difficulty with moving;dry skin;excess air or gas in the stomach or intestines;fear or nervousness;feeling of constant movement of self or surroundings;frequent urge to defecate;general feeling of discomfort or illness;hair loss;headache, severe and throbbing;heartburn;hives or welts;increase in body movements;increased sweating;increased thirst;indigestion;irritation or soreness of the mouth;joint stiffness or swelling;lack or loss of strength;loss of heat from the body;lower back or side pain;muscle aching or cramping;muscle pains or stiffness;passing of gas;peeling of the skin;pimples;poor concentration;pressure in the stomach;red, sore eyes;red, swollen skin;redness of the skin;scaly skin;seeing, hearing, or feeling things that are not there;sensation of spinning;sleepiness or unusual drowsiness;sleeplessness;sore mouth or tongue;soreness or redness around the fingernails and toenails;stomach discomfort, upset, or pain;stomach upset;straining while passing stool;swelling of the abdominal or stomach area;swelling or inflammation of the mouth;swollen, red, or tender area of infection;trouble with sleeping;unable to sleep;white patches in the mouth, tongue, or throat;or",,,,,,,,
14,14,ofloxacin,,,,,,,,,,,"abdominal or stomach pain;anxiety;black, tarry stools;bleeding gums;blood in the urine or stools;blurred vision;body aches or pain;chest pain;chills;cloudy urine;cold sweats;coma;confusion;congestion;cool, pale skin;cough;depression;diarrhea;dry mouth;dryness or soreness of the throat;eye pain;fast heartbeat;fever;flushed, dry skin;fruit-like breath odor;general feeling of illness;headache;hoarseness;increased hunger;increased thirst;increased urination;lower back or side pain;nausea;nightmares;painful or difficult urination;pale skin;pinpoint red spots on the skin;pus in the urine;runny nose;seizures;shakiness;slurred speech;sore throat;sores, ulcers, or white spots on the lips or in the mouth;sweating;swollen glands;tender, swollen glands in the neck;trouble with swallowing;troubled breathing with exertion;unexplained weight loss;unusual bleeding or bruising;unusual tiredness or weakness;voice changes;vomiting;burning while urinating;burning, crawling, itching, numbness, prickling, ""pins and needles"", or tingling feelings;change in color vision;continuing ringing or buzzing or other unexplained noise in the ears;convulsions;decrease in frequency of urination;decrease in urine volume;decreased hearing or any change in hearing;difficult or painful urination;difficulty in passing urine (dribbling);difficulty seeing at night;difficulty with moving;discouragement;dizziness, faintness, or lightheadedness when getting up suddenly from a lying or sitting position;false or unusual sense of well-being;fast, irregular, pounding, or racing heartbeat or pulse;feeling of constant movement of self or surroundings;feeling of warmth or heat;feeling sad or empty;flushing or redness of the skin, especially on the face and neck;hearing loss;hives or welts, itching, or skin rash;increased need to urinate;increased sensitivity of the eyes to sunlight;increased sweating;irritability;joint pain;lack of appetite;large, hive-like swelling on the face, eyelids, lips, tongue, throat, hands, legs, feet, or sex organs;loss of bladder control;loss of interest or pleasure;muscle aching or cramping;muscle pains or stiffness;muscle spasm or jerking of all extremities;no blood pressure or pulse;no breathing;passing urine more often;pounding in the ears;redness, soreness, or itching skin;seeing, hearing, or feeling things that are not there;sensation of spinning;shakiness in the legs, arms, hands, or feet;slow or fast heartbeat;sores, welting, or blisters;stopping of the heart;sudden loss of consciousness;swelling;swollen joints;trembling or shaking of the hands or feet;trouble concentrating;trouble performing routine tasks;trouble sleeping;unconsciousness;abdominal or stomach tenderness;actions that are out of control;back, leg, or stomach pains;blistering, peeling, or loosening of the skin;bloating;blue lips and fingernails;burning, dry, or itching eyes;changes in behavior;confusion about identity, place, and time;coughing that sometimes produces a pink frothy sputum;coughing up blood;cracks in the skin;crying;dark-colored urine;darkening of the skin;delusions of persecution, mistrust, suspiciousness, and/or combativeness;depersonalization;diarrhea, watery and severe, which may also be bloody;difficulty with breathing, chewing, speaking, or swallowing;discharge or excessive tearing;double vision;drooling;drooping eyelids;dysphoria;euphoria;feeling of discomfort;general body swelling;heartburn;high fever;hyperventilation;increased blood pressure;increased menstrual flow or vaginal bleeding;increased sensitivity of the skin to sunlight;increased sweating;indigestion;inflammation of the joints;irregular heartbeats;irregular or slow heart rate;itching of the vagina or outside the genitals;loss of ability to use or understand speech or language;loss of appetite;loss of balance control;loss of heat from the body;mental depression;mood or mental changes;muscle weakness;noisy breathing;nosebleeds;numbness of the hands;pain during sexual intercourse;pain in the ankles or knees;pain, inflammation, or swelling in the calves, shoulders, or hands;painful, red lumps under the skin, mostly on the legs;paralysis;prolonged bleeding from cuts;puffiness or swelling of the eyelids or around the eyes, face, lips, or tongue;quick to react or overreact emotionally;rapidly changing moods;red or black, tarry stools;red or dark brown urine;red skin lesions, often with a purple center;red, irritated eyes;red, swollen skin;redness or other discoloration of the skin;redness, pain, or swelling of the eye, eyelid, or inner lining of the eyelid;restlessness;scaly skin;severe abdominal or stomach pain, cramping, or burning;severe sunburn;severe tiredness;shaking;shuffling walk;stiffness of the limbs;stomach pain, continuing;swelling of the face, fingers, or lower legs;swollen lymph glands;talking, feeling, and acting with excitement;thick, white, curd-like vaginal discharge without odor or with mild odor;thoughts of killing oneself;twisting movements of the body;uncontrolled eye movements;uncontrolled movements, especially of the face, neck, and back;unexplained bleeding or bruising;unpleasant breath odor;unsteadiness or awkwardness;unusual behavior, such as disorientation to time or place, failure to recognize people, hyperactivity, or restlessness, especially in children using 2% cyclopentolate;unusual weight loss;upper right abdominal or stomach pain;vomiting of blood or material that looks like coffee grounds;weakness in the arms, hands, legs, or feet;weight gain;yellowing of the eyes or skin;change in taste;excess air or gas in the stomach or intestines;full feeling;loss of taste;passing gas;runny nose;or",,,,,,,,
15,15,Claforan,,,,,,,,,,,"abdominal or stomach cramps or tenderness;black, tarry stools;bloating;chest pain;chills;diarrhea;diarrhea, watery and severe, which may also be bloody;difficulty with breathing;difficulty with swallowing;dizziness;fast heartbeat;fever;hives, itching, or skin rash;increased thirst;large, hive-like swelling on the face, eyelids, lips, tongue, throat, hands, legs, feet, or sex organs;nausea or vomiting;noisy breathing;pain;painful or difficult urination;puffiness or swelling of the eyelids or around the eyes, face, lips, or tongue;sore throat;sores, ulcers, or white spots on the lips or in the mouth;swollen glands;tenderness;tightness in the chest;unusual bleeding or bruising;unusual tiredness or weakness;unusual weight loss;agitation;back, leg, or stomach pains;bleeding gums;blistering, peeling, or loosening of the skin;blood in the urine or stools;bloody or cloudy urine;blurred vision;coma;confusion;cough or hoarseness;cracks in the skin at the corners of the mouth;dark urine;drowsiness;fainting;fast, slow, or irregular heartbeat;fever with or without chills;general body swelling;general feeling of tiredness or weakness;greatly decreased frequency of urination or amount of urine;hallucinations;headache;irritability;itching of the vagina or genital area;joint or muscle pain;loss of appetite;lower back or side pain;nosebleeds;pain during sexual intercourse;pale skin;pinpoint red spots on the skin;red skin lesions, often with a purple center;red, irritated eyes;seizures;soreness or redness around the fingernails and toenails;stiff neck;swelling of the feet or lower legs;thick, white vaginal discharge with no odor or with a mild odor;yellow eyes or skin;clay-colored stools;unpleasant breath odor;vomiting of blood;red streaks on the skin;swelling, tenderness, or pain at the injection site;or",,,,,,,,
16,16,penicillin g potassium,,,,,,,,,,,,,,,,,,,
17,17,cefotaxime,,,,,,,,,,,"abdominal or stomach cramps or tenderness;black, tarry stools;bloating;chest pain;chills;diarrhea;diarrhea, watery and severe, which may also be bloody;difficulty with breathing;difficulty with swallowing;dizziness;fast heartbeat;fever;hives, itching, or skin rash;increased thirst;large, hive-like swelling on the face, eyelids, lips, tongue, throat, hands, legs, feet, or sex organs;nausea or vomiting;noisy breathing;pain;painful or difficult urination;puffiness or swelling of the eyelids or around the eyes, face, lips, or tongue;sore throat;sores, ulcers, or white spots on the lips or in the mouth;swollen glands;tenderness;tightness in the chest;unusual bleeding or bruising;unusual tiredness or weakness;unusual weight loss;agitation;back, leg, or stomach pains;bleeding gums;blistering, peeling, or loosening of the skin;blood in the urine or stools;bloody or cloudy urine;blurred vision;coma;confusion;cough or hoarseness;cracks in the skin at the corners of the mouth;dark urine;drowsiness;fainting;fast, slow, or irregular heartbeat;fever with or without chills;general body swelling;general feeling of tiredness or weakness;greatly decreased frequency of urination or amount of urine;hallucinations;headache;irritability;itching of the vagina or genital area;joint or muscle pain;loss of appetite;lower back or side pain;nosebleeds;pain during sexual intercourse;pale skin;pinpoint red spots on the skin;red skin lesions, often with a purple center;red, irritated eyes;seizures;soreness or redness around the fingernails and toenails;stiff neck;swelling of the feet or lower legs;thick, white vaginal discharge with no odor or with a mild odor;yellow eyes or skin;clay-colored stools;unpleasant breath odor;vomiting of blood;red streaks on the skin;swelling, tenderness, or pain at the injection site;or",,,,,,,,
18,18,Pfizerpen,,,,,,,,,,,,,,,,,,,
19,19,penicillin g sodium,,,,,,,,,,,,,,,,,,,
20,20,,,,,,,,,,,,,,,,,,,,
