62,62,Flagyl IV,,,,,,,,,,,"agitation;back pain;blindness;blurred vision;burning, numbness, tingling, or painful sensations in the hands or feet;changes in speech patterns;confusion;convulsions;decreased vision;depression;dizziness;drowsiness;eye pain;fever;hallucinations;headache;irritability;lack of coordination;nausea;seizures;shakiness and unsteady walk;slurred speech;stiff neck or back;trouble speaking;unsteadiness, trembling, or other problems with muscle control or coordination;unusual tiredness or weakness;vomiting;weakness in the arms, hands, legs, or feet;black, tarry stools;blood in the urine or stools;body aches or pain;chills;clumsiness or unsteadiness;difficulty with breathing;ear congestion;feeling of pelvic pressure;frequent or painful urination;loss of voice;nasal congestion;pinpoint red spots on the skin;runny nose;skin rash, hives, redness, or itching;sneezing;stomach and back pain (severe);unusual bleeding or bruising;vaginal irritation, discharge, or dryness not present before taking the medicine;bleeding gums;bloating;chest pain;constipation;cough;dark-colored urine;fast heartbeat;indigestion;loss of appetite;painful or difficult urination;pains in the stomach, side, or abdomen, possibly radiating to the back;sore throat;sores, ulcers, or white spots on the lips or in the mouth;swollen glands;yellow eyes or skin;blistering, peeling, or loosening of the skin;bloody or cloudy urine;burning while urinating;continuing diarrhea;continuing stomach pain;diarrhea;feeling of warmth;increased volume of pale, dilute urine;joint or muscle pain;loss of bladder control;red skin lesions, often with a purple center;red, irritated eyes;redness of the face, neck, arms, and occasionally, upper chest;redness of the skin;abdominal or stomach cramps;dizziness or lightheadedness;feeling of constant movement of self or surroundings;heartburn;sensation of spinning;trouble sleeping;weight loss;change in taste sensation;congestion;dry mouth;pain or tenderness around the eyes and cheekbones;tender, swollen glands in the neck;trouble with swallowing;unpleasant or sharp metallic taste;voice changes;decreased interest in sexual intercourse;inability to have or keep an erection;loss in sexual ability, desire, drive, or performance;painful sexual intercourse;or",,,,,,,,
63,63,gentamicin,,,,,,,,,,,"abdominal or stomach cramps or pain;agitation;back pain;black, tarry stools;blood in the urine;blurred or double vision;burning, numbness, tingling, or painful sensations;change in frequency of urination or amount of urine;chest pain;chills;coma;confusion;continuing ringing or buzzing or other unexplained noise in the ears;cough;difficult or troubled breathing;difficulty with swallowing;dizziness, faintness, or lightheadedness when getting up suddenly from a lying or sitting position;drowsiness;dry mouth;eye pain;fast heartbeat;fever with or without chills;hallucinations;headache;hearing loss;hives;hoarseness;increased thirst;irregular heartbeats;irregular, fast or slow, or shallow breathing;irritability;itching;joint pain;loss of appetite;mood or mental changes;muscle cramps in the hands, arms, feet, legs, or face;muscle pain or weakness;muscle spasms (tetany) or twitching;nausea or vomiting;nervousness;numbness and tingling around the mouth, fingertips, or feet;pale or blue lips, fingernails, or skin;pale skin;pinpoint red spots on the skin;puffiness or swelling of the eyelids or around the eyes, face, lips, or tongue;right upper abdominal or stomach pain and fullness;seizures;sensation of spinning;skin rash;slow or fast heartbeat;slow or irregular breathing;sore throat;sores, ulcers, or white spots on the lips or in the mouth;stiff neck;sweating;swelling of the feet or lower legs;swollen glands;tightness in the chest;trembling;unusual bleeding or bruising;unusual tiredness or weakness;weight chest discomfort;weight loss;wheezing;blurred or loss of vision;decreased appetite;depression;disturbed color perception;hair loss or thinning of the hair;halos around lights;hives or welts;increased salivation;night blindness;overbright appearance of lights;pain at the injection site;purple spots on the skin;redness of the skin;swelling or inflammation of the mouth;tunnel vision;unusual drowsiness, dullness, tiredness, weakness, or feeling of sluggishness;or",,,,,,,,
64,64,Invanz,,,,,,,,,,,"bleeding;blistering;burning;coldness;diarrhea;discoloration of skin;feeling of pressure;hives;infection;inflammation;itching skin;lumps;numbness;pain;redness of skin;scarring;skin rash;soreness;stinging;swelling;tenderness;tingling;ulceration;unusually warm skin;bluish color changes in skin color;dry, red, hot, or irritated skin;fast, pounding, or irregular heartbeat or pulse;pain, tenderness, or swelling of foot or leg;abdominal or stomach cramps;abdominal tenderness;bloating;convulsions;diarrhea, watery and severe, which may also be bloody;fainting or loss of consciousness;fast or irregular breathing;fever;increased thirst;loss of bladder control;muscle spasm or jerking of all extremities;nausea;sudden loss of consciousness;swelling of eyes or eyelids;tightness in chest;trouble in breathing;unusual tiredness or weakness;unusual weight loss;vomiting;wheezing;cough;difficulty swallowing;itching, puffiness, or swelling of the eyelids or around the eyes, face, lips, or tongue;seeing, hearing, or feeling things that are not there;shortness of breath;agitation;chest pain;confusion about identity, place, and time;drowsiness;headache;mental depression;acid or sour stomach;belching;blurred vision;body aches or pain;congestion;difficult or labored breathing;difficulty having a bowel movement (stool);dizziness;dryness or soreness of throat;faintness or lightheadedness when getting up from a lying or sitting position;fear;flushing;heartburn;hoarseness;indigestion;itching of the vagina or genital area;lack or loss of strength;leg pain;nervousness;pain during sexual intercourse;pounding in the ears;runny nose;sleeplessness;slow heartbeat;sore mouth or tongue;stomach discomfort, upset, or pain;sudden sweating;tender, swollen glands in neck;thick, white vaginal discharge with no odor or with a mild odor;tightness in chest;trouble sleeping;unable to sleep;voice changes;white patches in mouth and/or on tongue;or",,,,,,,,
65,65,Minocin,,,,,,,,,,,"black, tarry stools;blistering, peeling, or loosening of the skin;blood in the urine or stools;blurred or double vision;bulging soft spot on the head of an infant;chest pain, possibly moving to the left arm, neck, or shoulder;confusion;diarrhea;dizziness or lightheadedness;eye pain;fast heartbeat;general feeling of discomfort or illness;general tiredness and weakness;hives, itching, or skin rash;joint or muscle pain;large, hive-like swelling on the face, eyelids, lips, tongue, throat, hands, legs, feet, or sex organs;loss of appetite;nausea or vomiting;red skin lesions, often with a purple center;severe headache;severe stomach pain;sores, ulcers, or white spots on the lips or in the mouth;troubled breathing;unusual bleeding or bruising;upper right abdominal or stomach pain;yellow eyes and skin;continuing ringing or buzzing or other unexplained noise in the ears;difficulty with moving;hearing loss;hives or welts;muscle stiffness;redness of the skin;sleepiness or unusual drowsiness;bloating;discoloration of the tooth;increased sensitivity of the skin to sunlight;indigestion;severe sunburn;or",,,,,,,,
66,66,moxifloxacin,,,,,,,,,,,"abdominal or stomach cramps;abdominal or stomach tenderness;black, tarry stools;bleeding gums;blisters;bloating or swelling of the face, arms, hands, lower legs, or feet;blood in the urine or stools;blurred vision;bone pain;burning, crawling, itching, numbness, prickling, ""pins and needles"", or tingling feelings;chest pain;chills;clay-colored stools;cough;crying;dark urine;diarrhea, watery and severe, which may also be bloody;difficult or labored breathing;difficulty with moving;difficulty with swallowing;discouragement;dizziness, faintness, or lightheadedness when getting up suddenly from a lying or sitting position;dry mouth;excessive muscle tone;fainting;fast, irregular, pounding, or racing heartbeat or pulse;feeling of unreality;feeling of warmth or heat;feeling sad or empty;fever;flushed, dry skin;flushing or redness of the skin, especially on the face and neck;fruit-like breath odor;headache;hyperventilation;increased hunger;increased sensitivity of the skin to sunlight;increased thirst;increased urination;irregular heartbeat recurrent;irritability;joint pain, stiffness, or swelling;lack of coordination;loss of appetite;loss of interest or pleasure;lower back, side, or stomach pain;mood or mental changes;muscle aching or cramping;muscle pains or stiffness;muscle tension or tightness;nausea or vomiting;nervousness;noisy breathing;pain;pain in the pelvis;pain, warmth, or burning in the fingers, toes, and legs;painful or difficult urination;painful, swollen joints;pale skin;pinpoint red spots on the skin;pounding in the ears;problems with speech or speaking;problems with vision or hearing;quick to react or overreact emotionally;rapid weight gain;rapidly changing moods;redness or other discoloration of the skin;restlessness;seeing, hearing, or feeling things that are not there;seizures;sensation of the skin burning;sense of detachment from self or body;severe sunburn;shakiness in the legs, arms, hands, or feet;skin rash or itching;sore throat;sores, ulcers, or white spots on the lips or in the mouth;sweating;swelling of the feet or lower legs;swelling or puffiness of the face;swollen glands;tightness in the chest;tingling of the hands or feet;tiredness;trouble concentrating;trouble sleeping;troubled breathing with exertion;unexplained weight loss;unpleasant breath odor;unusual bleeding or bruising;unusual tiredness or weakness;unusual weight gain or loss;vomiting of blood;yellow eyes or skin;blistering, peeling, or loosening of the skin;burning, numbness, tingling, or painful sensations;change in the ability to see colors, especially blue or yellow;difficulty with chewing or talking;double vision;drooping eyelids;eye pain;general feeling of tiredness or weakness;hives;hoarseness;irregular or slow heart rate;large, hive-like swelling on the face, eyelids, lips, tongue, throat, hands, legs, feet, or sex organs;light-colored stools;muscle weakness;no blood pressure or pulse;puffiness or swelling of the eyelids or around the eyes, face, lips, or tongue;red, irritated eyes;red skin lesions, often with a purple center;severe headache;severe tiredness;stomach pain, continuing;stopping of heart;unconsciousness;unsteadiness or awkwardness;unusual behavior, such as disorientation to time or place, failure to recognize people, hyperactivity, or restlessness;weakness in the arms, hands, legs, or feet;acid or sour stomach;bad, unusual, or unpleasant (after) taste;belching;burning feeling in the chest or stomach;change in sense of smell;change in taste;changes in vision;continuing ringing or buzzing or other unexplained noise in the ears;difficulty having a bowel movement (stool);excess air or gas in the stomach or intestines;fear or nervousness;feeling of constant movement of self or surroundings;full feeling;general feeling of discomfort or illness;hearing loss;heartburn;impaired vision;indigestion;itching of the vagina or genital area;lack or loss of strength;loss of memory;pain during sexual intercourse;passing of gas;problems with memory;redness, swelling, or soreness of the tongue;sensation of spinning;sleepiness or unusual drowsiness;sore mouth or tongue;stomach discomfort, upset, or pain;thick, white vaginal discharge with no odor or with a mild odor;white patches in the mouth or on the tongue;or",,,,,,,,
67,67,Panixine,,,,,,,,,,,"diarrhea;abdominal or stomach pain;blistering, peeling, or loosening of the skin;chills;clay-colored stools;cough;dark urine;diarrhea;dizziness;fever;general tiredness and weakness;headache;itching or rash;joint or muscle pain;light-colored stools;loss of appetite;nausea and vomiting;red skin lesions, often with a purple center;red, irritated eyes;sore throat;sores, ulcers, or white spots in the mouth or on the lips;unpleasant breath odor;unusual tiredness or weakness;upper right abdominal or stomach pain;vomiting of blood;yellow eyes or skin;abdominal or stomach cramps or tenderness;back or leg pains;black, tarry stools;bleeding gums;bloating;blood in the urine or stools;chest pain;coughing up blood;diarrhea, watery and severe, which may also be bloody;difficulty with breathing or swallowing;fast heartbeat;general body swelling;hives;increased menstrual flow or vaginal bleeding;increased thirst;large, hive-like swelling on the face, eyelids, lips, tongue, throat, hands, legs, feet, or sex organs;loss of appetite;nosebleeds;pain;painful or difficult urination;pale skin;paralysis;pinpoint red spots on the skin;prolonged bleeding from cuts;puffiness or swelling of the eyelids or around the eyes, face, lips, or tongue;red or black, tarry stools;red or dark brown urine;swollen or painful glands;tightness in the chest;unusual bleeding or bruising;unusual weight loss;watery or bloody diarrhea;acid or sour stomach;anxiety;belching;burning feeling in the chest or stomach;difficulty with moving;dry mouth;heartburn;hyperventilation;indigestion;irregular heartbeats;irritability;itching of the vagina or genital area;muscle pain or stiffness;nervousness;pain during sexual intercourse;pain, swelling, or redness in the joints;redness of the skin;restlessness;seeing, hearing, or feeling things that are not there;shaking;stomach upset;trouble sleeping;white or brownish vaginal discharge;or",,,,,,,,
68,68,piperacillin / tazobactam,,,,,,,,,,,"diarrhea;bladder pain;bloating or swelling of the face, arms, hands, lower legs, or feet;blurred vision;burning upper abdominal or stomach pain;changes in urination;chest pain;confusion;dizziness, faintness, or lightheadedness when getting up suddenly from a lying or sitting position;fever or sweating;headache;inflammation or swelling at the injection site;lower back or side pain;nausea or vomiting;pain, tenderness, or swelling of the foot or leg;pain, warmth, or burning in the fingers, toes, and legs;problems with vision or hearing;skin rash;slow or fast heartbeat;troubled breathing;abdominal or stomach cramps, pain, or tenderness;agitation;bone pain;bruising;chills;cold sweats;cough;deep or fast breathing with dizziness;depression;diarrhea, watery and severe, which may also be bloody;drowsiness;dry mouth;hives;hostility;itching of the vagina or genital area;lethargy;muscle pain or cramps;muscle stiffness or twitching;nightmares;numbness or tingling in the hands, feet, or lips;puffiness or swelling of the eyelids or around the eyes, face, lips, or tongue;sore throat;sores, ulcers, or white spots on the lips, tongue, or inside the mouth;swollen glands;temporary blindness;thick, white vaginal discharge with no odor or with a mild odor;total body jerking;unexplained weight loss;unusual bleeding or bruising;back or leg pain;blistering, peeling, or loosening of the skin;high fever;joint or muscle pain;red skin lesions, often with a purple center;yellow eyes or skin;difficulty having a bowel movement (stool);trouble sleeping;acid or sour stomach;cracks in the skin at the corners of the mouth;hiccup;irritation and redness of the skin;runny nose;sneezing;stuffy nose;white patches in the mouth or on the tongue;body aches or pain;burning feeling in the chest or stomach;change in taste or bad unusual or unpleasant (after) taste;feeling of constant movement of self or surroundings;sensation of spinning;severe sleepiness;tenderness in stomach area;vision changes;voice changes",,,,,,,,
69,69,Vancocin,,,,,,,,,,,"bladder pain;bloating or swelling of the face, arms, hands, lower legs, or feet;bloody or cloudy urine;convulsions;decreased urine;difficult, burning, or painful urination;dry mouth;fever;frequent urge to urinate;increased thirst;irregular heartbeat;loss of appetite;lower back or side pain;mood changes;muscle pain or cramps;nausea or vomiting;numbness or tingling in the hands, feet, or lips;rapid weight gain;shortness of breath;unusual tiredness or weakness;unusual weight gain or loss;change in the frequency of urination or amount of urine;difficulty with breathing;drowsiness;weakness;hives;redness or other discoloration of the skin;scaling or welting of the skin;skin rash;black, tarry stools;bleeding gums;blistering, peeling, or loosening of the skin;blurred vision;chills;confusion;continuing ringing or buzzing or other unexplained noise in the ears;cough;diarrhea;difficulty with swallowing;dizziness, faintness, or lightheadedness when getting up suddenly from a lying or sitting position;fast heartbeat;feeling of constant movement of self or surroundings;feeling of fullness in the ears;hearing loss;itching;joint or muscle pain;loss of balance;lower back or side pain;pale skin;pinpoint red spots on the skin;puffiness or swelling of the eyelids or around the eyes, face, lips, or tongue;red skin lesions, often with a purple center;red, irritated eyes;ringing or buzzing in the ears;sensation of spinning;sore throat;sores, ulcers, or white spots in the mouth or on the lips;sweating;tightness in the chest;troubled breathing with exertion;unusual bleeding or bruising;abdominal or stomach pain;back pain;bitter or unpleasant taste;excess air or gas in the stomach or intestines;headache;mouth irritation;passing gas;depression;difficulty having a bowel movement (stool);trouble sleeping;or",,,,,,,,
70,70,Zosyn,,,,,,,,,,,"diarrhea;bladder pain;bloating or swelling of the face, arms, hands, lower legs, or feet;blurred vision;burning upper abdominal or stomach pain;changes in urination;chest pain;confusion;dizziness, faintness, or lightheadedness when getting up suddenly from a lying or sitting position;fever or sweating;headache;inflammation or swelling at the injection site;lower back or side pain;nausea or vomiting;pain, tenderness, or swelling of the foot or leg;pain, warmth, or burning in the fingers, toes, and legs;problems with vision or hearing;skin rash;slow or fast heartbeat;troubled breathing;abdominal or stomach cramps, pain, or tenderness;agitation;bone pain;bruising;chills;cold sweats;cough;deep or fast breathing with dizziness;depression;diarrhea, watery and severe, which may also be bloody;drowsiness;dry mouth;hives;hostility;itching of the vagina or genital area;lethargy;muscle pain or cramps;muscle stiffness or twitching;nightmares;numbness or tingling in the hands, feet, or lips;puffiness or swelling of the eyelids or around the eyes, face, lips, or tongue;sore throat;sores, ulcers, or white spots on the lips, tongue, or inside the mouth;swollen glands;temporary blindness;thick, white vaginal discharge with no odor or with a mild odor;total body jerking;unexplained weight loss;unusual bleeding or bruising;back or leg pain;blistering, peeling, or loosening of the skin;high fever;joint or muscle pain;red skin lesions, often with a purple center;yellow eyes or skin;difficulty having a bowel movement (stool);trouble sleeping;acid or sour stomach;cracks in the skin at the corners of the mouth;hiccup;irritation and redness of the skin;runny nose;sneezing;stuffy nose;white patches in the mouth or on the tongue;body aches or pain;burning feeling in the chest or stomach;change in taste or bad unusual or unpleasant (after) taste;feeling of constant movement of self or surroundings;sensation of spinning;severe sleepiness;tenderness in stomach area;vision changes;voice changes",,,,,,,,
71,71,amikacin,,,,,,,,,,,"agitation;black, tarry stools;bloody or cloudy urine;bluish lips or skin;blurred vision;burning, crawling, itching, numbness, prickling, ""pins and needles"", or tingling feelings;chest pain;chills;coma;confusion;cough;decrease in the amount of urine;decreased urine output;depression;difficulty with breathing;difficulty with moving;dizziness;dizziness, faintness, or lightheadedness when getting up suddenly from a lying or sitting position;drowsiness;dry mouth;feeling of fullness in the ears;fever;headache;hearing loss;irritability;lethargy;loss of balance;loss or change in hearing;muscle pain or stiffness;muscle twitching;nausea;not breathing;pain in the joints;pain in the lower back or side;painful or difficult urination;pale skin;rapid weight gain;ringing or buzzing in the ears;seizures;shakiness in the legs, arms, hands, or feet;shortness of breath;sore throat;sores, ulcers, or white spots on the lips or in the mouth;stupor;sweating;swelling of the face, ankles, or hands;swollen glands;thirst;trembling or shaking of the hands or feet;trouble with hearing;troubled breathing with exertion;unusual bleeding or bruising;unusual tiredness or weakness;skin rash;vomiting;or",,,,,,,,
72,72,ampicillin / sulbactam,,,,,,,,,,,"changes in skin color;diarrhea;pain, tenderness, or swelling of the foot or leg;bloody nose;burning while urinating;chest pain, discomfort, or pressure;chills;decrease in the frequency of urination;decrease in urine volume;difficulty in passing urine (dribbling);flushing or redness of the skin;painful urination;swelling;swelling or puffiness of the face;tightness in the throat;unusually warm skin;abdominal or stomach cramps or tenderness;black, hairy tongue;blistering, peeling, or loosening of the skin;bloating;cough or hoarseness;cracks in the skin;diarrhea, watery and severe, which may also be bloody;fever;fever with or without chills;general feeling of tiredness or weakness;increased thirst;itching;joint or muscle pain;loss of heat from the body;lower back or side pain;nausea or vomiting;pain;red, irritated eyes;red, swollen skin;scaly skin;severe stomach pain;sore throat;sores, ulcers, or white spots on the lips or in the mouth;swelling or inflammation of the mouth;unusual bleeding or bruising;unusual tiredness or weakness;unusual weight loss;vomiting;bleeding, blistering, burning, coldness, discoloration of the skin, feeling of pressure, hives, infection, inflammation, itching, lumps, numbness, pain, rash, redness, scarring, soreness, stinging, swelling, tenderness, tingling, ulceration, or warmth at the injection site;excess air or gas in the stomach or intestines;full or bloated feeling;general feeling of discomfort or illness;headache;passing gas;pressure in the stomach;redness, swelling, or soreness of the tongue;swelling of the abdominal or stomach area;white patches in the mouth or throat or on the tongue;white patches with diaper rash;burning feeling in the chest or stomach;indigestion;stomach upset",,,,,,,,
73,73,cefotaxime,,,,,,,,,,,"abdominal or stomach cramps or tenderness;black, tarry stools;bloating;chest pain;chills;diarrhea;diarrhea, watery and severe, which may also be bloody;difficulty with breathing;difficulty with swallowing;dizziness;fast heartbeat;fever;hives, itching, or skin rash;increased thirst;large, hive-like swelling on the face, eyelids, lips, tongue, throat, hands, legs, feet, or sex organs;nausea or vomiting;noisy breathing;pain;painful or difficult urination;puffiness or swelling of the eyelids or around the eyes, face, lips, or tongue;sore throat;sores, ulcers, or white spots on the lips or in the mouth;swollen glands;tenderness;tightness in the chest;unusual bleeding or bruising;unusual tiredness or weakness;unusual weight loss;agitation;back, leg, or stomach pains;bleeding gums;blistering, peeling, or loosening of the skin;blood in the urine or stools;bloody or cloudy urine;blurred vision;coma;confusion;cough or hoarseness;cracks in the skin at the corners of the mouth;dark urine;drowsiness;fainting;fast, slow, or irregular heartbeat;fever with or without chills;general body swelling;general feeling of tiredness or weakness;greatly decreased frequency of urination or amount of urine;hallucinations;headache;irritability;itching of the vagina or genital area;joint or muscle pain;loss of appetite;lower back or side pain;nosebleeds;pain during sexual intercourse;pale skin;pinpoint red spots on the skin;red skin lesions, often with a purple center;red, irritated eyes;seizures;soreness or redness around the fingernails and toenails;stiff neck;swelling of the feet or lower legs;thick, white vaginal discharge with no odor or with a mild odor;yellow eyes or skin;clay-colored stools;unpleasant breath odor;vomiting of blood;red streaks on the skin;swelling, tenderness, or pain at the injection site;or",,,,,,,,
