,Unnamed: 0,Brand Name,Generic Name,Type of Treatment,Brief Description,Quantity,Location,Uninsured Cost,Typical Copay,Rating,Vendor,Effectiveness,Side Effects / Risk,Ingredients,Usage Overview,Conflicting Treatment/Therapies,Food Interaction,Frequency of Treatment,Estimated Percentage of Usage,Additional Information,Reference Link
0,0,cephalexin,,,,,,,,,,,"diarrhea;abdominal or stomach pain;blistering, peeling, or loosening of the skin;chills;clay-colored stools;cough;dark urine;diarrhea;dizziness;fever;general tiredness and weakness;headache;itching or rash;joint or muscle pain;light-colored stools;loss of appetite;nausea and vomiting;red skin lesions, often with a purple center;red, irritated eyes;sore throat;sores, ulcers, or white spots in the mouth or on the lips;unpleasant breath odor;unusual tiredness or weakness;upper right abdominal or stomach pain;vomiting of blood;yellow eyes or skin;abdominal or stomach cramps or tenderness;back or leg pains;black, tarry stools;bleeding gums;bloating;blood in the urine or stools;chest pain;coughing up blood;diarrhea, watery and severe, which may also be bloody;difficulty with breathing or swallowing;fast heartbeat;general body swelling;hives;increased menstrual flow or vaginal bleeding;increased thirst;large, hive-like swelling on the face, eyelids, lips, tongue, throat, hands, legs, feet, or sex organs;loss of appetite;nosebleeds;pain;painful or difficult urination;pale skin;paralysis;pinpoint red spots on the skin;prolonged bleeding from cuts;puffiness or swelling of the eyelids or around the eyes, face, lips, or tongue;red or black, tarry stools;red or dark brown urine;swollen or painful glands;tightness in the chest;unusual bleeding or bruising;unusual weight loss;watery or bloody diarrhea;acid or sour stomach;anxiety;belching;burning feeling in the chest or stomach;difficulty with moving;dry mouth;heartburn;hyperventilation;indigestion;irregular heartbeats;irritability;itching of the vagina or genital area;muscle pain or stiffness;nervousness;pain during sexual intercourse;pain, swelling, or redness in the joints;redness of the skin;restlessness;seeing, hearing, or feeling things that are not there;shaking;stomach upset;trouble sleeping;white or brownish vaginal discharge;or",,,,,,,,
1,1,Keflex,,,,,,,,,,,"diarrhea;abdominal or stomach pain;blistering, peeling, or loosening of the skin;chills;clay-colored stools;cough;dark urine;diarrhea;dizziness;fever;general tiredness and weakness;headache;itching or rash;joint or muscle pain;light-colored stools;loss of appetite;nausea and vomiting;red skin lesions, often with a purple center;red, irritated eyes;sore throat;sores, ulcers, or white spots in the mouth or on the lips;unpleasant breath odor;unusual tiredness or weakness;upper right abdominal or stomach pain;vomiting of blood;yellow eyes or skin;abdominal or stomach cramps or tenderness;back or leg pains;black, tarry stools;bleeding gums;bloating;blood in the urine or stools;chest pain;coughing up blood;diarrhea, watery and severe, which may also be bloody;difficulty with breathing or swallowing;fast heartbeat;general body swelling;hives;increased menstrual flow or vaginal bleeding;increased thirst;large, hive-like swelling on the face, eyelids, lips, tongue, throat, hands, legs, feet, or sex organs;loss of appetite;nosebleeds;pain;painful or difficult urination;pale skin;paralysis;pinpoint red spots on the skin;prolonged bleeding from cuts;puffiness or swelling of the eyelids or around the eyes, face, lips, or tongue;red or black, tarry stools;red or dark brown urine;swollen or painful glands;tightness in the chest;unusual bleeding or bruising;unusual weight loss;watery or bloody diarrhea;acid or sour stomach;anxiety;belching;burning feeling in the chest or stomach;difficulty with moving;dry mouth;heartburn;hyperventilation;indigestion;irregular heartbeats;irritability;itching of the vagina or genital area;muscle pain or stiffness;nervousness;pain during sexual intercourse;pain, swelling, or redness in the joints;redness of the skin;restlessness;seeing, hearing, or feeling things that are not there;shaking;stomach upset;trouble sleeping;white or brownish vaginal discharge;or",,,,,,,,
2,2,clindamycin,,,,,,,,,,,"cracks in the skin;loss of heat from the body;red, swollen skin scaly skin;abdominal or stomach cramps, pain, or tenderness;black, tarry stools;bleeding gums;blistering, peeling, or loosening of the skin;bloating;blood in the urine or stools;blurred vision;chest pain;chills;clay-colored stools;cloudy urine;confusion;cough or hoarseness;dark urine;decrease in the amount of urine;diarrhea;diarrhea, watery and severe, which may also be bloody;difficulty with swallowing;dizziness;dizziness, faintness, or lightheadedness when getting up suddenly from a lying or sitting position;dry mouth;fast heartbeat;fever with or without chills;general feeling of tiredness or weakness;headache;heartburn;heart stops;hives or welts, itching, or skin rash;increased thirst;itching of the vagina or genital area;joint or muscle pain;loss of appetite;lower back or side pain;nausea or vomiting;no breathing;no pulse or blood pressure;pain during sexual intercourse;pain in the lower back or side;painful or difficult urination;pinpoint red spots on the skin;puffiness or swelling of the eyelids or around the eyes, face, lips, or tongue;rash with flat lesions or small raised lesions on the skin;red skin lesions, often with a purple center;red, irritated eyes;redness of the skin;shortness of breath;sore throat;sores, ulcers, or white spots in the mouth or on the lips;swollen glands;thick, white vaginal discharge with no odor or with a mild odor;thirst;tightness in the chest;unconscious;unpleasant breath odor;unusual bleeding or bruising;unusual tiredness or weakness;unusual weight loss;vomiting of blood;yellow eyes or skin;or",,,,,,,,
3,3,Amoxil,,,,,,,,,,,"abdominal or stomach cramps or tenderness;back, leg, or stomach pains;black, tarry stools;bleeding gums;blistering, peeling, or loosening of the skin;bloating;blood in the urine;bloody nose;chest pain;chills;clay-colored stools;cough;dark urine;diarrhea;diarrhea, watery and severe, which may also be bloody;difficulty with breathing;difficulty with swallowing;dizziness;fast heartbeat;feeling of discomfort;fever;general body swelling;headache;heavier menstrual periods;hives or welts;increased thirst;inflammation of the joints;itching;joint or muscle pain;loss of appetite;muscle aches;nausea or vomiting;nosebleeds;pain;pain in the lower back;pain or burning while urinating;painful or difficult urination;pale skin;pinpoint red spots on the skin;puffiness or swelling of the eyelids or around the eyes, face, lips, or tongue;rash;red, irritated eyes;redness, soreness, or itching skin;shortness of breath;sore throat;sores, ulcers, or white spots in the mouth or on the lips;sores, welting, or blisters;sudden decrease in the amount of urine;swollen, lymph glands;tenderness;tightness in the chest;unpleasant breath odor;unusual bleeding or bruising;unusual tiredness or weakness;unusual weight loss;vomiting of blood;watery or bloody diarrhea;wheezing;yellow eyes or skin;bad, unusual, or unpleasant (after) taste;change in taste;agitation;black, hairy tongue;changes in behavior;confusion;convulsions;discoloration of the tooth (brown, yellow, or gray staining);dizziness;sleeplessness;trouble with sleeping;unable to sleep;white patches in the mouth or throat or on the tongue;white patches with diaper rash;or",,,,,,,,
4,4,doxycycline,,,,,,,,,,,"abdominal or stomach tenderness;black, tarry stools;bloating;clay-colored stools;cough;dark urine;decreased appetite;diarrhea;diarrhea, watery and severe, which may also be bloody;difficulty with swallowing;dizziness;fast heartbeat;feeling of discomfort;fever;headache;hives, itching, puffiness or swelling of the eyelids or around the eyes, face, lips, or tongue;hives or welts, itching, or rash;increased thirst;inflammation of the joints;joint or muscle pain;large, hive-like swelling on the face, eyelids, lips, tongue, throat, hands, legs, feet, or sex organs;loss of appetite;nausea and vomiting;numbness or tingling of the face, hands, or feet;pain;redness and soreness of the eyes;redness of the skin;severe stomach pain;sore throat;sores in the mouth;stomach cramps;stomach pain or tenderness;swelling of the feet or lower legs;swollen lymph glands;tightness in the chest;unusual tiredness or weakness;unusual weight loss;yellow eyes or skin;back, leg, or stomach pains;bleeding gums;blood in the urine or stools;blurred vision;bulging soft spot on the head of an infant;change in the ability to see colors, especially blue or yellow;chest pain, discomfort, or burning;chills;cracks in the skin;decrease in vision;difficulty breathing;discoloration of the thyroid glands;double vision;general body swelling;heartburn;increased sensitivity of the skin to sunlight;loss of heat from the body;lower back or side pain;nosebleeds;pain or burning in the throat;pain with swallowing;painful or difficult urination;pale skin;pinpoint red spots on the skin;rash with flat lesions or small raised lesions on the skin;red, swollen skin;redness or other discoloration of the skin;redness, swelling, or soreness of the tongue;scaly skin;severe nausea;severe sunburn;sores, ulcers, or white spots on the lips or tongue or inside the mouth;unusual bleeding or bruising;vomiting blood;or",,,,,,,,
5,5,Augmentin,,,,,,,,,,,"hives or welts;itching;itching of the vagina or genital area;pain during sexual intercourse;redness of the skin;skin rash;thick, white vaginal discharge with no odor or with a mild odor;bloody or cloudy urine;fever;greatly decreased frequency of urination or amount of urine;seizures;swelling of the feet or lower legs;abdominal or stomach cramps or tenderness;back, leg, or stomach pains;black, hairy tongue;black, tarry stools;bleeding gums;blistering, peeling, or loosening of the skin;bloating;blood in the stools;bloody nose;chest pain;chills;clay-colored stools;cough or hoarseness;cracks in the skin;dark urine;diarrhea;diarrhea, watery and severe, which may also be bloody;difficulty with breathing;difficulty with moving;difficulty with swallowing;dizziness;fast heartbeat;fever with or without chills;general body swelling;general feeling of tiredness or weakness;headache;heavier menstrual periods;increased thirst;joint or muscle pain;large, hive-like swelling on the face, eyelids, lips, tongue, throat, hands, legs, feet, or sex organs;light-colored stools;loss of appetite;loss of heat from the body;lower back or side pain;muscle stiffness;nausea or vomiting;pain;pain, swelling, or redness in the joints;painful or difficult urination;pale skin;pinpoint red spots on the skin;puffiness or swelling of the eyelids or around the eyes, face, lips, or tongue;rash;red skin lesions, often with a purple center;red, irritated eyes;red, swollen skin;scaly skin;sore throat;sores, ulcers, or white spots on the lips or in the mouth;swollen glands;tightness in the chest;troubled breathing with exertion;unpleasant breath odor;unusual bleeding or bruising;unusual tiredness or weakness;unusual weight loss;upper right abdominal or stomach pain;vomiting of blood;white patches in the mouth or throat or on the tongue;white patches with diaper rash;yellow eyes or skin;abdominal or stomach pain;cloudy urine;diarrhea;greatly decreased frequency of urination or amount of urine;sleepiness;anxiety;dry mouth;hyperventilation;irregular heartbeats;irritability;restlessness;shaking;sleeplessness;tooth discoloration;trouble sitting still;trouble with sleeping;burning feeling in the chest or stomach;indigestion;redness, swelling, or soreness of the tongue;stomach upset;swelling or inflammation of the mouth",,,,,,,,
6,6,amoxicillin,,,,,,,,,,,"abdominal or stomach cramps or tenderness;back, leg, or stomach pains;black, tarry stools;bleeding gums;blistering, peeling, or loosening of the skin;bloating;blood in the urine;bloody nose;chest pain;chills;clay-colored stools;cough;dark urine;diarrhea;diarrhea, watery and severe, which may also be bloody;difficulty with breathing;difficulty with swallowing;dizziness;fast heartbeat;feeling of discomfort;fever;general body swelling;headache;heavier menstrual periods;hives or welts;increased thirst;inflammation of the joints;itching;joint or muscle pain;loss of appetite;muscle aches;nausea or vomiting;nosebleeds;pain;pain in the lower back;pain or burning while urinating;painful or difficult urination;pale skin;pinpoint red spots on the skin;puffiness or swelling of the eyelids or around the eyes, face, lips, or tongue;rash;red, irritated eyes;redness, soreness, or itching skin;shortness of breath;sore throat;sores, ulcers, or white spots in the mouth or on the lips;sores, welting, or blisters;sudden decrease in the amount of urine;swollen, lymph glands;tenderness;tightness in the chest;unpleasant breath odor;unusual bleeding or bruising;unusual tiredness or weakness;unusual weight loss;vomiting of blood;watery or bloody diarrhea;wheezing;yellow eyes or skin;bad, unusual, or unpleasant (after) taste;change in taste;agitation;black, hairy tongue;changes in behavior;confusion;convulsions;discoloration of the tooth (brown, yellow, or gray staining);dizziness;sleeplessness;trouble with sleeping;unable to sleep;white patches in the mouth or throat or on the tongue;white patches with diaper rash;or",,,,,,,,
7,7,Cipro,,,,,,,,,,,"diarrhea;bloody or black, tarry stools;burning, crawling, itching, numbness, prickling, ""pins and needles"", or tingling feelings;changes in skin color;changes in urination;chest pain or discomfort;chest tightness or heaviness;chills or fever;clumsiness or unsteadiness;confusion;continuing ringing or buzzing or other unexplained noise in the ears;coughing or spitting up blood;dizziness, faintness, or lightheadedness when getting up suddenly from a lying or sitting position;fast, irregular, pounding, or racing heartbeat or pulse;headache, severe and throbbing;hearing loss;hives or welts or skin rash;joint stiffness;large, hive-like swelling on the face, eyelids, lips, tongue, throat, hands, legs, feet, or sex organs;light-colored stools;muscle pain or stiffness;nausea and vomiting;nightmares;numbness of the hands;pain in the joints;pain or discomfort in the arms, jaw, back, or neck;painful, red lumps under the skin, mostly on the legs;pounding in the ears;puffiness or swelling of the eyelids or around the eyes, face, lips, or tongue;redness of the face, neck, arms, and occasionally, upper chest;seizures;severe abdominal or stomach pain, cramping, or burning;shakiness in the legs, arms, hands, or feet;swelling of the face, feet, or lower legs;swollen, painful, or tender lymph glands in the neck, armpit, or groin;thick, white vaginal discharge with no odor or with a mild odor;unsteadiness, trembling, or other problems with muscle control or coordination;unusual drowsiness, dullness, tiredness, weakness, or feeling of sluggishness;white patches in the mouth and/or on the tongue;yellow eyes or skin;acid or sour stomach;blistering, peeling, or loosening of the skin;bluish-colored lips, fingernails, or palms;bone pain;diarrhea, watery and severe, which may also be bloody;difficulty with breathing, chewing, or talking;double vision;excessive muscle tone;feeling of discomfort;feeling, seeing, or hearing things that are not there;increased sensitivity to pain;increased sensitivity to touch;irregular or slow heart rate;mood changes;nosebleeds;rapid heart rate;red skin lesions, often with a purple center;seeing, hearing, or feeling things that are not there;sores, ulcers, or white spots on the lips or in the mouth;unusual bleeding or bruising;unusual excitement, nervousness, or restlessness;vaginal yeast infection;runny nose;sneezing;stuffy nose;or",,,,,,,,
8,8,Azithromycin Dose Pack,,,,,,,,,,,"diarrhea;loose stools;blistering, crusting, irritation, itching, or reddening of the skin;cracked, dry, or scaly skin;fever;swelling;abdominal or stomach pain;blistering, peeling, or loosening of the skin;bloody or cloudy urine;bloody, black, or tarry stools;body aches or pain;burning while urinating;chest pain;chills;congestion;cough increased;cough producing mucus;dark urine;difficult or labored breathing;difficult or painful urination;dizziness;drowsiness;dryness or soreness of the throat;earache;fainting;fast, irregular, pounding, or racing heartbeat or pulse;general feeling of discomfort or illness;general feeling of tiredness or weakness;headache;indigestion;irregular or slow heart rate;itching;joint or muscle pain;large, hive-like swelling on the face, eyelids, lips, tongue, throat, hands, legs, feet, or sex organs;light-colored stools;loss of appetite;muscle aches and pains;nausea or vomiting;noisy breathing;passing of gas;rash;red skin lesions, often with a purple center;red, irritated eyes;redness or swelling in the ear;runny nose;shivering;shortness of breath;sneezing;sores, ulcers, or white spots on the lips or in the mouth;stomach pain, continuing;stomach pain, fullness, or discomfort;stuffy nose;sweating;swelling of the face, ankles, hands, feet, or lower legs;tender, swollen glands in the neck;tightness in the chest;trouble with sleeping;trouble with swallowing;unpleasant breath odor;unusual bleeding or bruising;unusual tiredness or weakness;upper right abdominal or stomach pain;voice changes;vomiting of blood;wheezing;yellow eyes or skin;abdominal or stomach cramps or tenderness;bleeding gums;bloating;blood in the urine or stools;blurred vision;change in hearing;clay-colored stools;coma;confusion;constipation;continuing ringing or buzzing or other unexplained noise in the ears;decreased urine output;depression;diarrhea, watery and severe, which may also be bloody;dizziness, faintness, or lightheadedness when getting up suddenly from a lying or sitting position;fainting;greatly decreased frequency of urination or amount of urine;hives;hostility;increased thirst;irritability;lethargy;loss of hearing;lower back or side pain;muscle twitching;pains in the stomach, side, or abdomen, possibly radiating to the back;pale skin;pinpoint red spots on the skin;puffiness or swelling of the eyelids or around the eyes, face, lips, or tongue;rapid weight gain;seizures;stupor;unusual weight loss;acid or sour stomach;aggressive or angry;bad, unusual, or unpleasant (after) taste;belching;burning feeling in the chest or stomach;burning, crawling, itching, numbness, prickling, ""pins and needles"", or tingling feelings;change in taste;changes in the color of the tongue;crying;depersonalization;dry mouth;dysphoria;euphoria;excess air or gas in the stomach or intestines;feeling of constant movement of self or surroundings;full feeling;heartburn;hyperventilation;increase in body movements;itching of the vagina or genital area;lack or loss of strength;mental depression;nervousness;pain during sexual intercourse;paranoia;quick to react or overreact emotionally;rapidly changing moods;rash with flat lesions or small raised lesions on the skin;redness of the skin;restlessness;sensation of spinning;shaking;shortness of breath;sleepiness or unusual drowsiness;sleeplessness;sore mouth or tongue;stomach upset;thick, white vaginal discharge with no odor or with a mild odor;unable to sleep;white patches in the mouth, tongue, or throat;difficulty with moving;fear or nervousness;increased sensitivity of the skin to sunlight;muscle pain or stiffness;pain in the joints;redness or other discoloration of the skin;severe sunburn;trouble sitting still;or",,,,,,,,
9,9,ciprofloxacin,,,,,,,,,,,"diarrhea;bloody or black, tarry stools;burning, crawling, itching, numbness, prickling, ""pins and needles"", or tingling feelings;changes in skin color;changes in urination;chest pain or discomfort;chest tightness or heaviness;chills or fever;clumsiness or unsteadiness;confusion;continuing ringing or buzzing or other unexplained noise in the ears;coughing or spitting up blood;dizziness, faintness, or lightheadedness when getting up suddenly from a lying or sitting position;fast, irregular, pounding, or racing heartbeat or pulse;headache, severe and throbbing;hearing loss;hives or welts or skin rash;joint stiffness;large, hive-like swelling on the face, eyelids, lips, tongue, throat, hands, legs, feet, or sex organs;light-colored stools;muscle pain or stiffness;nausea and vomiting;nightmares;numbness of the hands;pain in the joints;pain or discomfort in the arms, jaw, back, or neck;painful, red lumps under the skin, mostly on the legs;pounding in the ears;puffiness or swelling of the eyelids or around the eyes, face, lips, or tongue;redness of the face, neck, arms, and occasionally, upper chest;seizures;severe abdominal or stomach pain, cramping, or burning;shakiness in the legs, arms, hands, or feet;swelling of the face, feet, or lower legs;swollen, painful, or tender lymph glands in the neck, armpit, or groin;thick, white vaginal discharge with no odor or with a mild odor;unsteadiness, trembling, or other problems with muscle control or coordination;unusual drowsiness, dullness, tiredness, weakness, or feeling of sluggishness;white patches in the mouth and/or on the tongue;yellow eyes or skin;acid or sour stomach;blistering, peeling, or loosening of the skin;bluish-colored lips, fingernails, or palms;bone pain;diarrhea, watery and severe, which may also be bloody;difficulty with breathing, chewing, or talking;double vision;excessive muscle tone;feeling of discomfort;feeling, seeing, or hearing things that are not there;increased sensitivity to pain;increased sensitivity to touch;irregular or slow heart rate;mood changes;nosebleeds;rapid heart rate;red skin lesions, often with a purple center;seeing, hearing, or feeling things that are not there;sores, ulcers, or white spots on the lips or in the mouth;unusual bleeding or bruising;unusual excitement, nervousness, or restlessness;vaginal yeast infection;runny nose;sneezing;stuffy nose;or",,,,,,,,
10,10,Biaxin,,,,,,,,,,,"cough;fever or chills;hoarseness;lower back or side pain;painful or difficult urination;abdominal or stomach tenderness;fever with or without chills;nausea and vomiting;severe abdominal or stomach cramps and pain;shortness of breath;skin rash and itching;unusual bleeding or bruising;watery and severe diarrhea, which may also be bloody;yellow eyes or skin;abdominal or stomach pain;anxiety;black, tarry stools;blistering, peeling, or loosening of the skin;blurred vision;chest pain or discomfort;clay-colored stools;confusion about identity, place, and time;cool, pale skin;dark urine;depression;difficulty with swallowing;dizziness;fainting;fast, pounding, or irregular heartbeat or pulse;feeling of unreality;feeling that others are watching you or controlling your behavior;feeling that others can hear your thoughts;feeling, seeing, or hearing things that are not there;hives;increased hunger;irregular heartbeat;joint or muscle pain;light-colored stools;loss of appetite;nightmares;puffiness or swelling of the eyelids or around the eyes, face, lips, or tongue;recurrent fainting;red skin lesions, often with a purple center;red, irritated eyes;redness, swelling, or soreness of the tongue;seizures;sense of detachment from self or body;severe mood or mental changes;shakiness;slow heartbeat;slurred speech;sore throat;sores, ulcers, or white spots in the mouth or on the lips;sudden death;swollen glands;tightness in the chest;unpleasant breath odor;unusual behavior;unusual tiredness or weakness;vomiting of blood;wheezing;acid or sour stomach;belching;bloated or full feeling;change in sensation of taste;diarrhea (mild);excess air or gas in the stomach or intestines;headache;heartburn;indigestion;passing gas;stomach discomfort, upset, or pain;alterations of sense of smell;continuing ringing or buzzing or other unexplained noise in the ears;feeling of constant movement of self or surroundings;hearing loss;lightheadedness;mental depression;mood or mental changes;sensation of spinning;shakiness in the legs, arms, hands, or feet;skin eruptions;sleeplessness;sore mouth or tongue;swelling or inflammation of the mouth;taste loss;tongue discoloration;tooth discoloration;trouble sleeping;unable to sleep;weight loss;or",,,,,,,,
