22,22,clarithromycin,,,,,,,,,,,"cough;fever or chills;hoarseness;lower back or side pain;painful or difficult urination;abdominal or stomach tenderness;fever with or without chills;nausea and vomiting;severe abdominal or stomach cramps and pain;shortness of breath;skin rash and itching;unusual bleeding or bruising;watery and severe diarrhea, which may also be bloody;yellow eyes or skin;abdominal or stomach pain;anxiety;black, tarry stools;blistering, peeling, or loosening of the skin;blurred vision;chest pain or discomfort;clay-colored stools;confusion about identity, place, and time;cool, pale skin;dark urine;depression;difficulty with swallowing;dizziness;fainting;fast, pounding, or irregular heartbeat or pulse;feeling of unreality;feeling that others are watching you or controlling your behavior;feeling that others can hear your thoughts;feeling, seeing, or hearing things that are not there;hives;increased hunger;irregular heartbeat;joint or muscle pain;light-colored stools;loss of appetite;nightmares;puffiness or swelling of the eyelids or around the eyes, face, lips, or tongue;recurrent fainting;red skin lesions, often with a purple center;red, irritated eyes;redness, swelling, or soreness of the tongue;seizures;sense of detachment from self or body;severe mood or mental changes;shakiness;slow heartbeat;slurred speech;sore throat;sores, ulcers, or white spots in the mouth or on the lips;sudden death;swollen glands;tightness in the chest;unpleasant breath odor;unusual behavior;unusual tiredness or weakness;vomiting of blood;wheezing;acid or sour stomach;belching;bloated or full feeling;change in sensation of taste;diarrhea (mild);excess air or gas in the stomach or intestines;headache;heartburn;indigestion;passing gas;stomach discomfort, upset, or pain;alterations of sense of smell;continuing ringing or buzzing or other unexplained noise in the ears;feeling of constant movement of self or surroundings;hearing loss;lightheadedness;mental depression;mood or mental changes;sensation of spinning;shakiness in the legs, arms, hands, or feet;skin eruptions;sleeplessness;sore mouth or tongue;swelling or inflammation of the mouth;taste loss;tongue discoloration;tooth discoloration;trouble sleeping;unable to sleep;weight loss;or",,,,,,,,
23,23,erythromycin,,,,,,,,,,,"blistering, peeling, or loosening of the skin;chills;cough;diarrhea;difficulty with swallowing;dizziness;fast heartbeat;hives or welts;joint or muscle pain;puffiness or swelling of the eyelids or around the eyes, face, lips, or tongue;red, irritated eyes;red skin lesions, often with a purple center;redness of the skin;skin rash;sore throat;sores, ulcers, or white spots in the mouth or on the lips;tightness in the chest;unusual tiredness or weakness;wheezing;abdominal or stomach cramps or tenderness;bloating;bloody or cloudy urine;chest pain or discomfort;dark urine;diarrhea, watery and severe, which may also be bloody;fainting;fever;general tiredness and weakness;greatly decreased frequency of urination or amount of urine;hearing loss;increased thirst;irregular heartbeat recurrent;irregular or slow heart rate;light-colored stools;nausea and vomiting;pain;swelling of the feet or lower legs;unusual weight loss;upper right abdominal or stomach pain;yellow eyes and skin;abdominal or stomach pain;diarrhea (mild);loss of appetite;weight loss;or",,,,,,,,
24,24,dicloxacillin,,,,,,,,,,,or,,,,,,,,
25,25,Avelox,,,,,,,,,,,"abdominal or stomach cramps;abdominal or stomach tenderness;black, tarry stools;bleeding gums;blisters;bloating or swelling of the face, arms, hands, lower legs, or feet;blood in the urine or stools;blurred vision;bone pain;burning, crawling, itching, numbness, prickling, ""pins and needles"", or tingling feelings;chest pain;chills;clay-colored stools;cough;crying;dark urine;diarrhea, watery and severe, which may also be bloody;difficult or labored breathing;difficulty with moving;difficulty with swallowing;discouragement;dizziness, faintness, or lightheadedness when getting up suddenly from a lying or sitting position;dry mouth;excessive muscle tone;fainting;fast, irregular, pounding, or racing heartbeat or pulse;feeling of unreality;feeling of warmth or heat;feeling sad or empty;fever;flushed, dry skin;flushing or redness of the skin, especially on the face and neck;fruit-like breath odor;headache;hyperventilation;increased hunger;increased sensitivity of the skin to sunlight;increased thirst;increased urination;irregular heartbeat recurrent;irritability;joint pain, stiffness, or swelling;lack of coordination;loss of appetite;loss of interest or pleasure;lower back, side, or stomach pain;mood or mental changes;muscle aching or cramping;muscle pains or stiffness;muscle tension or tightness;nausea or vomiting;nervousness;noisy breathing;pain;pain in the pelvis;pain, warmth, or burning in the fingers, toes, and legs;painful or difficult urination;painful, swollen joints;pale skin;pinpoint red spots on the skin;pounding in the ears;problems with speech or speaking;problems with vision or hearing;quick to react or overreact emotionally;rapid weight gain;rapidly changing moods;redness or other discoloration of the skin;restlessness;seeing, hearing, or feeling things that are not there;seizures;sensation of the skin burning;sense of detachment from self or body;severe sunburn;shakiness in the legs, arms, hands, or feet;skin rash or itching;sore throat;sores, ulcers, or white spots on the lips or in the mouth;sweating;swelling of the feet or lower legs;swelling or puffiness of the face;swollen glands;tightness in the chest;tingling of the hands or feet;tiredness;trouble concentrating;trouble sleeping;troubled breathing with exertion;unexplained weight loss;unpleasant breath odor;unusual bleeding or bruising;unusual tiredness or weakness;unusual weight gain or loss;vomiting of blood;yellow eyes or skin;blistering, peeling, or loosening of the skin;burning, numbness, tingling, or painful sensations;change in the ability to see colors, especially blue or yellow;difficulty with chewing or talking;double vision;drooping eyelids;eye pain;general feeling of tiredness or weakness;hives;hoarseness;irregular or slow heart rate;large, hive-like swelling on the face, eyelids, lips, tongue, throat, hands, legs, feet, or sex organs;light-colored stools;muscle weakness;no blood pressure or pulse;puffiness or swelling of the eyelids or around the eyes, face, lips, or tongue;red, irritated eyes;red skin lesions, often with a purple center;severe headache;severe tiredness;stomach pain, continuing;stopping of heart;unconsciousness;unsteadiness or awkwardness;unusual behavior, such as disorientation to time or place, failure to recognize people, hyperactivity, or restlessness;weakness in the arms, hands, legs, or feet;acid or sour stomach;bad, unusual, or unpleasant (after) taste;belching;burning feeling in the chest or stomach;change in sense of smell;change in taste;changes in vision;continuing ringing or buzzing or other unexplained noise in the ears;difficulty having a bowel movement (stool);excess air or gas in the stomach or intestines;fear or nervousness;feeling of constant movement of self or surroundings;full feeling;general feeling of discomfort or illness;hearing loss;heartburn;impaired vision;indigestion;itching of the vagina or genital area;lack or loss of strength;loss of memory;pain during sexual intercourse;passing of gas;problems with memory;redness, swelling, or soreness of the tongue;sensation of spinning;sleepiness or unusual drowsiness;sore mouth or tongue;stomach discomfort, upset, or pain;thick, white vaginal discharge with no odor or with a mild odor;white patches in the mouth or on the tongue;or",,,,,,,,
26,26,cefuroxime,,,,,,,,,,,"chills;diarrhea;fever;general feeling of illness or discomfort;headache;itching of the vagina or genital area;pain during sexual intercourse;rigidity;sweating;thick, white vaginal discharge with no odor or with a mild odor;black, tarry stools;chest pain;cough;loose stools;painful or difficult urination;shortness of breath;sore throat;sores, ulcers, or white spots on the lips or in the mouth;swollen glands;unusual bleeding or bruising;unusual tiredness or weakness;back, leg, or stomach pains;bladder pain;bleeding gums;bloody or cloudy urine;body aches or pain;burning while urinating;dark urine;difficulty with breathing;ear congestion;fast, pounding, or irregular heartbeat or pulse;frequent urge to urinate;general body swelling;loss of appetite;loss of voice;lower back or side pain;nasal congestion;nausea or vomiting;nosebleeds;pain or tenderness around the eyes and cheekbones;pale skin;pink or red urine;sneezing;stuffy or runny nose;swelling of the joints;swollen glands;tightness of chest or wheezing;white or brownish vaginal discharge;white patches in the mouth or throat or on the tongue;white patches with diaper rash;yellowing of the eyes or skin;blistering, peeling, or loosening of the skin;bloody, black, or tarry stools;clay-colored stools;cough or hoarseness;coughing up blood;decrease in urine output or decrease in urine-concentrating ability;feeling of discomfort;fever with or without chills;general feeling of tiredness or weakness;high fever;hives;increased menstrual flow or vaginal bleeding;joint or muscle pain;large, hive-like swelling on the face, eyelids, lips, tongue, throat, hands, legs, feet, or sex organs;light-colored stools;paralysis;prolonged bleeding from cuts;puffiness or swelling of the eyelids or around the eyes, face, lips, or tongue;red or black, tarry stools;red or dark brown urine;red skin lesions, often with a purple center;red, irritated eyes;seizures;swollen lymph glands;swollen or painful glands;unpleasant breath odor;upper right abdominal or stomach pain;vomiting of blood;bad, unusual, or unpleasant (after) taste;change in taste;diaper rash;abdominal or stomach cramps;acid or sour stomach;belching;bloated;difficulty with moving;excess air or gas in the stomach or intestines;flushing or redness of the skin;full feeling;gas in the stomach;heartburn;indigestion;irritability;irritation or soreness of the mouth;itching skin;muscle pain or stiffness;muscle spasm of the neck;passing gas;restlessness;sleepiness or unusual drowsiness;stomach discomfort, upset, or pain;swelling of the tongue;thirst;trouble sitting still;unusually warm skin;watering of the mouth and drooling;weight loss;hives or welts;redness of the skin;or",,,,,,,,
27,27,vancomycin,,,,,,,,,,,"bladder pain;bloating or swelling of the face, arms, hands, lower legs, or feet;bloody or cloudy urine;convulsions;decreased urine;difficult, burning, or painful urination;dry mouth;fever;frequent urge to urinate;increased thirst;irregular heartbeat;loss of appetite;lower back or side pain;mood changes;muscle pain or cramps;nausea or vomiting;numbness or tingling in the hands, feet, or lips;rapid weight gain;shortness of breath;unusual tiredness or weakness;unusual weight gain or loss;change in the frequency of urination or amount of urine;difficulty with breathing;drowsiness;weakness;hives;redness or other discoloration of the skin;scaling or welting of the skin;skin rash;black, tarry stools;bleeding gums;blistering, peeling, or loosening of the skin;blurred vision;chills;confusion;continuing ringing or buzzing or other unexplained noise in the ears;cough;diarrhea;difficulty with swallowing;dizziness, faintness, or lightheadedness when getting up suddenly from a lying or sitting position;fast heartbeat;feeling of constant movement of self or surroundings;feeling of fullness in the ears;hearing loss;itching;joint or muscle pain;loss of balance;lower back or side pain;pale skin;pinpoint red spots on the skin;puffiness or swelling of the eyelids or around the eyes, face, lips, or tongue;red skin lesions, often with a purple center;red, irritated eyes;ringing or buzzing in the ears;sensation of spinning;sore throat;sores, ulcers, or white spots in the mouth or on the lips;sweating;tightness in the chest;troubled breathing with exertion;unusual bleeding or bruising;abdominal or stomach pain;back pain;bitter or unpleasant taste;excess air or gas in the stomach or intestines;headache;mouth irritation;passing gas;depression;difficulty having a bowel movement (stool);trouble sleeping;or",,,,,,,,
28,28,Ancef,,,,,,,,,,,"bluish color;changes in skin color;pain;swelling of the foot or leg;tenderness;abdominal or stomach cramps or tenderness;back, leg, or stomach pains;black, tarry stools;bleeding gums;blistering, peeling, or loosening of the skin;bloating;blood in the urine or stools;bloody or cloudy urine;chest pain;chills;clay-colored stools;cloudy urine;cough;coughing up blood;dark urine;decrease in urine output or decrease in urine-concentrating ability;decreased frequency or amount of urine;diarrhea;diarrhea, watery and severe, which may also be bloody;difficult or painful urination;difficulty with breathing or swallowing;dizziness;excessive muscle tone;fast heartbeat;feeling of discomfort;fever;general body swelling;general tiredness and weakness;headache;hives;increased blood pressure;increased menstrual flow or vaginal bleeding;increased thirst;inflammation of the joints;itching;itching of the vagina or genital area;joint or muscle pain;light-colored stools;loss of appetite;lower back or side pain;muscle aches or stiffness;muscle tension or tightness;nausea or vomiting;nosebleeds;pain during sexual intercourse;pain, warmth, or burning in the fingers, toes, and legs;pale skin;paralysis;pinpoint red spots on the skin;problems with vision or hearing;prolonged bleeding from cuts;puffiness or swelling of the eyelids or around the eyes, face, lips, or tongue;rash;red irritated eyes;red or black, tarry stools;red or dark brown urine;red skin lesions, often with a purple center;red, irritated eyes;restlessness;seizures;skin rash;sore throat;sores, ulcers, or white spots on the lips or in the mouth;stomach cramps;sudden decrease in the amount of urine;swelling of the face, fingers, or lower legs;swollen lymph glands;swollen or painful glands;thick, white vaginal discharge with no odor or with a mild odor;tightness in the chest;trouble sitting still;troubled breathing;unpleasant breath odor;unusual bleeding or bruising;unusual tiredness or weakness;unusual weight loss;upper right abdominal pain;vomiting;vomiting of blood;weight gain;wheezing;yellowing of the eyes or skin;bleeding, blistering, burning, coldness, discoloration of the skin, feeling of pressure, hives, infection, inflammation, itching, lumps, numbness, pain, rash, redness, scarring, soreness, stinging, swelling, tenderness, tingling, ulceration, or warmth at the injection site;hives or welts;redness of the skin;sore mouth or tongue;weight loss;white patches in the mouth, tongue, or throat;or",,,,,,,,
29,29,cefdinir,,,,,,,,,,,"diarrhea;black, tarry stools;chest pain;chills;cough;fever;painful or difficult urination;shortness of breath;sore throat;sores, ulcers, or white spots on the lips or in the mouth;swollen glands;unusual bleeding or bruising;unusual tiredness or weakness;abdominal or stomach cramps or tenderness;back, leg, or stomach pains;bleeding gums;blistering, peeling, or loosening of the skin;bloating;blood in the urine or stools;bloody nose;bloody or cloudy urine;bloody, black, or tarry stools;blue lips, fingernails, or skin;bruising;chest pain or discomfort;clay-colored stools;cold, clammy skin;confusion;coughing or vomiting blood;cracks in the skin;dark-colored urine;diarrhea, watery and severe, which may also be bloody;difficult or troubled breathing;difficulty with breathing or swallowing;dilated neck veins;dizziness;extreme fatigue;fast heartbeat;fast, weak pulse;feeling of discomfort;general body swelling;general tiredness and weakness;headache;heavier menstrual periods;high fever;hives;hoarseness;increased thirst;inflammation of the joints;irregular breathing;irregular heartbeat;irregular, fast or slow, or shallow breathing;itching;joint or muscle pain;light-colored stools;lightheadedness;loss of appetite;loss of consciousness;loss of heat from the body;muscle aches;muscle cramps or spasms;muscle pain or stiffness;nausea or vomiting;noisy breathing;nosebleeds;pain in the ankles or knees;pain or discomfort in the arms, jaw, back, or neck;painful, red lumps under the skin, mostly on the legs;pale skin;persistent bleeding or oozing from puncture sites, mouth, or nose;pinpoint red spots on the skin;problems with bleeding or clotting;puffiness or swelling of the eyelids or around the eyes, face, lips, or tongue;rash;red skin lesions, often with a purple center;red, irritated eyes;red, swollen skin;scaly skin;seizures;severe stomach pain;slow or irregular breathing;sudden decrease in the amount of urine;sweating;swelling of the face, fingers, feet, or lower legs;swollen lymph glands;tightness in the chest;unpleasant breath odor;unusual weight loss;upper right abdominal or stomach pain;vomiting of blood;weight gain;wheezing;yellow eyes or skin;itching of the vagina or genital area;pain during sexual intercourse;thick, white vaginal discharge with no odor or with a mild odor;vaginal yeast infection;acid or sour stomach;belching;constipation;dry mouth;excess air or gas in the stomach or intestines;full feeling;heartburn;increase in body movements;increased clear or white vaginal discharge;indigestion;lack or loss of strength;passing gas;rash with flat lesions or small raised lesions on the skin;sleepiness or unusual drowsiness;soreness or redness around the fingernails and toenails;stomach discomfort, upset, or pain;unable to sleep;burning, dry, or itching eyes;discharge, excessive tearing;redness, pain, or swelling of the eye, eyelid, or inner lining of the eyelid;swelling or inflammation of the mouth;or",,,,,,,,
30,30,Doxy 100,,,,,,,,,,,"abdominal or stomach tenderness;bloating;clay-colored stools;cough;dark urine;decreased appetite;diarrhea;diarrhea, watery and severe, which may also be bloody;difficulty with swallowing;dizziness;fast heartbeat;feeling of discomfort;fever;headache;hives, itching, puffiness or swelling of the eyelids or around the eyes, face, lips, or tongue;hives or welts, itching, or rash;increased thirst;inflammation of the joints;joint or muscle pain;large, hive-like swelling on the face, eyelids, lips, tongue, throat, hands, legs, feet, or sex organs;loss of appetite;nausea and vomiting;numbness or tingling of the face, hands, or feet;pain;redness and soreness of the eyes;redness of the skin;sore throat;sores in the mouth;stomach cramps;stomach pain or tenderness;swelling of the feet or lower legs;swollen lymph glands;tightness in the chest;unusual tiredness or weakness;unusual weight loss;yellow eyes or skin;back, leg, or stomach pains;black, tarry stools;bleeding gums;blood in the urine or stools;blurred vision;bulging soft spot on the head of an infant;change in the ability to see colors, especially blue or yellow;chest pain, discomfort, or burning;chills;cracks in the skin;decrease in vision;difficulty breathing;discoloration of the thyroid glands;double vision;general body swelling;heartburn;increased sensitivity of the skin to sunlight;loss of heat from the body;lower back or side pain;nosebleeds;pain or burning in the throat;pain with swallowing;painful or difficult urination;pale skin;pinpoint red spots on the skin;rash with flat lesions or small raised lesions on the skin;red, swollen skin;redness or other discoloration of the skin;redness, swelling, or soreness of the tongue;scaly skin;severe nausea;severe stomach pain;severe sunburn;sores, ulcers, or white spots on the lips or tongue or inside the mouth;unusual bleeding or bruising;vomiting blood;or",,,,,,,,
31,31,meropenem,,,,,,,,,,,"redness and swelling at the injection site;bluish lips or skin;chills;cold, clammy skin;confusion;dizziness;fainting;fast heartbeat;fast, weak pulse;fever;itching skin;lightheadedness;not breathing;pain at the injection site;rapid, shallow breathing;skin rash and itching;sweating;abdominal or stomach cramps and severe pain;agitation;black, bloody, or tarry stools;black, bloody vomit;bloating or swelling of the face, arms, hands, lower legs, or feet;blurred vision;burning while urinating;burning, crawling, itching, numbness, prickling, ""pins and needles"", or tingling feelings;convulsions (seizures);cough;dark urine;decreased urine output;depression;diarrhea (watery and severe), which may also be bloody;difficult or painful urination;difficulty with breathing;dilated neck veins;extreme fatigue;fever with or without chills;headache;hostility;irregular breathing;irritability;lethargy;light-colored stools;loss of consciousness;muscle twitching;nausea;no blood pressure or pulse;nosebleed;pale skin;pounding in the ears;rapid weight gain;severe constipation;severe vomiting;slow, irregular heartbeat;stopping of the heart;stupor;tightness in the chest;troubled breathing with exertion;unconsciousness;unpleasant breath odor;unusual bleeding or bruising;unusual tiredness or weakness;unusual weight gain or loss;vomiting of blood or material that looks like coffee grounds;weight gain;yellow eyes or skin;back, leg, or stomach pains;bleeding gums;blistering, peeling, or loosening of the skin;chest pain;cough or hoarseness;general body swelling;general feeling of tiredness or weakness;joint or muscle pain;large, hive-like swelling on the face, eyelids, tongue, throat, hands, legs, feet, or sex organs;loss of appetite;lower back or side pain;red skin lesions, often with a purple center;red, irritated eyes;sore throat;sores, ulcers, or white spots in the mouth or on the lips;swollen glands;constipation;body aches or pain;cold hands and feet;cold sweats;congestion;cool pale skin;dryness or soreness of the throat;increased hunger;indigestion;nightmares;passing of gas;redness, swelling, or soreness of the tongue;runny nose;shakiness;slurred speech;sneezing;stomach pain, fullness, or discomfort;trouble swallowing;vaginal yeast infection;voice changes;acid or sour stomach;belching;excess air or gas in the stomach or intestines;full feeling;heartburn;hives or welts;redness of the skin;seeing, hearing, or feeling things that are not there;sleepiness or unusual drowsiness;trouble sleeping;white patches in the mouth, tongue, or throat;or",,,,,,,,
32,32,Monodox,,,,,,,,,,,"abdominal or stomach tenderness;bloating;clay-colored stools;cough;dark urine;decreased appetite;diarrhea;diarrhea, watery and severe, which may also be bloody;difficulty with swallowing;dizziness;fast heartbeat;feeling of discomfort;fever;headache;hives, itching, puffiness or swelling of the eyelids or around the eyes, face, lips, or tongue;hives or welts, itching, or rash;increased thirst;inflammation of the joints;joint or muscle pain;large, hive-like swelling on the face, eyelids, lips, tongue, throat, hands, legs, feet, or sex organs;loss of appetite;nausea and vomiting;numbness or tingling of the face, hands, or feet;pain;redness and soreness of the eyes;redness of the skin;sore throat;sores in the mouth;stomach cramps;stomach pain or tenderness;swelling of the feet or lower legs;swollen lymph glands;tightness in the chest;unusual tiredness or weakness;unusual weight loss;yellow eyes or skin;back, leg, or stomach pains;black, tarry stools;bleeding gums;blood in the urine or stools;blurred vision;bulging soft spot on the head of an infant;change in the ability to see colors, especially blue or yellow;chest pain, discomfort, or burning;chills;cracks in the skin;decrease in vision;difficulty breathing;discoloration of the thyroid glands;double vision;general body swelling;heartburn;increased sensitivity of the skin to sunlight;loss of heat from the body;lower back or side pain;nosebleeds;pain or burning in the throat;pain with swallowing;painful or difficult urination;pale skin;pinpoint red spots on the skin;rash with flat lesions or small raised lesions on the skin;red, swollen skin;redness or other discoloration of the skin;redness, swelling, or soreness of the tongue;scaly skin;severe nausea;severe stomach pain;severe sunburn;sores, ulcers, or white spots on the lips or tongue or inside the mouth;unusual bleeding or bruising;vomiting blood;or",,,,,,,,
33,33,Penicillin VK,,,,,,,,,,,"fast or irregular breathing;fever;joint pain;lightheadedness or fainting (sudden);puffiness or swelling around the face;red, scaly skin;shortness of breath;skin rash, hives, itching;abdominal or stomach cramps and pain (severe);abdominal tenderness;convulsions (seizures);decreased amount of urine;diarrhea (watery and severe), which may also be bloody;mental depression;nausea and vomiting;pain at place of injection;sore throat and fever;unusual bleeding or bruising;yellow eyes or skin;agitation or combativeness;anxiety;confusion;fear of impending death;feeling, hearing, or seeing things that are not real;diarrhea (mild);headache;sore mouth or tongue;vaginal itching and discharge;white patches in the mouth and/or on the tongue",,,,,,,,
