15,15,Platinol,,,,,,,,,,,"black, tarry stools;blood in urine or stools;cough or hoarseness accompanied by fever or chills;dizziness or faintness (during or shortly after a dose);fast heartbeat (during or shortly after a dose);fever or chills;lower back or side pain accompanied by fever or chills;painful or difficult urination accompanied by fever or chills;pain or redness at place of injection;pinpoint red spots on skin;swelling of face (during or shortly after a dose);unusual bleeding or bruising;wheezing (during or shortly after a dose);joint pain;loss of balance;ringing in ears;swelling of feet or lower legs;trouble in hearing;unusual tiredness or weakness;convulsions (seizures);loss of reflexes;loss of taste;numbness or tingling in fingers or toes;trouble in walking;agitation or confusion;blurred vision;change in ability to see colors (especially blue or yellow);muscle cramps;sores in mouth and on lips;nausea and vomiting (severe);loss of appetite;black, tarry stools;blood in urine or stools;convulsions (seizures);cough or hoarseness;decrease in urination;fever or chills;loss of balance;loss of reflexes;loss of taste;lower back or side pain;numbness or tingling in fingers or toes;painful or difficult urination;pinpoint red spots on skin;ringing in ears;swelling of feet or lower legs;trouble in hearing;trouble in walking;unusual bleeding or bruising;or",,,,,,,,
16,16,vinorelbine,,,,,,,,,,,"cough or hoarseness, accompanied by fever or chills;fever or chills;lower back or side pain, accompanied by fever or chills;painful or difficult urination, accompanied by fever or chills;redness, increased warmth, pain, or discoloration of vein at place of injection;sore throat, accompanied by fever or chills;chest pain;shortness of breath;sores in mouth and on lips;black, tarry stools;bloating;blood in urine or stools;chills;darkened urine;fast heartbeat;fever;indigestion;loss of appetite;nausea;painful urination;pains in stomach;pinpoint red spots on skin;skin rash;unusual bleeding or bruising;vomiting;yellow eyes or skin;loss of strength and energy;unusual tiredness or weakness;numbness or tingling in fingers and toes;chest pain;cough or hoarseness, accompanied by fever or chills;fever or chills;heartburn;lower back or side pain, accompanied by fever or chills;mild abdominal pain and constipation;numbness or tingling in fingers and toes;painful or difficult urination, accompanied by fever or chills;sore throat, accompanied by fever or chills;unusual bleeding or bruising;unusual tiredness or weakness;vomiting;constipation;loss of appetite;nausea and vomiting;diarrhea;jaw pain;joint or muscle pain",,,,,,,,
17,17,Gilotrif,,,,,,,,,,,"bloody or cloudy urine;burning, dry, or itching eyes;diarrhea;difficult, burning, or painful urination;discharge or excessive tearing;fever;frequent urge to urinate;redness, pain, or swelling of the eye, eyelid, or inner lining of the eyelid;redness, swelling, or pain of the skin;scaling of the skin on the hands and feet;tingling of the hands and feet;ulceration of the skin;cough;difficult breathing;abdominal or stomach pain;dizziness;headache;lack or loss of strength;nausea;vomiting;blemishes on the skin;canker sores;chapped, red, or swollen lips;decreased appetite;decreased weight;dry skin;itching skin or rash;loosening of the fingernails;nosebleeds;pimples;redness or soreness around the fingernails;runny nose;scaling, redness, burning, pain, or other signs of inflammation of the lips;sores, ulcers, or white spots on the lips or tongue or inside the mouth",,,,,,,,
18,18,gefitinib,,,,,,,,,,,"abdominal or stomach pain or tenderness;clay colored stools;dark urine;decreased appetite;diarrhea, severe;fever;headache;itching or skin rash;loss of appetite;nausea and vomiting;swelling of the feet or lower legs;unusual tiredness or weakness;yellow eyes or skin;burning, dry, or itching eyes;chest pain;chills;cough;difficult breathing;discharge or excessive tearing;dry eyes;general feeling of discomfort or illness;redness, pain, or swelling of the eye, eyelid, or inner lining of the eyelid;thickening of bronchial secretions;troubled breathing;troubled or quick, shallow breathing;blistering, peeling, or loosening of the skin;bloody, black, or tarry stools;eye redness, irritation, or pain;heartburn;indigestion;joint or muscle pain;red skin lesions, often with a purple center;severe abdominal or stomach pain, cramping, or burning;sore throat;sores, ulcers, or white spots in the mouth or on the lips;vomiting of material that looks like coffee grounds, severe and continuing;redness or soreness around fingernails or loosening of the fingernails",,,,,,,,
19,19,bevacizumab,,,,,,,,,,,"black, tarry stools;bleeding gums;body aches or pain;burning, tingling, numbness, or pain in the hands, arms, feet, or legs;chest pain or discomfort;chills;cloudy urine;convulsions;cough;cracks in the skin;decreased urine output;difficult or labored breathing;dilated neck veins;dizziness, faintness, or lightheadedness when getting up suddenly from a lying or sitting position;ear congestion;extreme fatigue;fever;irregular breathing;irregular heartbeat;lack or loss of strength;lightheadedness;loss of appetite;loss of heat from the body;loss of voice;mood changes;nasal congestion;nervousness;pain;pain, redness, or swelling in the arm or leg;painful or difficult urination;pinpoint red spots on the skin;pounding in the ears;rapid breathing;redness;runny nose;sensation of pins and needles;slow or fast heartbeat;sore throat;sores on the skin;sores, ulcers, or white spots on the lips or in the mouth;stabbing pain;sunken eyes;sweating;swelling of the face, fingers, feet, or lower legs;swelling or inflammation of the mouth;swollen glands;thirst;tightness in the chest;trouble breathing;unusual bleeding or bruising;unusual tiredness or weakness;vomiting of blood or material that looks like coffee grounds;watery or bloody diarrhea;weight gain;wrinkled skin;yellow skin;abdominal or stomach pain or tenderness;bone pain;difficulty with swallowing;fainting;severe constipation;severe vomiting;back pain;blisters;blurred vision;coma;confusion;dizziness;drowsiness;headache;increased thirst;muscle pain or cramps;open sores;pale skin;bloody mucus or unexplained nosebleeds;hoarseness;sudden weakness in the arms or legs;sudden, severe chest pain;voice changes;acid or sour stomach;belching;bloody nose;change in taste or bad unusual or unpleasant (after) taste;change in walking and balance;clumsiness or unsteadiness;diarrhea;dry mouth;excess flow of tears;hair loss;heartburn;indigestion;stomach discomfort, upset, or pain;thinning of the hair;weight loss;or",,,,,,,,
20,20,gemcitabine,,,,,,,,,,,"bleeding gums;blood in urine or stools;burning, crawling, itching, numbness, prickling, ""pins and needles"", or tingling feelings;chest pain;cloudy urine;coughing up blood;cough or hoarseness;diarrhea;difficult or labored breathing;difficulty in moving;difficulty in swallowing;dizziness;fever or chills;general feeling of discomfort or illness;headache;increased menstrual flow or vaginal bleeding;joint pain;lack or loss of strength;loss of appetite;lower back or side pain;muscle aching or cramping;muscle pains or stiffness;nausea;nosebleeds;painful or difficult urination;pale skin;paralysis;pinpoint red spots on skin;prolonged bleeding from cuts;red or black, tarry stools;red or dark brown urine;runny nose;shivering;shortness of breath;sores, ulcers, or white spots on lips or in mouth;sore throat;sweating;swelling of hands, ankles, feet, or lower legs;swollen glands;swollen joints;tightness in chest;troubled breathing with exertion;trouble sleeping;unusual bleeding or bruising;unusual tiredness or weakness;vomiting;weight loss;wheezing;blurred vision;chest discomfort;fainting;fast, slow, or irregular heartbeat;headache (sudden and severe);inability to speak;nervousness;noisy breathing;pain or discomfort in arms, jaw, back or neck;pounding in the ears;seizures;slurred speech;temporary blindness;weakness in arm and/or leg on one side of the body (sudden and severe);confusion;lightheadedness;rapid, shallow breathing;hives;itching;puffiness or swelling of the eyelids or around the eyes, face, lips or tongue;skin rash;difficulty having a bowel movement (stool);hair loss;pain;sleepiness or unusual drowsiness;swelling or inflammation of the mouth;thinning of hair;bleeding, blistering, burning, coldness, discoloration of skin, feeling of pressure, hives, infection, inflammation, itching, lumps, numbness, pain, rash, redness, scarring, soreness, stinging, swelling, tenderness, tingling, ulceration, or warmth at site",,,,,,,,
21,21,methotrexate,,,,,,,,,,,"black, tarry stools;blood in the urine or stools;bloody vomit;diarrhea;joint pain;reddening of the skin;sores in the mouth or lips;stomach pain;swelling of the feet or lower legs;back pain;blurred vision;confusion;convulsions (seizures);cough or hoarseness;dark urine;dizziness;drowsiness;fever or chills;headache;lower back or side pain;painful or difficult urination;pinpoint red spots on the skin;shortness of breath;unusual bleeding or bruising;unusual tiredness or weakness;yellow eyes or skin;hair loss, temporary;loss of appetite;nausea or vomiting;acne;boils on skin;pale skin;skin rash or itching;or",,,,,,,,
22,22,crizotinib,,,,,,,,,,,"black, tarry stools;bloating or swelling of the face, arms, hands, lower legs, or feet;body aches or pain;burning, crawling, itching, numbness, prickling, ""pins and needles"", or tingling feelings;chest pain or discomfort;cough or hoarseness;difficult or labored breathing;ear congestion;fever or chills;headache;increased sensitivity to pain or touch;lightheadedness, dizziness, or fainting;loss of voice;lower back or side pain;nerve pain;painful or difficult urination;pale skin;rapid weight gain;runny or stuffy nose;slow or irregular heartbeat;sneezing;sore throat;tightness in the chest;ulcers, sores, or white spots in the mouth;unsteadiness or awkwardness;unusual bleeding or bruising;unusual tiredness or weakness;unusual weight gain or loss;weakness in the arms, hands, legs, or feet;bleeding gums;blood in the urine or stools;pinpoint red spots on the skin;abdominal or stomach discomfort, pain, or tenderness;acid or sour stomach;back pain;belching;change in taste;decrease or change in vision;decreased appetite;diarrhea;difficulty having a bowel movement (stool);difficulty with moving;difficulty with swallowing;heartburn;increased sensitivity of the eyes to sunlight;indigestion;muscle pain or stiffness;nausea;pain in the joints;pain or burning in the throat;pain or discomfort in the chest, upper stomach, or throat;problems with balance;rash;redness, swelling, or soreness of the tongue;scaling, redness, burning, pain, chapping, swelling, or other signs of inflammation of the lips;seeing flashes or sparks of light;swelling or inflammation of the mouth;trouble sleeping",,,,,,,,
23,23,docetaxel,,,,,,,,,,,"burning, numbness, tingling, or pain in the arms, hands, legs, or feet;swelling of the stomach, face, fingers, hands, feet, or lower legs;unusual tiredness or weakness;weight gain;black, tarry stools;blood in the urine or stools;cough or hoarseness (accompanied by fever or chills);difficult or labored breathing;difficult or painful urination (accompanied by fever or chills);difficulty with swallowing;dizziness;fast heartbeat;fever or chills;hives or skin rash;itching, puffiness, or swelling of the eyelids or around the eyes, face, lips, or tongue;lower back or side pain (accompanied by fever or chills);noisy, rattling breathing;pinpoint red spots on the skin;red, scaly, swollen, or peeling areas of the skin (severe);tightness in the chest;troubled breathing while at rest;unusual bleeding or bruising;chest pain or discomfort;decreased blood pressure;fast or irregular heartbeat;increased blood pressure;congestion;diarrhea;dryness or soreness of the throat;nausea;skin rash or redness (mild);sores or ulcers on the lips or tongue or inside the mouth;weakness in the arms, hands, legs, or feet;bloody nose;body aches or pain;change in the color of the fingernails or toenails;dry, red, hot, or irritated skin at the injection site;headache;hoarseness;loosening or loss of the fingernails or toenails, sometimes painful;pain in the joints or muscles;pain, swelling, or lump under the skin at the injection site;runny nose;tender, swollen glands in the neck;voice changes;vomiting;burning, dry, or itching eyes;burning upper abdominal or stomach pain;confusion;difficulty having a bowel movement (stool);discharge from the eyes;excessive tearing;pain and redness of the skin at the place of earlier radiation treatment;rapid breathing;redness, pain, or swelling of the eye, eyelid, or inner lining of the eyelid;sunken eyes;tearing of the eyes;wrinkled skin",,,,,,,,
24,24,pemetrexed,,,,,,,,,,,"black, tarry stools;bleeding gums;chest pain;chills;cough;fever;loss of coordination;lower back or side pain;painful or difficult urination;pains in the chest, groin, or legs, especially calves of the legs;pale skin;pinpoint red spots on the skin;severe headaches of sudden onset;shortness of breath;sore throat;sudden onset of slurred speech;sudden vision changes;swollen glands;troubled breathing;ulcers, sores, or white spots in the mouth;unusual bleeding or bruising;unusual tiredness or weakness;bloody urine or bloody stools;decreased frequency or amount of urine;fainting or loss of consciousness;fast or irregular breathing;increased blood pressure;increased thirst;itching;loss of appetite;nausea;skin rash;swelling of the eyes or eyelids;swelling of the face, fingers, or lower legs;tightness in the chest or wheezing;vomiting;weight gain;blistering, peeling, or loosening of the skin;joint or muscle pain;pain and redness of the skin in the area of earlier radiation treatment;red skin lesions, often with a purple center;red, irritated eyes;stomach cramps, tenderness, or pain;watery diarrhea;burning, tingling, numbness, or pain in the hands, arms, feet, or legs;confusion;cough or hoarseness;decreased urination;diarrhea;difficulty having a bowel movement (stool);difficulty with moving;difficulty with swallowing;discouragement;dizziness;dry mouth;feeling sad or empty;hair loss;headache;heartburn;increase in heart rate;irritability;lightheadedness;loss of interest or pleasure;mood changes;muscle aches or cramping;muscle stiffness;pain or burning in the throat;pain produced by swallowing;rapid breathing;sensation of pins and needles;stabbing pain;stuffy or runny nose;sunken eyes;swelling;swelling or inflammation of the mouth;swollen joints;thinning of the hair;thirst;tiredness;trouble concentrating;trouble sleeping;weight loss;wheezing;wrinkled skin",,,,,,,,
25,25,afatinib,,,,,,,,,,,"bloody or cloudy urine;burning, dry, or itching eyes;diarrhea;difficult, burning, or painful urination;discharge or excessive tearing;fever;frequent urge to urinate;redness, pain, or swelling of the eye, eyelid, or inner lining of the eyelid;redness, swelling, or pain of the skin;scaling of the skin on the hands and feet;tingling of the hands and feet;ulceration of the skin;cough;difficult breathing;abdominal or stomach pain;dizziness;headache;lack or loss of strength;nausea;vomiting;blemishes on the skin;canker sores;chapped, red, or swollen lips;decreased appetite;decreased weight;dry skin;itching skin or rash;loosening of the fingernails;nosebleeds;pimples;redness or soreness around the fingernails;runny nose;scaling, redness, burning, pain, or other signs of inflammation of the lips;sores, ulcers, or white spots on the lips or tongue or inside the mouth",,,,,,,,
26,26,nivolumab,,,,,,,,,,,"back pain;blistering, peeling, or loosening of the skin;chest tightness;chills;constipation;cough;depressed mood;diarrhea;dry skin and hair;feeling cold;fever;flushing;hair loss;headache;hoarseness or husky voice;itching;joint or muscle pain;muscle cramps and stiffness;nausea and vomiting;red, irritated eyes;slowed heartbeat;sore throat;sores, ulcers, or white spots in the mouth or on the lips;trouble breathing;unusual tiredness or weakness;weight gain;chest pain;dark urine;general feeling of discomfort or illness;light-colored stools;nervousness;pain;sensitivity to heat;stomach cramps;sweating;tenderness;thickening of bronchial secretions;trouble sleeping;upper right abdominal or stomach pain;watery or bloody diarrhea;weight loss;yellow eyes and skin;bloating;bloody or cloudy urine;blurred vision or other change in vision;darkening of the skin;dizziness;drowsiness;eye pain;fainting;fast heartbeat;indigestion;loss of appetite;mental depression;pains in the stomach, side, or abdomen, possibly radiating to the back;redness of the eye;sensitivity of the eye to light;skin rash;swelling of the face, feet, or lower legs;tearing;stuffy or runny nose",,,,,,,,
27,27,Platinol-AQ,,,,,,,,,,,"black, tarry stools;blood in urine or stools;cough or hoarseness accompanied by fever or chills;dizziness or faintness (during or shortly after a dose);fast heartbeat (during or shortly after a dose);fever or chills;lower back or side pain accompanied by fever or chills;painful or difficult urination accompanied by fever or chills;pain or redness at place of injection;pinpoint red spots on skin;swelling of face (during or shortly after a dose);unusual bleeding or bruising;wheezing (during or shortly after a dose);joint pain;loss of balance;ringing in ears;swelling of feet or lower legs;trouble in hearing;unusual tiredness or weakness;convulsions (seizures);loss of reflexes;loss of taste;numbness or tingling in fingers or toes;trouble in walking;agitation or confusion;blurred vision;change in ability to see colors (especially blue or yellow);muscle cramps;sores in mouth and on lips;nausea and vomiting (severe);loss of appetite;black, tarry stools;blood in urine or stools;convulsions (seizures);cough or hoarseness;decrease in urination;fever or chills;loss of balance;loss of reflexes;loss of taste;lower back or side pain;numbness or tingling in fingers or toes;painful or difficult urination;pinpoint red spots on skin;ringing in ears;swelling of feet or lower legs;trouble in hearing;trouble in walking;unusual bleeding or bruising;or",,,,,,,,
28,28,ceritinib,,,,,,,,,,,"abdominal or stomach pain or tenderness;blurred vision;burning, crawling, itching, numbness, prickling, ""pins and needles"", or tingling feelings;clay colored stools;dark urine;decreased appetite;dry mouth;fever;flushed, dry skin;fruit-like breath odor;headache;increased hunger;increased thirst;increased urination;loss of appetite;nausea and vomiting;skin rash or itching;sweating;swelling of the feet or lower legs;troubled breathing;unexplained weight loss;unsteadiness or awkwardness;unusual tiredness or weakness;weakness in the arms, hands, legs, or feet;yellow eyes or skin;chest pain;chills;cough;fainting;general feeling of discomfort or illness;irregular heartbeat, recurrent;thickening of bronchial secretions;blurred vision or other changes in vision;decreased appetite;diarrhea;difficulty having a bowel movement (stool);heartburn;pain or discomfort in the chest, upper stomach, or throat;seeing flashes or sparks of light",,,,,,,,
29,29,Docefrez,,,,,,,,,,,"burning, numbness, tingling, or pain in the arms, hands, legs, or feet;swelling of the stomach, face, fingers, hands, feet, or lower legs;unusual tiredness or weakness;weight gain;black, tarry stools;blood in the urine or stools;cough or hoarseness (accompanied by fever or chills);difficult or labored breathing;difficult or painful urination (accompanied by fever or chills);difficulty with swallowing;dizziness;fast heartbeat;fever or chills;hives or skin rash;itching, puffiness, or swelling of the eyelids or around the eyes, face, lips, or tongue;lower back or side pain (accompanied by fever or chills);noisy, rattling breathing;pinpoint red spots on the skin;red, scaly, swollen, or peeling areas of the skin (severe);tightness in the chest;troubled breathing while at rest;unusual bleeding or bruising;chest pain or discomfort;decreased blood pressure;fast or irregular heartbeat;increased blood pressure;congestion;diarrhea;dryness or soreness of the throat;nausea;skin rash or redness (mild);sores or ulcers on the lips or tongue or inside the mouth;weakness in the arms, hands, legs, or feet;bloody nose;body aches or pain;change in the color of the fingernails or toenails;dry, red, hot, or irritated skin at the injection site;headache;hoarseness;loosening or loss of the fingernails or toenails, sometimes painful;pain in the joints or muscles;pain, swelling, or lump under the skin at the injection site;runny nose;tender, swollen glands in the neck;voice changes;vomiting;burning, dry, or itching eyes;burning upper abdominal or stomach pain;confusion;difficulty having a bowel movement (stool);discharge from the eyes;excessive tearing;pain and redness of the skin at the place of earlier radiation treatment;rapid breathing;redness, pain, or swelling of the eye, eyelid, or inner lining of the eyelid;sunken eyes;tearing of the eyes;wrinkled skin",,,,,,,,
30,30,Ethyol,,,,,,,,,,,"blurred vision;confusion;dizziness, faintness, or lightheadedness when getting up from a lying or sitting position suddenly;fainting or loss of consciousness;fast or irregular breathing;itching;nausea and vomiting;red, scaly, swollen, or peeling areas of the skin;skin rash;sweating;swelling of the eyes or eyelids;tightness in the chest;trouble with breathing;unusual tiredness or weakness;wheezing;abdominal cramps;blistering, peeling, or loosening of the skin;burning or tingling sensation;chills;convulsions;cough;cracks in the skin;diarrhea;difficulty in breathing;fast, slow, or irregular heartbeat or pulse;fever;joint or muscle pain;loss of bladder control;loss of heat from the body;muscle cramps in the hands, arms, feet, legs, or face;muscle spasm or jerking of all extremities;no blood pressure or pulse;numbness and tingling around the mouth, fingertips, or feet;palpitations;red irritated eyes;red skin lesions, often with a purple center;shortness of breath;sore throat;sores, ulcers, or white spots in the mouth or on the lips;stopping of the heart;sudden loss of consciousness;tremor;unconsciousness;difficulty in swallowing;hives or welts;hoarseness;slow or irregular breathing;feeling unusually warm or cold;flushing or redness of the face or neck;headache;hiccups;nervousness;pounding in the ears;sleepiness (severe);sneezing",,,,,,,,
31,31,Keytruda,,,,,,,,,,,"bloating or swelling of the face, arms, hands, lower legs, or feet;body aches or pain;chills;constipation;cough;depressed mood;difficulty with breathing;difficulty with moving;dry skin and hair;ear congestion;feeling cold;fever;hair loss;headache;hoarseness or husky voice;loss of voice;muscle cramps, pain, and stiffness;pain in the joints;pale skin;rapid weight gain;runny or stuffy nose;slowed heartbeat;sneezing;sore throat;tingling of the hands or feet;trouble breathing;troubled breathing with exertion;unusual bleeding or bruising;unusual tiredness or weakness;unusual weight gain or loss;chest pain;general feeling of discomfort or illness;nervousness;pain;sensitivity to heat;stomach cramps;sweating;tenderness;thickening of bronchial secretions;trouble sleeping;watery or bloody diarrhea;weight loss;back, leg, or stomach pains;bleeding gums;blurred vision or other change in vision;cracks in the skin;darkened urine;difficulty with moving;drowsiness;eye pain;fast heartbeat;general body swelling;general tiredness and weakness;indigestion;light-colored stools;loss of appetite;loss of heat from the body;nausea or vomiting;nosebleeds;pain, swelling, or redness in the joints;pains in the stomach, side, or abdomen, possibly radiating to the back;pale skin;red, swollen skin;redness of the eye;scaly skin;seizures;sensitivity of the eye to light;sore throat;tearing;upper right abdominal or stomach pain;yellow eyes and skin;decreased appetite;diarrhea;dizziness;headache;rash",,,,,,,,
32,32,Onxol,,,,,,,,,,,"black or tarry stools;blurred vision;burning, numbness, tingling, or painful sensations;confusion;cough or hoarseness with fever or chills;dizziness, faintness, or lightheadedness when getting up suddenly from a lying or sitting position;feeling of warmth;fever or chills;lower back or side pain;painful or difficult urination;pale skin;redness of the face, neck, arms, and occasionally, upper chest;shortness of breath;skin rash or itching;sore throat;sweating;troubled breathing with exertion;ulcers, sores, or white spots in the mouth;unsteadiness or awkwardness;unusual bleeding or bruising;unusual tiredness or weakness;weakness in the arms, hands, legs, or feet;blood in the urine or stools;difficult or labored breathing;pinpoint red spots on the skin;shortness of breath (severe);slow heartbeat;tightness in the chest;wheezing;anxiety;blue lips, fingernails, or skin;difficult or troubled breathing;fainting;fast heartbeat;irregular, fast or slow, or shallow breathing;sudden shortness of breath;bleeding, blistering, burning, coldness, discoloration of the skin, feeling of pressure, hives, infection, inflammation, itching, lumps, numbness, pain, rash, redness, scarring, soreness, stinging, swelling, tenderness, tingling, ulceration, or warmth at the injection site;cracked lips;diarrhea;difficulty with swallowing;hair loss;nausea or vomiting;numbness, burning, or tingling in the hands or feet;pain in the joints or muscles, especially in the arms or legs;thinning of the hair;or",,,,,,,,
