33,33,Photofrin,,,,,,,,,,,"bladder pain;bloody or cloudy urine;blurred vision;body aches or pain;chest pain or discomfort;confusion;congestion;cough;coughing or spitting up blood;difficult or troubled breathing;difficult, burning, or painful urination;difficulty with swallowing;dilated neck veins;dizziness, faintness, or lightheadedness when getting up suddenly from a lying or sitting position;dryness or soreness of the throat;extreme fatigue;fast, pounding, or irregular heartbeat or pulse;fever or chills;frequent urge to urinate;headache;hoarseness;increased sensitivity of the skin to sunlight;irregular, fast or slow, or shallow breathing;itching;lower back or side pain;nervousness;pale or blue lips, fingernails, or skin;pale skin;pounding in the ears;redness or other discoloration of the skin;runny nose;severe pain in the chest;severe sunburn;skin rash;slow or fast heartbeat;sneezing;sore throat;sudden onset of severe breathing difficulty;sweating;swelling of the face, fingers, feet, or lower legs;tender, swollen glands in the neck;tightness in the chest;unusual bleeding or bruising;unusual tiredness or weakness;voice changes;vomiting of blood or material that looks like coffee grounds;weight gain;white patches in the mouth or throat or on the tongue;white patches with diaper rash;bloody, black, or tarry stools;decrease in the amount of urine;decreased urination;dry mouth;fainting;heartburn;increase in heart rate;noisy, rattling breathing;pain or burning in the throat;rapid breathing;shortness of breath;sores, ulcers, or white spots on the lips or tongue or inside the mouth;sunken eyes;thirst;troubled breathing at rest;vomiting;wrinkled skin;acid or sour stomach;back pain;belching;constipation;diarrhea;fear or nervousness;indigestion;lack or loss of strength;loss of appetite;nausea;pain;sleeplessness;stomach discomfort, upset, or pain;trouble sleeping;unable to sleep;weight loss;bloated or full feeling;change in the color of treated skin;excess air or gas in the stomach;increased hair growth;small lumps under the skin",,,,,,,,
34,34,Tagrisso,,,,,,,,,,,"anxiety;cough;dizziness, lightheadedness, or fainting;eye or vision changes;fast, pounding, or uneven heartbeat;pain in the chest, groin, or legs, especially the calves;pain, redness, or swelling in the arm or leg;shortness of breath or troubled breathing;slurred speech;sudden loss of coordination;sudden, severe headache;sudden, severe weakness or numbness in the arm or leg;blurred vision;fever or chills;general feeling of discomfort or illness;inability to speak;seizures;sneezing;sore throat;sudden, severe weakness on one side of the body;temporary blindness;thickening of bronchial secretions;back pain;changes in the fingernails or toenails, including brittleness, inflammation, pain, redness, tenderness, separation from nail bed, or shedding of nails;constipation;decreased appetite;diarrhea;headache;nausea;skin rash, dryness, or itching;swelling or inflammation of the mouth;unusual tiredness or weakness",,,,,,,,
35,35,Zykadia,,,,,,,,,,,"abdominal or stomach pain or tenderness;blurred vision;burning, crawling, itching, numbness, prickling, ""pins and needles"", or tingling feelings;clay colored stools;dark urine;decreased appetite;dry mouth;fever;flushed, dry skin;fruit-like breath odor;headache;increased hunger;increased thirst;increased urination;loss of appetite;nausea and vomiting;skin rash or itching;sweating;swelling of the feet or lower legs;troubled breathing;unexplained weight loss;unsteadiness or awkwardness;unusual tiredness or weakness;weakness in the arms, hands, legs, or feet;yellow eyes or skin;chest pain;chills;cough;fainting;general feeling of discomfort or illness;irregular heartbeat, recurrent;thickening of bronchial secretions;blurred vision or other changes in vision;decreased appetite;diarrhea;difficulty having a bowel movement (stool);heartburn;pain or discomfort in the chest, upper stomach, or throat;seeing flashes or sparks of light",,,,,,,,
36,36,amifostine,,,,,,,,,,,"blurred vision;confusion;dizziness, faintness, or lightheadedness when getting up from a lying or sitting position suddenly;fainting or loss of consciousness;fast or irregular breathing;itching;nausea and vomiting;red, scaly, swollen, or peeling areas of the skin;skin rash;sweating;swelling of the eyes or eyelids;tightness in the chest;trouble with breathing;unusual tiredness or weakness;wheezing;abdominal cramps;blistering, peeling, or loosening of the skin;burning or tingling sensation;chills;convulsions;cough;cracks in the skin;diarrhea;difficulty in breathing;fast, slow, or irregular heartbeat or pulse;fever;joint or muscle pain;loss of bladder control;loss of heat from the body;muscle cramps in the hands, arms, feet, legs, or face;muscle spasm or jerking of all extremities;no blood pressure or pulse;numbness and tingling around the mouth, fingertips, or feet;palpitations;red irritated eyes;red skin lesions, often with a purple center;shortness of breath;sore throat;sores, ulcers, or white spots in the mouth or on the lips;stopping of the heart;sudden loss of consciousness;tremor;unconsciousness;difficulty in swallowing;hives or welts;hoarseness;slow or irregular breathing;feeling unusually warm or cold;flushing or redness of the face or neck;headache;hiccups;nervousness;pounding in the ears;sleepiness (severe);sneezing",,,,,,,,
37,37,capecitabine,,,,,,,,,,,"abdominal or stomach pain;diarrhea;nausea;numbness, pain, tingling, or other unusual sensations in the palms of the hands or bottoms of the feet;pain, blistering, peeling, redness, or swelling of the palms of the hands or bottoms of the feet;pain, redness, swelling, sores, or ulcers in your mouth or on your lips;unusual tiredness or weakness;vomiting;abdominal or stomach cramping or pain (severe);agitation;back pain;bleeding and bruising;bleeding gums;blood in the urine or stools;bloody nose;bloody or black, tarry stools;blurred vision;burning, dry, or itching eyes;chest pain;chills;clumsiness or unsteadiness;cold;collapse;coma;confusion;constipation;convulsions;cough or hoarseness (accompanied by fever or chills);cough producing mucus;coughing or spitting up blood;dark urine;decreased frequency or amount of urine;difficulty with breathing;difficulty with swallowing or pain in the back of throat or chest when swallowing;discharge from the eyes;drowsiness;dry mouth;excessive tearing;extra heartbeats;eye redness, irritation, or pain;fainting;fast or irregular heartbeat;fever or chills;flu-like symptoms;hallucinations;headache, sudden and severe;heavier menstrual periods;high fever;hot, red skin on the feet or legs;inability to speak;increased menstrual flow or vaginal bleeding;increased thirst;irritability;itching in the genital or other skin areas;lightheadedness;light-colored stools;loss of consciousness;lower back or side pain (accompanied by fever or chills);muscle aches or cramps;muscle spasms;nosebleeds;numbness or tingling in the hands, feet, or lips;painful or difficult urination (accompanied by fever or chills);painful, swollen feet or legs;pain, tenderness, or swelling in the upper abdominal or stomach area;pale skin;paralysis;pinpoint red spots on the skin;problems with coordination;prolonged bleeding from cuts;rapid, shallow breathing;red or dark brown urine;redness, pain, or swelling of the eye, eyelid, or inner lining of the eyelid;scaling;seizures;severe constipation;skin rash or itching;slow or irregular heartbeat;slurred speech;sneezing, sore throat, or stuffy nose;sores, ulcers, or white spots on the lips or in the mouth;stiff neck;stomach bloating, burning, or cramping;swelling of the face, fingers, feet, or lower legs;swelling of the lymph nodes;swollen glands;temporary blindness;tiredness or weakness;trouble with speaking;troubled breathing or tightness in the chest;unexplained nosebleeds;unusual bleeding or bruising;unusual lump or swelling in the chest;vomiting blood or material that looks like coffee grounds;weakness in the arm or leg on one side of the body, sudden and severe;weight gain or loss;white patches in the mouth or throat or on the tongue;white patches with diaper rash;yellow eyes or skin;burning, crawling, itching, numbness, prickling, pins and needles, or tingling feelings;changes or discoloration in the fingernails or toenails;difficulty with moving;discouragement;dizziness;headache;heartburn;increased sensitivity of the skin to sunlight;muscle pain;pain;pain and redness of the skin at the place of x-ray treatment;pain in the joints or limbs;red, sore eyes;sunken eyes;thirst;trouble sleeping;weakness;wrinkled skin;bone pain;change in color of treated skin;difficulty with walking;discouragement;feeling of constant movement of self or surroundings;feeling sad or empty;full or bloated feeling or pressure in the stomach;general feeling of discomfort or illness;hot flushes;impaired balance;increased sweating;joint pain;lack of appetite;loss of interest or pleasure;muscle weakness;noisy breathing;pain in the rectum;pain, swelling, or redness in the joints;passing less gas;rough, scratchy sound to voice;runny nose;sensation of spinning;shakiness in the legs, arms, hands, or feet;shivering;sores on the skin;swelling of abdominal or stomach area;tremor or shaking of the hands or feet;trouble concentrating;voice changes",,,,,,,,
38,38,cetuximab,,,,,,,,,,,"blemishes on the skin or pimples;bloating or swelling of the face, arms, hands, lower legs, or feet;body aches or pain;chills;congestion;cough or hoarseness;deep cracks, grooves, or lines in the skin;difficult or labored breathing;dizziness;facial swelling;fever;headache;lower back or side pain;nausea;painful or difficult urination;pale skin;rapid weight gain;runny nose;severe dry skin;shortness of breath;skin rash;tender, swollen glands in the neck;tightness in the chest;tingling of the hands or feet;trouble with breathing on exertion;trouble with swallowing;unusual bleeding or bruising;unusual tiredness or weakness;unusual weight gain or loss;voice changes;vomiting;weakness;wheezing;anxiety;black, tarry stools;chest pain;confusion;decreased urination;dry mouth;fainting;fast heartbeat;increase in heart rate;lightheadedness;rapid, shallow breathing;sore throat;sores, ulcers, or white spots on the lips or in the mouth;sunken eyes;swollen glands;thirst;wrinkled skin;acid or sour stomach;belching;burning, dry, or itching eyes;diarrhea;difficulty having a bowel movement (stool);discharge from the eye;discoloration of the fingernails or toenails;discouragement;excessive tearing;feeling sad or empty;hair loss or thinning of the hair;heartburn;indigestion;irritability;itching skin;lack or loss of appetite;lack or loss of strength;loss of interest or pleasure;pain;redness, pain, or swelling of the eye, eyelid, or inner lining of the eyelid;sleeplessness;stomach discomfort, upset, or pain;swelling or inflammation of the mouth;trouble concentrating;trouble sleeping;unable to sleep;or",,,,,,,,
39,39,Cyramza,,,,,,,,,,,"back pain or spasms;blurred vision;burning, crawling, itching, numbness, prickling, ""pins and needles"", or tingling feelings;chest pain;chills;confusion;convulsions;decreased urine output;dizziness, faintness, or lightheadedness when getting up suddenly from a lying or sitting position;fainting;fast, pounding, or irregular heartbeat or pulse;feeling of warmth;feeling unusually cold;headache;increased thirst;muscle pain or cramps;nausea or vomiting;nervousness;pounding in the ears;redness of the face, neck, arms, and occasionally, upper chest;shakiness in the legs, arms, hands, or feet;shivering;sweating;swelling of the face, ankles, or hands;trembling or shaking of the hands or feet;unusual tiredness or weakness;abdominal or stomach pain, cramping, or burning;bleeding gums;bloody nose;cough;coughing up blood;difficulty with breathing or swallowing;dizziness;fever;inability to speak;increased menstrual flow or vaginal bleeding;low blood pressure or pulse;lower back or side pain;nosebleeds;pain in the chest, groin, or legs, especially calves of the legs;pain or discomfort in the arms, jaw, back, or neck;painful or difficult urination;pale skin;paralysis;prolonged bleeding from cuts;red or black, tarry stools;red or dark brown urine;severe constipation;severe headaches of sudden onset;severe numbness, especially on one side of the face or body;slurred speech;sore throat;sudden loss of coordination;sudden onset of shortness of breath for no apparent reason;sudden onset of slurred speech;sudden vision changes;sweating;temporary blindness;ulcers, sores, or white spots in the mouth;unconsciousness;unusual bleeding or bruising;vomiting of material that looks like coffee grounds, severe and continuing;diarrhea",,,,,,,,
40,40,paclitaxel protein-bound,,,,,,,,,,,"black, tarry stools;bloating or swelling of the face, arms, hands, lower legs, or feet;blurred or double vision;chest pain;chills;cough;fever;loss of taste;lower back or side pain;painful or difficult urination;pale skin;rapid weight gain;sneezing;sore mouth, tongue, or throat;tightness in the chest;tingling of the hands or feet;troubled breathing with exertion;ulcers, sores, or white spots in the mouth;unusual bleeding or bruising;unusual weight gain or loss;unusual tiredness or weakness;anxiety;bleeding;blood in the urine or stools;burning, tingling, numbness or pain in the hands, arms, feet, or legs;confusion;difficulty with swallowing;dizziness, faintness, or lightheadedness when getting up suddenly from a lying or sitting position;fast, pounding, slow, or irregular heartbeat or pulse;general feeling of discomfort or illness;inability to move the arms, legs, or facial muscles;inability to speak;pain in the chest, groin, or legs, especially the calves;pinpoint red spots on the skin;rapid, shallow breathing;sensation of pins and needles;severe, sudden headache;skin itching, rash, or redness;slurred or slow speech;stabbing pain;sudden loss of coordination;sudden, severe weakness or numbness in the arms or legs;sudden, unexplained shortness of breath;sweating;swelling of the face, throat, or tongue;thickening of bronchial secretions;trouble thinking or walking;cracked lips;decreased appetite;diarrhea;difficulty with moving;headache;lack or loss of strength;loss of hair;muscle pain or stiffness;nausea;pain in the joints;swelling;vomiting;bleeding, blistering, burning, coldness, discoloration of the skin, a feeling of pressure, hives, infection, inflammation, itching, lumps, numbness, pain, rash, redness, scarring, soreness, stinging, swelling, tenderness, tingling, ulceration, or warmth at the injection site;nail changes",,,,,,,,
41,41,porfimer,,,,,,,,,,,"bladder pain;bloody or cloudy urine;blurred vision;body aches or pain;chest pain or discomfort;confusion;congestion;cough;coughing or spitting up blood;difficult or troubled breathing;difficult, burning, or painful urination;difficulty with swallowing;dilated neck veins;dizziness, faintness, or lightheadedness when getting up suddenly from a lying or sitting position;dryness or soreness of the throat;extreme fatigue;fast, pounding, or irregular heartbeat or pulse;fever or chills;frequent urge to urinate;headache;hoarseness;increased sensitivity of the skin to sunlight;irregular, fast or slow, or shallow breathing;itching;lower back or side pain;nervousness;pale or blue lips, fingernails, or skin;pale skin;pounding in the ears;redness or other discoloration of the skin;runny nose;severe pain in the chest;severe sunburn;skin rash;slow or fast heartbeat;sneezing;sore throat;sudden onset of severe breathing difficulty;sweating;swelling of the face, fingers, feet, or lower legs;tender, swollen glands in the neck;tightness in the chest;unusual bleeding or bruising;unusual tiredness or weakness;voice changes;vomiting of blood or material that looks like coffee grounds;weight gain;white patches in the mouth or throat or on the tongue;white patches with diaper rash;bloody, black, or tarry stools;decrease in the amount of urine;decreased urination;dry mouth;fainting;heartburn;increase in heart rate;noisy, rattling breathing;pain or burning in the throat;rapid breathing;shortness of breath;sores, ulcers, or white spots on the lips or tongue or inside the mouth;sunken eyes;thirst;troubled breathing at rest;vomiting;wrinkled skin;acid or sour stomach;back pain;belching;constipation;diarrhea;fear or nervousness;indigestion;lack or loss of strength;loss of appetite;nausea;pain;sleeplessness;stomach discomfort, upset, or pain;trouble sleeping;unable to sleep;weight loss;bloated or full feeling;change in the color of treated skin;excess air or gas in the stomach;increased hair growth;small lumps under the skin",,,,,,,,
42,42,Alecensa,,,,,,,,,,,"chest pain or discomfort;cough;difficulty with moving;joint pain;lightheadedness, dizziness, or fainting;muscle aching or cramping;muscle pains or stiffness;shortness of breath;slow or irregular heartbeat;swollen joints;unusual tiredness;abdominal pain or tenderness;clay colored stools;dark urine;decreased appetite;fever;headache;itching or skin rash;loss of appetite;nausea and vomiting;swelling of the feet or lower legs;yellow eyes or skin;difficult breathing;fever;back pain;bloating or swelling of the face, arms, hands, lower legs, or feet;blurred vision;difficulty having a bowel movement (stool);double vision;lack or loss of strength;rapid weight gain;rash with flat lesions or small raised lesions on the skin;seeing double;seeing floating dark spots or material before the eyes;swelling around the eyes;tingling of the hands or feet;unusual weight gain or loss;vision changes",,,,,,,,
43,43,alectinib,,,,,,,,,,,"chest pain or discomfort;cough;difficulty with moving;joint pain;lightheadedness, dizziness, or fainting;muscle aching or cramping;muscle pains or stiffness;shortness of breath;slow or irregular heartbeat;swollen joints;unusual tiredness;abdominal pain or tenderness;clay colored stools;dark urine;decreased appetite;fever;headache;itching or skin rash;loss of appetite;nausea and vomiting;swelling of the feet or lower legs;yellow eyes or skin;difficult breathing;fever;back pain;bloating or swelling of the face, arms, hands, lower legs, or feet;blurred vision;difficulty having a bowel movement (stool);double vision;lack or loss of strength;rapid weight gain;rash with flat lesions or small raised lesions on the skin;seeing double;seeing floating dark spots or material before the eyes;swelling around the eyes;tingling of the hands or feet;unusual weight gain or loss;vision changes",,,,,,,,
44,44,cyclophosphamide,,,,,,,,,,,"cough or hoarseness;fever or chills;lower back or side pain;missing menstrual periods;painful or difficult urination;blood in the urine;dizziness, confusion, or agitation;fast heartbeat;joint pain;shortness of breath;swelling of the feet or lower legs;unusual tiredness or weakness;black, tarry stools;pinpoint red spots on the skin;unusual bleeding or bruising;frequent urination;redness, swelling, or pain at the injection site;sores in the mouth and on the lips;sudden shortness of breath;unusual thirst;yellow eyes or skin;darkening of the skin and fingernails;loss of appetite;nausea or vomiting;diarrhea;flushing or redness of the face;headache;increased sweating;skin rash, hives, or itching;stomach pain;swollen lips;or",,,,,,,,
45,45,ramucirumab,,,,,,,,,,,"back pain or spasms;blurred vision;burning, crawling, itching, numbness, prickling, ""pins and needles"", or tingling feelings;chest pain;chills;confusion;convulsions;decreased urine output;dizziness, faintness, or lightheadedness when getting up suddenly from a lying or sitting position;fainting;fast, pounding, or irregular heartbeat or pulse;feeling of warmth;feeling unusually cold;headache;increased thirst;muscle pain or cramps;nausea or vomiting;nervousness;pounding in the ears;redness of the face, neck, arms, and occasionally, upper chest;shakiness in the legs, arms, hands, or feet;shivering;sweating;swelling of the face, ankles, or hands;trembling or shaking of the hands or feet;unusual tiredness or weakness;abdominal or stomach pain, cramping, or burning;bleeding gums;bloody nose;cough;coughing up blood;difficulty with breathing or swallowing;dizziness;fever;inability to speak;increased menstrual flow or vaginal bleeding;low blood pressure or pulse;lower back or side pain;nosebleeds;pain in the chest, groin, or legs, especially calves of the legs;pain or discomfort in the arms, jaw, back, or neck;painful or difficult urination;pale skin;paralysis;prolonged bleeding from cuts;red or black, tarry stools;red or dark brown urine;severe constipation;severe headaches of sudden onset;severe numbness, especially on one side of the face or body;slurred speech;sore throat;sudden loss of coordination;sudden onset of shortness of breath for no apparent reason;sudden onset of slurred speech;sudden vision changes;sweating;temporary blindness;ulcers, sores, or white spots in the mouth;unconsciousness;unusual bleeding or bruising;vomiting of material that looks like coffee grounds, severe and continuing;diarrhea",,,,,,,,
46,46,atezolizumab,,,,,,,,,,,"bladder pain;bloating or swelling of the face, arms, hands, lower legs, or feet;bloody or cloudy urine;constipation;cough or hoarseness;difficult, burning, or painful urination;fever or chills;frequent urge to urinate;general tiredness and weakness;loss of appetite;lower back or side pain;nausea or vomiting;pain;painful or difficult urination;rapid weight gain;stomach cramps;tenderness;tingling of the hands or feet;unusual weight gain or loss;watery or bloody diarrhea;chest pain;dark urine;depressed mood;dizziness;dry skin and hair;facial swelling;feeling cold;general feeling of discomfort or illness;hair loss;headache;hoarseness or husky voice;light-colored stools;muscle cramps and stiffness;nervousness;sensitivity to heat;skin rash;slowed heartbeat;sweating;thickening of bronchial secretions;trouble sleeping;troubled breathing;unusual tiredness or weakness;upper right abdominal or stomach pain;weakness;yellow eyes and skin;burning, tingling, numbness or pain in the hands, arms, feet, or legs;confusion;difficulty with chewing, swallowing, or talking;double vision;drooping eyelids;drowsiness;headache;inability to move the arms and legs;irritability;muscle weakness;seizures;sensation of pins and needles;severe headache;severe tiredness;stabbing pain;stiff neck or back;sudden numbness and weakness in the arms and legs;bloating;darkening of the skin;diarrhea;fainting;fast heartbeat;indigestion;pains in the stomach, side, or abdomen, possibly radiating to the back;blurred vision;dry mouth;flushed, dry skin;fruit-like breath odor;increased hunger;increased thirst;increased urination;sweating;back or neck pain;itching skin;pain in the joints",,,,,,,,
47,47,necitumumab,,,,,,,,,,,"abdominal or stomach cramps;confusion;convulsions;decreased urine;difficulty with breathing;drowsiness;dry mouth;increased thirst;irregular heartbeat;loss of appetite;mood or mental changes;muscle cramps in the hands, arms, feet, legs, or face;muscle pain or muscle spasms (tetany) or twitching;nausea or vomiting;numbness and tingling around the mouth, fingertips, or feet;tremor;unusual tiredness or weakness;anxiety;back pain;chest pain or discomfort;chest tightness;chills;cough;difficulty with speaking;dizziness or lightheadedness;double vision;fainting;fast heartbeat;fever;flushing;headache;heart stops;inability to move the arms, legs, or facial muscles;no breathing;no pulse or blood pressure;pain or discomfort in the arms, jaw, back, or neck;pain, redness, or swelling in the arm or leg;pains in the chest, groin, or legs, especially the calves of the legs;severe headaches of sudden onset;slow speech;sudden loss of coordination;sudden onset of slurred speech;sudden shortness of breath or troubled breathing;sudden vision changes;sweating;trouble breathing;unconscious;blemishes on the skin;burning, dry, or itching eyes;decreased weight;diarrhea;discharge or excessive tearing;dry skin;itching skin or rash;loosening of the fingernails;pimples;rash with flat lesions or small raised lesions on the skin;redness or soreness around the fingernails;redness, pain, or swelling of the eye, eyelid, or inner lining of the eyelid;swelling or inflammation of the mouth",,,,,,,,
48,48,osimertinib,,,,,,,,,,,"anxiety;cough;dizziness, lightheadedness, or fainting;eye or vision changes;fast, pounding, or uneven heartbeat;pain in the chest, groin, or legs, especially the calves;pain, redness, or swelling in the arm or leg;shortness of breath or troubled breathing;slurred speech;sudden loss of coordination;sudden, severe headache;sudden, severe weakness or numbness in the arm or leg;blurred vision;fever or chills;general feeling of discomfort or illness;inability to speak;seizures;sneezing;sore throat;sudden, severe weakness on one side of the body;temporary blindness;thickening of bronchial secretions;back pain;changes in the fingernails or toenails, including brittleness, inflammation, pain, redness, tenderness, separation from nail bed, or shedding of nails;constipation;decreased appetite;diarrhea;headache;nausea;skin rash, dryness, or itching;swelling or inflammation of the mouth;unusual tiredness or weakness",,,,,,,,
